arnaldobranco,15/09/2015 23:55:56,O facebook tinha que lançar o botão Nem convida,64,0.0,0.0,Unknown,Unknown,Unknown,Unknown,Unknown
arnaldobranco,15/09/2015 13:10:34,"Saiu a segunda parte da minha HQ """"Minhas férias na fazenda evangélicas"""" no projeto Nébula https://t.co/igWJd9gbII http://t.co/mgGeFU6SQ7",8,0.0,0.0,Unknown,Unknown,Unknown,Unknown,Unknown
arnaldobranco,15/09/2015 12:28:59,Vai ser irônico se o governo Dilma acabar por excesso de preocupação com a governabilidade,28,0.0,0.0,Unknown,Unknown,Unknown,Unknown,Unknown
arnaldobranco,14/09/2015 12:03:55,Mundinho animal http://t.co/IDd1lcc27R,47,0.0,0.0,Unknown,Unknown,Unknown,Unknown,Unknown
arnaldobranco,10/09/2015 13:57:41,Tem uns freaks que aposto que ficam acariciando avatar com o cursor,4,0.0,0.0,Unknown,Unknown,Unknown,Unknown,Unknown
arnaldobranco,10/09/2015 11:21:56,Esquete: ladrão vai pra cadeia e de repente surge um comitê de boas vindas por ele ser o milionésimo preso do sistema carcerário brasileiro,16,0.0,0.0,Unknown,Unknown,Unknown,Unknown,Unknown
arnaldobranco,09/09/2015 21:22:53,Toda vez que apple lança alguma coisa me sinto menos retardado por comprar todos os modelos de camisa do Flamengo,49,0.0,0.0,Unknown,Unknown,Unknown,Unknown,Unknown
arnaldobranco,09/09/2015 03:37:06,"Deportee, clássico do Woody Guthrie (na voz do seu filho Arlo) sobre imigrantes ilegais de outra época https://t.co/ZaB6dHkN2j",1,0.0,0.0,Unknown,Unknown,Unknown,Unknown,Unknown
arnaldobranco,08/09/2015 21:26:06,"Nesse tempo de escrotidão tem que ser muito filho da puta pra se destacar, parabéns repórter húngara que deu banda em refugiado",48,0.0,0.0,Unknown,Unknown,Unknown,Unknown,Unknown
arnaldobranco,07/09/2015 15:14:24,Bom dia pra lembrar a charge do Jaguar que valeu a prisão de quase toda a redação do Pasquim http://t.co/5t35dehJJ6,197,0.0,0.0,Unknown,Unknown,Unknown,Unknown,Unknown
arnaldobranco,07/09/2015 12:41:01,Tem uns caras que com certeza ficam lendo os próprios tweets em voz alta,6,0.0,0.0,Unknown,Unknown,Unknown,Unknown,Unknown
arnaldobranco,07/09/2015 11:44:30,Mundinho animal http://t.co/NS7nZEkOtv,117,0.0,0.0,Unknown,Unknown,Unknown,Unknown,Unknown
arnaldobranco,07/09/2015 01:16:47,"Pelé calado é um poeta, Zico sem se meter em política é um estadista",15,0.0,0.0,Unknown,Unknown,Unknown,Unknown,Unknown
arnaldobranco,06/09/2015 11:25:15,"O pessoal adota várias causas e depois abandona, parece eu com rede social",11,0.0,0.0,Unknown,Unknown,Unknown,Unknown,Unknown
arnaldobranco,03/09/2015 22:46:31,Às vezes estou trabalhando e penso como seria bom se um imigrante ilegal roubasse o meu emprego,55,0.0,0.0,Unknown,Unknown,Unknown,Unknown,Unknown
arnaldobranco,03/09/2015 00:54:53,A torcida do Vasco tinha que fazer um Eurico inflável,205,0.0,0.0,Unknown,Unknown,Unknown,Unknown,Unknown
arnaldobranco,02/09/2015 21:28:25,O Wagner Moura também teve que aguentar umas duzentas novelas com carioca imitando sotaque baiano,571,0.0,0.0,Unknown,Unknown,Unknown,Unknown,Unknown
arnaldobranco,02/09/2015 20:51:30,Essa treta do deboísmo mostra que o pessoal leva a sério até piada sem graça,69,0.0,0.0,Unknown,Unknown,Unknown,Unknown,Unknown
arnaldobranco,02/09/2015 16:02:19,"""""G4 é obrigação"""" Sou da época em que era prêmio de consolação",6,0.0,0.0,Unknown,Unknown,Unknown,Unknown,Unknown
arnaldobranco,02/09/2015 15:03:29,"""""Minhas férias na fazenda evangélica"""", HQ sobre uma experiência traumática no projeto Nébula http://t.co/y9jPJuQYWT http://t.co/GjZhfn3rmo",35,0.0,0.0,Unknown,Unknown,Unknown,Unknown,Unknown
arnaldobranco,02/09/2015 13:23:44,Marcelo Odebrecht prestou depoimento no sofá da Hebe http://t.co/ld9C6s66Ah,187,0.0,0.0,Unknown,Unknown,Unknown,Unknown,Unknown
arnaldobranco,01/09/2015 14:57:31,"Estou no excelente projeto Nébula com uma HQ autobiográfica: """"Minhas férias na fazenda evangélica"""" https://t.co/niPtjvk6gh",4,0.0,0.0,Unknown,Unknown,Unknown,Unknown,Unknown
arnaldobranco,01/09/2015 00:58:27,De boas aqui pronto para assistir A Regra do Jogo https://t.co/RTDV14SWHs,1,0.0,0.0,Unknown,Unknown,Unknown,Unknown,Unknown
arnaldobranco,31/08/2015 23:54:08,"Opa, amigos, falta pouco pro livro do @coiote4fun sair, vamos abrir nossos corações e carteiras https://t.co/UhMT7lIYjm",1,0.0,0.0,Unknown,Unknown,Unknown,Unknown,Unknown
arnaldobranco,31/08/2015 22:43:16,A volta da Escolinha do Professor Raimundo foi ofuscada pelas eleições de São Paulo,13,0.0,0.0,Unknown,Unknown,Unknown,Unknown,Unknown
arnaldobranco,31/08/2015 18:28:09,A matéria do casal que largou tudo para viver viajando e acabou lavando privada deve estar enfeitando muita baia de trabalhador ressentido,24,0.0,0.0,Unknown,Unknown,Unknown,Unknown,Unknown
arnaldobranco,31/08/2015 17:41:36,O twitter gosta muito de celebridades que usam gíria de twitter,11,0.0,0.0,Unknown,Unknown,Unknown,Unknown,Unknown
arnaldobranco,31/08/2015 12:17:22,Mundinho animal http://t.co/pkzxgB8tCY,73,0.0,0.0,Unknown,Unknown,Unknown,Unknown,Unknown
arnaldobranco,27/08/2015 14:06:15,"O que gosto mais nesse anúncio em que um cano de descarga atira uma bola de caspa pro Cristiano Ronaldo cabecear é a legenda """"dramatização""""",45,0.0,0.0,Unknown,Unknown,Unknown,Unknown,Unknown
arnaldobranco,26/08/2015 16:36:54,Sabatina do Janot lembrando a entrevista de emprego do Monty Python https://t.co/DQRTVJd5HN,20,0.0,0.0,Unknown,Unknown,Unknown,Unknown,Unknown
arnaldobranco,26/08/2015 12:33:50,Queima de estoque http://t.co/f7twi3sZSs,277,0.0,0.0,Unknown,Unknown,Unknown,Unknown,Unknown
arnaldobranco,25/08/2015 23:01:06,Graças ao facebook descobri que posso não ter absolutamente nada em comum com uma pessoa a não ser 129 amigos,40,0.0,0.0,Unknown,Unknown,Unknown,Unknown,Unknown
arnaldobranco,25/08/2015 21:55:21,Com apenas seu documento de identidade você está apto a ter uma coluna na grande imprensa,12,0.0,0.0,Unknown,Unknown,Unknown,Unknown,Unknown
arnaldobranco,25/08/2015 20:08:50,Na vida do frila qualquer dia pode ser fim do mês,16,0.0,0.0,Unknown,Unknown,Unknown,Unknown,Unknown
arnaldobranco,24/08/2015 11:13:56,Mundinho animal http://t.co/TQtwGWIoXs,45,0.0,0.0,Unknown,Unknown,Unknown,Unknown,Unknown
arnaldobranco,23/08/2015 16:04:22,Matéria do grande Calbuque sobre a adaptação que eu e o Guazzelli fizemos para Vidas Secas http://t.co/PxCo2fDc4D,2,0.0,0.0,Unknown,Unknown,Unknown,Unknown,Unknown
arnaldobranco,23/08/2015 14:44:07,Ideia pra uma camiseta: ✅✅ ESCOLHI IGNORAR,24,0.0,0.0,Unknown,Unknown,Unknown,Unknown,Unknown
arnaldobranco,23/08/2015 00:39:09,"A @NEToficial torna impossível assistir qualquer filme ou série por streaming, deve ter um lobista do pirate bay infiltrado lá",8,0.0,0.0,Unknown,Unknown,Unknown,Unknown,Unknown
arnaldobranco,22/08/2015 21:01:20,As ruínas do Terra Encantada são bem mais assustadoras que a Disneylândia do Banksy https://t.co/zutb1HBodn,7,0.0,0.0,Unknown,Unknown,Unknown,Unknown,Unknown
arnaldobranco,22/08/2015 19:59:30,Alguns dos caras que curtem páginas tipo De Boas isso ou Tranquilão aquilo são os que mais perdem a linha na internet,22,0.0,0.0,Unknown,Unknown,Unknown,Unknown,Unknown
arnaldobranco,22/08/2015 14:50:33,RT @itibancomicshop: Vidas Secas em quadrinhos por @arnaldobranco  e Guazzelli  https://t.co/Vtp3Bw6lu7,0,0.0,0.0,Unknown,Unknown,Unknown,Unknown,Unknown
arnaldobranco,21/08/2015 22:42:14,Rola mais benefício da dúvida pro filho do Pitanguy do que pra ciclovia do Haddad,91,0.0,0.0,Unknown,Unknown,Unknown,Unknown,Unknown
arnaldobranco,20/08/2015 19:26:31,Oswaldo de Oliveira é a diretoria do Flamengo agindo como o marido cansado de ouvir pedido pra jantar fora e levar de sacanagem no Habib's,10,0.0,0.0,Unknown,Unknown,Unknown,Unknown,Unknown
arnaldobranco,20/08/2015 15:40:09,Com essa mania de classe c a gente tá fazendo mais tv mexicana que o México,0,0.0,0.0,Unknown,Unknown,Unknown,Unknown,Unknown
arnaldobranco,20/08/2015 13:15:39,"""""Por aí não!"""" """"Volta, volta!"""" Parece torcida de futebol mas sou eu acompanhando pelo gps o táxi que pedi pelo aplicativo",12,0.0,0.0,Unknown,Unknown,Unknown,Unknown,Unknown
arnaldobranco,20/08/2015 12:37:50,O cara que consegue fumar maconha e seguir uma linha de raciocínio por mim podia trabalhar no cirque du soleil,35,0.0,0.0,Unknown,Unknown,Unknown,Unknown,Unknown
arnaldobranco,20/08/2015 12:08:24,O Flamengo demora pra substituir técnicos que demoram a substituir,9,0.0,0.0,Unknown,Unknown,Unknown,Unknown,Unknown
arnaldobranco,19/08/2015 22:28:52,Amigos curtam a minha página enquanto é de graça https://t.co/G1jes3hnLE,1,0.0,0.0,Unknown,Unknown,Unknown,Unknown,Unknown
arnaldobranco,19/08/2015 21:18:45,A oposição finalmente produziu um candidato mais carismático do que o Lula http://t.co/mkI6HknzWK,41,0.0,0.0,Unknown,Unknown,Unknown,Unknown,Unknown
arnaldobranco,19/08/2015 20:48:50,"Não sei o que é mais decepcionante, sessão histórica do STF ou luta do século no boxe",6,0.0,0.0,Unknown,Unknown,Unknown,Unknown,Unknown
arnaldobranco,19/08/2015 20:12:24,Internet é um lugar as pessoas não acentuam nenhuma palavra a não ser cu,40,0.0,0.0,Unknown,Unknown,Unknown,Unknown,Unknown
arnaldobranco,19/08/2015 19:56:13,"""""Maconha é a porta de entrada pra drogas mais pesadas"""" Os cara achando que droga é videogame",87,0.0,0.0,Unknown,Unknown,Unknown,Unknown,Unknown
arnaldobranco,19/08/2015 19:01:50,"Deus antigo: atirava raio, jogava doença, mandava dilúvio Deus moderno: não aguenta cinco minuto de piada do twitter https://t.co/9HfcGAcN8Z",208,0.0,0.0,Unknown,Unknown,Unknown,Unknown,Unknown
arnaldobranco,19/08/2015 18:38:24,Os caras falam em regulamentar o uso e eu imagino que vão multar quem travar o beque,18,0.0,0.0,Unknown,Unknown,Unknown,Unknown,Unknown
arnaldobranco,19/08/2015 18:10:30,@ronaldrios Essa é ainda mais triste por causa da intenção irônica,0,0.0,0.0,Unknown,Unknown,Unknown,Unknown,Unknown
arnaldobranco,19/08/2015 18:05:47,Tem um pessoal que faz textão de facebook disfarçado de uma caralhada de tweets,24,0.0,0.0,Unknown,Unknown,Unknown,Unknown,Unknown
arnaldobranco,17/08/2015 14:44:49,Um filme político baseado em Mulher nota 1000 que em vez da garota perfeita os caras criam um adversário burro ideal para ganhar num debate,4,0.0,0.0,Unknown,Unknown,Unknown,Unknown,Unknown
arnaldobranco,17/08/2015 11:44:59,Mundinho animal http://t.co/xh0VRBcvir,21,0.0,0.0,Unknown,Unknown,Unknown,Unknown,Unknown
arnaldobranco,16/08/2015 14:18:53,A zaga do Flamengo vai começar a fazer gol contra pra evitar escanteio,6,0.0,0.0,Unknown,Unknown,Unknown,Unknown,Unknown
arnaldobranco,15/08/2015 20:46:49,"Vendo um vídeo de um moleque de quinze anos pra aprender a dar nó em gravata, flagrante o despreparo para a vida adulta",4,0.0,0.0,Unknown,Unknown,Unknown,Unknown,Unknown
arnaldobranco,15/08/2015 14:09:03,"@kamiquase Com certeza, só de ex-namorado sem noção...",0,0.0,0.0,Unknown,Unknown,Unknown,Unknown,Unknown
arnaldobranco,15/08/2015 14:01:28,Dá pra fazer carreira no twitter com piadas que a gente reprovaria na tv aberta,12,0.0,0.0,Unknown,Unknown,Unknown,Unknown,Unknown
arnaldobranco,14/08/2015 15:43:18,Tem uns assuntos que eu só conheço o suficiente pra conversar com quem se interessa de verdade,6,0.0,0.0,Unknown,Unknown,Unknown,Unknown,Unknown
arnaldobranco,14/08/2015 15:27:33,"@elrodris Valeu, chefe! Aparece lá!",0,0.0,0.0,Unknown,Unknown,Unknown,Unknown,Unknown
arnaldobranco,14/08/2015 13:51:27,"Na sequência, vou pra esse evento bacana https://t.co/HF483vlhW7",1,0.0,0.0,Unknown,Unknown,Unknown,Unknown,Unknown
arnaldobranco,14/08/2015 13:49:39,"Hoje falo no Sem Censura (16h, TV Brasil) sobre Vidas Secas, a adaptação de Graciliano pra HQ que fiz com o Guazzelli http://t.co/0M9P6tt6KX",3,0.0,0.0,Unknown,Unknown,Unknown,Unknown,Unknown
arnaldobranco,13/08/2015 21:21:26,Olha o carinho da torcida do Vasco http://t.co/HnMG6TAp8b,2,0.0,0.0,Unknown,Unknown,Unknown,Unknown,Unknown
arnaldobranco,13/08/2015 13:45:19,Amanhã (14/08) vou autografar livros e originais nesse evento com bebidas alcoólicas e shows de bandas https://t.co/HF483vlhW7,1,0.0,0.0,Unknown,Unknown,Unknown,Unknown,Unknown
arnaldobranco,12/08/2015 23:03:28,Vendo o jogo sem óculos com a TV longe pra caralho semicoberta por um toldo e desconfiando que estou no lucro,0,0.0,0.0,Unknown,Unknown,Unknown,Unknown,Unknown
arnaldobranco,12/08/2015 19:03:36,"Exploding Hearts, a banda que teve o fim mais rock'n'roll da história (os membros morreram em um acidente de van) https://t.co/cxwZdDp3BI",1,0.0,0.0,Unknown,Unknown,Unknown,Unknown,Unknown
arnaldobranco,12/08/2015 16:16:14,~ Certas séries ~ deviam ter opção mute pra narração em off,2,0.0,0.0,Unknown,Unknown,Unknown,Unknown,Unknown
arnaldobranco,11/08/2015 21:47:39,"@sound3vision Opa, valeu! :)",0,0.0,0.0,Unknown,Unknown,Unknown,Unknown,Unknown
arnaldobranco,11/08/2015 21:43:32,@sound3vision E quando volta a do Oasis com o logo do Blur? Estou devendo uma aqui em casa :P,0,0.0,0.0,Unknown,Unknown,Unknown,Unknown,Unknown
arnaldobranco,10/08/2015 11:53:52,Mundinho animal http://t.co/wxZWqlp6fA,58,0.0,0.0,Unknown,Unknown,Unknown,Unknown,Unknown
arnaldobranco,09/08/2015 20:18:55,Bonita homenagem ao pai estelionatário na camisa do Luiz Antônio,12,0.0,0.0,Unknown,Unknown,Unknown,Unknown,Unknown
arnaldobranco,09/08/2015 19:23:19,"Os jogadores do Flamengo pensam tanto antes de decidir a jogada pra depois fazer merda, parece eu jogando xadrez",19,0.0,0.0,Unknown,Unknown,Unknown,Unknown,Unknown
arnaldobranco,09/08/2015 13:16:20,"Não existe expressão mais passivo-agressiva que """"nem me convida""""",59,0.0,0.0,Unknown,Unknown,Unknown,Unknown,Unknown
arnaldobranco,09/08/2015 12:16:02,Cartum que saiu hoje na Folha http://t.co/AUe44iDwwX http://t.co/v6DcXtuLgo,16,0.0,0.0,Unknown,Unknown,Unknown,Unknown,Unknown
arnaldobranco,08/08/2015 19:14:42,Agosto me lembra a melhor coisa que já fizeram na TV brasileira http://t.co/sf8HyLdZ1g,2,0.0,0.0,Unknown,Unknown,Unknown,Unknown,Unknown
arnaldobranco,08/08/2015 17:25:53,Veja também está revoltada com as injustiças em MasterChef http://t.co/t7RGx3qHut,67,0.0,0.0,Unknown,Unknown,Unknown,Unknown,Unknown
arnaldobranco,08/08/2015 16:33:03,RT @linhadotrem: @arnaldobranco hahahahah http://t.co/fFOXHEWqCt,0,0.0,0.0,Unknown,Unknown,Unknown,Unknown,Unknown
arnaldobranco,08/08/2015 16:32:51,@linhadotrem Hahahaha porra!,0,0.0,0.0,Unknown,Unknown,Unknown,Unknown,Unknown
arnaldobranco,08/08/2015 16:10:17,"""""Que cara superficial, não tira o olho do celular"""" Aí vai ver e o cara tá lendo Ulysses",62,0.0,0.0,Unknown,Unknown,Unknown,Unknown,Unknown
arnaldobranco,08/08/2015 14:13:11,Twitter é um serviço pra te avisar o que está passando na Globo,85,0.0,0.0,Unknown,Unknown,Unknown,Unknown,Unknown
arnaldobranco,07/08/2015 20:25:27,Uma sexta feira tão relutante que parece quinta,14,0.0,0.0,Unknown,Unknown,Unknown,Unknown,Unknown
arnaldobranco,06/08/2015 19:46:04,Rodrigo Constantino lança livro cheio de metáforas para colorir,65,0.0,0.0,Unknown,Unknown,Unknown,Unknown,Unknown
arnaldobranco,06/08/2015 16:55:06,Capaz da Dilma e da Abril caírem juntas que nem na cena do nocaute duplo de Rocky II,21,0.0,0.0,Unknown,Unknown,Unknown,Unknown,Unknown
arnaldobranco,06/08/2015 02:41:13,"Goleada e Libertadores, nada a ver :(",3,0.0,0.0,Unknown,Unknown,Unknown,Unknown,Unknown
arnaldobranco,06/08/2015 02:19:28,@joaoluisjr É o equivalente a um bom sexo casual,4,0.0,0.0,Unknown,Unknown,Unknown,Unknown,Unknown
arnaldobranco,06/08/2015 02:16:56,Ver futebol indiferente ao resultado final é uma espécie de budismo,35,0.0,0.0,Unknown,Unknown,Unknown,Unknown,Unknown
arnaldobranco,06/08/2015 02:05:47,Libertadores é a fina linha entre os Melhores momentos e as Cenas lamentáveis,22,0.0,0.0,Unknown,Unknown,Unknown,Unknown,Unknown
arnaldobranco,06/08/2015 02:00:59,Clima de Libertadores é algo entre o Carnaval e o Estado de sítio,27,0.0,0.0,Unknown,Unknown,Unknown,Unknown,Unknown
arnaldobranco,06/08/2015 01:42:25,Tigres batendo como aquele convidado de um dos regulares da pelada que não entende que se trata de uma confraternização entre amigos,19,0.0,0.0,Unknown,Unknown,Unknown,Unknown,Unknown
arnaldobranco,06/08/2015 01:36:22,Veja agindo no caso Romário como se estivesse surpresa que alguém leve Veja a sério,33,0.0,0.0,Unknown,Unknown,Unknown,Unknown,Unknown
arnaldobranco,03/08/2015 22:29:17,Sempre que tem um item na lista de compras que não sei reconhecer toca na minha cabeça I WANNA KNOW WHAT AÇAFRÃO IS I WANT YOU TO SHOW ME,5,0.0,0.0,Unknown,Unknown,Unknown,Unknown,Unknown
arnaldobranco,03/08/2015 19:42:42,Não é legal rolar golpe porque olha só quem sobrou pra fazer as músicas de protesto :(,15,0.0,0.0,Unknown,Unknown,Unknown,Unknown,Unknown
arnaldobranco,03/08/2015 16:40:59,"Se tem um cara que deve repetir muito o clichê """"não foi pra isso que nós fizemos a revolução"""" é o José Dirceu",6,0.0,0.0,Unknown,Unknown,Unknown,Unknown,Unknown
arnaldobranco,03/08/2015 16:22:38,"@pelizariot Claro, nem é minha :P",0,0.0,0.0,Unknown,Unknown,Unknown,Unknown,Unknown
arnaldobranco,03/08/2015 15:58:39,A gente tem mais palavras pra se referir a suborno do que esquimó pra descrever a neve,80,0.0,0.0,Unknown,Unknown,Unknown,Unknown,Unknown
arnaldobranco,03/08/2015 11:43:52,Mundinho animal http://t.co/3PduIXE9I1,34,0.0,0.0,Unknown,Unknown,Unknown,Unknown,Unknown
arnaldobranco,02/08/2015 21:28:58,O Cristóvão é ruim até pra se explicar,15,0.0,0.0,Unknown,Unknown,Unknown,Unknown,Unknown
arnaldobranco,01/08/2015 21:40:16,Preciso dessa camiseta http://t.co/Uo1mmJBFPv,105,0.0,0.0,Unknown,Unknown,Unknown,Unknown,Unknown
arnaldobranco,01/08/2015 17:43:26,"@1brunoporto @goombagoomba Não tive tempo de ouvir, quero fingir que considerei a possibilidade antes de discordar veementemente",0,0.0,0.0,Unknown,Unknown,Unknown,Unknown,Unknown
arnaldobranco,31/07/2015 19:45:35,Mil pessoas tocarão Foo Fighters à sua direita e mil à sua esquerda mas não serás atingido pois terás te matado antes,46,0.0,0.0,Unknown,Unknown,Unknown,Unknown,Unknown
arnaldobranco,31/07/2015 13:31:37,Começando o dia no twitter http://t.co/lHIwAfnD0b,8,0.0,0.0,Unknown,Unknown,Unknown,Unknown,Unknown
arnaldobranco,30/07/2015 21:27:36,"Romário, você vai processar a Veja? http://t.co/RbyeLg8gdq",46,0.0,0.0,Unknown,Unknown,Unknown,Unknown,Unknown
arnaldobranco,30/07/2015 20:23:22,Difícil saber se a crise tem mais negadores ou entusiastas,63,0.0,0.0,Unknown,Unknown,Unknown,Unknown,Unknown
arnaldobranco,30/07/2015 20:02:50,"Mil caras tocando uma música para pedir show da banda mais arroz de festa do mundo, italiano é mesmo exagerado",32,0.0,0.0,Unknown,Unknown,Unknown,Unknown,Unknown
arnaldobranco,29/07/2015 20:51:17,De 2009 https://t.co/Hgf3ZS4tT6,2,0.0,0.0,Unknown,Unknown,Unknown,Unknown,Unknown
arnaldobranco,27/07/2015 10:55:09,Mundinho animal http://t.co/0Z1maCuna0,39,0.0,0.0,Unknown,Unknown,Unknown,Unknown,Unknown
arnaldobranco,26/07/2015 19:57:32,Acabou o caô mas repuseram o estoque,49,0.0,0.0,Unknown,Unknown,Unknown,Unknown,Unknown
arnaldobranco,26/07/2015 19:43:10,Aparentemente o Flamengo contratou o Guerrero pra ele ajudar na defesa,12,0.0,0.0,Unknown,Unknown,Unknown,Unknown,Unknown
arnaldobranco,24/07/2015 18:02:53,Rua  Gomes Freire 226 https://t.co/Wg41eptfkt,3,0.0,0.0,Unknown,Unknown,Unknown,Unknown,Unknown
arnaldobranco,23/07/2015 18:50:18,Originais para jogo no evento amanhã http://t.co/ztpoalmf6h,0,0.0,0.0,Unknown,Unknown,Unknown,Unknown,Unknown
arnaldobranco,23/07/2015 14:32:33,vdd  https://t.co/7UfC27ogHj,0,0.0,0.0,Unknown,Unknown,Unknown,Unknown,Unknown
arnaldobranco,21/07/2015 21:43:01,"Compareçam, vou vender originais a preço de banana https://t.co/olsThDaNqK",2,0.0,0.0,Unknown,Unknown,Unknown,Unknown,Unknown
arnaldobranco,20/07/2015 19:32:56,"Evento de quadrinhos e culinária comigo e com a Chiquinha (@Elefoa), prestigiem https://t.co/029Dqvbhtj",0,0.0,0.0,Unknown,Unknown,Unknown,Unknown,Unknown
arnaldobranco,20/07/2015 14:10:59,Mundinho animal http://t.co/WXmzjaBhI2,40,0.0,0.0,Unknown,Unknown,Unknown,Unknown,Unknown
arnaldobranco,19/07/2015 15:01:58,Tira para a revista da livraria Cultura http://t.co/UcAeS8WWIc,30,0.0,0.0,Unknown,Unknown,Unknown,Unknown,Unknown
arnaldobranco,18/07/2015 13:51:26,A capa da Veja é um exemplo comovente do homem superando seus limites,9,0.0,0.0,Unknown,Unknown,Unknown,Unknown,Unknown
arnaldobranco,18/07/2015 12:14:02,Tira para o Risadaria com o tema: selfie http://t.co/laxlez1nS5,23,0.0,0.0,Unknown,Unknown,Unknown,Unknown,Unknown
arnaldobranco,17/07/2015 15:09:52,O rato abandonou o barquinho de papel,13,0.0,0.0,Unknown,Unknown,Unknown,Unknown,Unknown
arnaldobranco,16/07/2015 13:21:16,01 tira http://t.co/tbuZuO7z9N,56,0.0,0.0,Unknown,Unknown,Unknown,Unknown,Unknown
arnaldobranco,16/07/2015 01:16:57,Ouvir a escalação do Flamengo é um pouco como esperar a divulgação da lista das vítimas de um desastre aéreo,20,0.0,0.0,Unknown,Unknown,Unknown,Unknown,Unknown
arnaldobranco,16/07/2015 00:30:48,O pessoal reclamando do carinha do obituário da Folha tem alma de síndico de prédio,15,0.0,0.0,Unknown,Unknown,Unknown,Unknown,Unknown
arnaldobranco,15/07/2015 22:01:03,Wow such verified much identification very followers https://t.co/2IG8WGmT91,2,0.0,0.0,Unknown,Unknown,Unknown,Unknown,Unknown
arnaldobranco,14/07/2015 23:53:10,Por mim podia trocar o cargo do presidente da república pelo de uma grande mãe que cortasse a internet das pessoas,8,0.0,0.0,Unknown,Unknown,Unknown,Unknown,Unknown
arnaldobranco,13/07/2015 23:59:44,Foda o trailer do Esquadrão Suicida https://t.co/h8zDicOeKV,20,0.0,0.0,Unknown,Unknown,Unknown,Unknown,Unknown
arnaldobranco,13/07/2015 12:37:29,Mundinho animal http://t.co/COPsOWYjhO,242,0.0,0.0,Unknown,Unknown,Unknown,Unknown,Unknown
arnaldobranco,09/07/2015 14:48:18,"@PauloHalm só quando o Cláudio subir pra página no facebook, e tá tipo umas três séries atrasadas :(",0,0.0,0.0,Unknown,Unknown,Unknown,Unknown,Unknown
arnaldobranco,06/07/2015 11:00:50,Mundinho animal http://t.co/n5WHQKVbsD,278,0.0,0.0,Unknown,Unknown,Unknown,Unknown,Unknown
arnaldobranco,05/07/2015 16:43:42,Minha timeline do facebook está parecendo o instagram do Bolsonaro,16,0.0,0.0,Unknown,Unknown,Unknown,Unknown,Unknown
arnaldobranco,04/07/2015 22:08:09,Chile tá só a capa do Aquaman,2,0.0,0.0,Unknown,Unknown,Unknown,Unknown,Unknown
arnaldobranco,04/07/2015 17:50:14,"""""Joia do Botafogo tem estreia de gala contra o Sampaio Correia"""" Jornalista de esporte devia ser obrigado a ler suas manchetes em voz alta",21,0.0,0.0,Unknown,Unknown,Unknown,Unknown,Unknown
arnaldobranco,04/07/2015 14:25:42,"Hashtag contra o racismo, isso deve resolver",37,0.0,0.0,Unknown,Unknown,Unknown,Unknown,Unknown
arnaldobranco,04/07/2015 01:55:43,RT @roteirodecinema: Clássica do @arnaldobranco http://t.co/BfUjOJpXl0,0,0.0,0.0,Unknown,Unknown,Unknown,Unknown,Unknown
arnaldobranco,02/07/2015 12:21:09,"Vou divulgar os nomes a favor da redução da maioridade penal, quem votou neles justamente por esse tipo de postura vai mudar de ideia!!!!",13,0.0,0.0,Unknown,Unknown,Unknown,Unknown,Unknown
arnaldobranco,30/06/2015 18:20:32,Tentando fazer movimentações no HSBC que está encerrando as atividades no Brasil e lembrando do filme A Queda,1,0.0,0.0,Unknown,Unknown,Unknown,Unknown,Unknown
arnaldobranco,30/06/2015 12:31:05,Mundinho animal http://t.co/V8LAs6JFHF,32,0.0,0.0,Unknown,Unknown,Unknown,Unknown,Unknown
arnaldobranco,26/06/2015 08:04:29,@DeborahDelancy @dianinews @kyobr Ei @julianoenrico corre aqui!,0,0.0,0.0,Unknown,Unknown,Unknown,Unknown,Unknown
arnaldobranco,22/06/2015 10:25:49,Mundinho animal de hoje http://t.co/SitUe3AHCE,49,0.0,0.0,Unknown,Unknown,Unknown,Unknown,Unknown
arnaldobranco,15/06/2015 11:42:12,Mundinho Animal de hoje http://t.co/VcrLyg7aov,119,0.0,0.0,Unknown,Unknown,Unknown,Unknown,Unknown
arnaldobranco,08/06/2015 09:58:18,Mundinho Animal de hoje http://t.co/f6YMcRondi,25,0.0,0.0,Unknown,Unknown,Unknown,Unknown,Unknown
arnaldobranco,01/06/2015 18:34:21,Se o Garrincha jogasse hoje em dia pegava pena de morte,15,0.0,0.0,Unknown,Unknown,Unknown,Unknown,Unknown
arnaldobranco,01/06/2015 14:09:43,Mundinho animal de hoje http://t.co/C6tqRytMQS,32,0.0,0.0,Unknown,Unknown,Unknown,Unknown,Unknown
arnaldobranco,29/05/2015 22:51:27,Mais uma da série O Flamengo que eu lembro no @reppazeamor http://t.co/388i31NSFM,3,0.0,0.0,Unknown,Unknown,Unknown,Unknown,Unknown
arnaldobranco,29/05/2015 17:19:05,Já posso tirar onda de artista censurado http://t.co/ORjZXAmiCR,7,0.0,0.0,Unknown,Unknown,Unknown,Unknown,Unknown
arnaldobranco,27/05/2015 19:47:14,Sempre bom rever o John Oliver sobre a FIFA https://t.co/QiSDRY87DT,19,0.0,0.0,Unknown,Unknown,Unknown,Unknown,Unknown
arnaldobranco,25/05/2015 22:11:28,Depois do acidente do casal Huck jornais criam editoria Foi só um susto,23,0.0,0.0,Unknown,Unknown,Unknown,Unknown,Unknown
arnaldobranco,25/05/2015 21:45:22,@Tonkiel @sound3vision Me juntando à marcha para Brasília,0,0.0,0.0,Unknown,Unknown,Unknown,Unknown,Unknown
arnaldobranco,25/05/2015 21:39:31,"@sound3vision Fora Dilma!!!!1111 Tranquilo, espero :)",0,0.0,0.0,Unknown,Unknown,Unknown,Unknown,Unknown
arnaldobranco,25/05/2015 21:35:06,@sound3vision Minha camisa do Wavves desapareceu do radar dos correios dia 19 :((((,0,0.0,0.0,Unknown,Unknown,Unknown,Unknown,Unknown
arnaldobranco,25/05/2015 11:28:31,Mundinho animal http://t.co/DGbzekgH6a,0,0.0,0.0,Unknown,Unknown,Unknown,Unknown,Unknown
arnaldobranco,23/05/2015 11:05:32,Com essa onda de esfaqueamentos no Rio lembrei que já fui assaltado quando era criança por um sujeito portando uma faca de manteiga,2,0.0,0.0,Unknown,Unknown,Unknown,Unknown,Unknown
arnaldobranco,22/05/2015 21:27:44,Paulinho Vilhena cotado para viver O Líder ou o Verme Mental http://t.co/VpklwAKVKY,21,0.0,0.0,Unknown,Unknown,Unknown,Unknown,Unknown
arnaldobranco,22/05/2015 11:19:48,01 gráfico http://t.co/3Vw7Llt3YW,7,0.0,0.0,Unknown,Unknown,Unknown,Unknown,Unknown
