juracraveiro,16/09/2015 11:31:27,The California Water Company não existe. Mas faz propaganda para alertar sobre a seca http://t.co/qdNL57dJee,1,0.0,0.0,Unknown,Unknown,Unknown,Unknown
juracraveiro,16/09/2015 10:39:51,Rio Negro no Pantanal de Aquidauana http://t.co/Rzmo9rHTlN,0,0.0,0.0,Unknown,Unknown,Unknown,Unknown
juracraveiro,15/09/2015 19:14:41,"Dados, crescei e multiplicai-vos: a quantidade de dados que a sociedade da informação produz minuto a minuto http://t.co/JZQbenxx7D",1,0.0,0.0,Unknown,Unknown,Unknown,Unknown
juracraveiro,15/09/2015 17:54:46,"CEO da BMW desmaia no palco, no meio de uma apresentação! http://t.co/i7E5e590pP #seráqueestavabebum",0,0.0,0.0,Unknown,Unknown,Unknown,Unknown
juracraveiro,15/09/2015 10:10:48,Delicado http://t.co/SnHIl4lPw2,0,0.0,0.0,Unknown,Unknown,Unknown,Unknown
juracraveiro,14/09/2015 19:24:03,Dá até vontade de pastar #jura_pantanal http://t.co/F2TGbt0Efz,0,0.0,0.0,Unknown,Unknown,Unknown,Unknown
juracraveiro,13/09/2015 21:17:22,Queimada tinge o céu http://t.co/Kmn01bhv2Z,0,0.0,0.0,Unknown,Unknown,Unknown,Unknown
juracraveiro,13/09/2015 09:37:12,Bem-te-vi pantaneiro http://t.co/dA3SUiLEGL,0,0.0,0.0,Unknown,Unknown,Unknown,Unknown
juracraveiro,12/09/2015 21:47:10,Rancho na Fazenda Luzero http://t.co/XuevWxzPeJ,0,0.0,0.0,Unknown,Unknown,Unknown,Unknown
juracraveiro,11/09/2015 21:45:56,Queimada dá essa cor triste ao céu http://t.co/DaX0EhvJKr,0,0.0,0.0,Unknown,Unknown,Unknown,Unknown
juracraveiro,11/09/2015 12:06:19,Abre as asas sobre nós http://t.co/WlgtZEiOzT,1,0.0,0.0,Unknown,Unknown,Unknown,Unknown
juracraveiro,10/09/2015 11:20:25,Abrigando-se do sol de 42° http://t.co/4MACMqnMXG,0,0.0,0.0,Unknown,Unknown,Unknown,Unknown
juracraveiro,10/09/2015 02:08:54,"""""Mean Old World"""" by T-Bone Walker http://t.co/2qrLPZDWNi",0,0.0,0.0,Unknown,Unknown,Unknown,Unknown
juracraveiro,10/09/2015 01:56:29,Big Walter Horton [American folk blues festival 1970 Copenhagen] http://t.co/TNhEDJTzUW,0,0.0,0.0,Unknown,Unknown,Unknown,Unknown
juracraveiro,10/09/2015 01:50:35,"""""The Devil Is A Busy Man"""" by Sunnyland Slim http://t.co/W9b4SGMVhS",0,0.0,0.0,Unknown,Unknown,Unknown,Unknown
juracraveiro,10/09/2015 00:30:15,"O atraso do atraso do atraso: """"Vereadores vetam o Uber em São Paulo"""" http://t.co/r54p394VLH",1,0.0,0.0,Unknown,Unknown,Unknown,Unknown
juracraveiro,09/09/2015 21:33:20,"Piúva e Acurí, típicos do pantanal de Aquidauana http://t.co/NS5SxL2AIA",0,0.0,0.0,Unknown,Unknown,Unknown,Unknown
juracraveiro,09/09/2015 12:01:52,"Tony Ramos e o próximo comercial da Friboi: """"Caminhão é interceptado com maconha avaliada em R$ 232 mil"""" http://t.co/yv4kvjyIoR",0,0.0,0.0,Unknown,Unknown,Unknown,Unknown
juracraveiro,09/09/2015 11:18:19,"Travessia do Rio Negro, Fazenda Barramansa do @guilhermerondon http://t.co/7fP3zr8K9s",0,0.0,0.0,Unknown,Unknown,Unknown,Unknown
juracraveiro,08/09/2015 22:13:37,"Como assim? """"Marihuana de otro planeta: la Nasa encuentra THC en fragmento de meteorito"""" http://t.co/HFIqw8HAKh",0,0.0,0.0,Unknown,Unknown,Unknown,Unknown
juracraveiro,08/09/2015 21:28:01,"O comercial excelente é da Pot Noodle, uma das marcas mais icônicas do Reino Unido http://t.co/wpNo731eeD",0,0.0,0.0,Unknown,Unknown,Unknown,Unknown
juracraveiro,08/09/2015 20:40:39,"Lançado em 2007, o iPhone representa 70% da grana que a Apple embolsa atualmente http://t.co/ywbQhYYeqM",0,0.0,0.0,Unknown,Unknown,Unknown,Unknown
juracraveiro,08/09/2015 13:29:48,"Cunha, em outra encarnação http://t.co/0XsK0zUKAe",0,0.0,0.0,Unknown,Unknown,Unknown,Unknown
juracraveiro,07/09/2015 21:51:45,"Inacreditável: """"Regina Duarte lidera o setor pecuarista contra os povos indígenas"""". http://t.co/0yBftkgkl7",1,0.0,0.0,Unknown,Unknown,Unknown,Unknown
juracraveiro,07/09/2015 20:45:47,Dancing days http://t.co/Gmqh8lD0xl,0,0.0,0.0,Unknown,Unknown,Unknown,Unknown
juracraveiro,07/09/2015 11:08:50,Branquelo http://t.co/IGUFVYa3Fg,0,0.0,0.0,Unknown,Unknown,Unknown,Unknown
juracraveiro,06/09/2015 21:27:57,Na Fazenda Luzero do Zé Henrique e Liliane http://t.co/dG6CloYzlW,0,0.0,0.0,Unknown,Unknown,Unknown,Unknown
juracraveiro,06/09/2015 17:14:55,Um outro mundo #jura_pantanal http://t.co/DfIvpidMBQ,0,0.0,0.0,Unknown,Unknown,Unknown,Unknown
juracraveiro,05/09/2015 21:46:49,"Em cima do galho, pra variar http://t.co/cAnUWkOGGZ",0,0.0,0.0,Unknown,Unknown,Unknown,Unknown
juracraveiro,05/09/2015 11:00:39,Protegidos das seca no Retirinho do Tinho Proença http://t.co/lD0nxy6J8U,0,0.0,0.0,Unknown,Unknown,Unknown,Unknown
juracraveiro,04/09/2015 20:42:11,Poeirão do gado 40º http://t.co/IGZKYV3IRU,0,0.0,0.0,Unknown,Unknown,Unknown,Unknown
juracraveiro,04/09/2015 09:17:00,Sozinha no Retirinho http://t.co/5Mok6ibgWr,0,0.0,0.0,Unknown,Unknown,Unknown,Unknown
juracraveiro,03/09/2015 22:35:45,"@flaviobosso isso mesmo, Flávio, passei ao lado do pesqueiro do Almir Sater no Rio Negro, anteontem :-)",0,0.0,0.0,Unknown,Unknown,Unknown,Unknown
juracraveiro,03/09/2015 20:12:41,"Cabeça-seca ou passarão, jaburu-moleque, cabeça-de-pedra e trepa-moleque http://t.co/AV0haRn8H9",0,0.0,0.0,Unknown,Unknown,Unknown,Unknown
juracraveiro,03/09/2015 09:18:11,"Depois de 3 dias sem internet, passamos na Fazenda Retirinho do Tinho. http://t.co/QIFneDL1Qi",0,0.0,0.0,Unknown,Unknown,Unknown,Unknown
juracraveiro,31/08/2015 09:44:55,"Boiada viajando na estrada se chama """"comitiva"""". http://t.co/qVrfrx21Lb",0,0.0,0.0,Unknown,Unknown,Unknown,Unknown
juracraveiro,30/08/2015 22:03:22,Peões pantaneiros http://t.co/zUHKfEKV9W,0,0.0,0.0,Unknown,Unknown,Unknown,Unknown
juracraveiro,30/08/2015 18:04:56,Este senhor arrepiado parece um beija-flor gordinho. Será? http://t.co/257Zg3Y2b0,0,0.0,0.0,Unknown,Unknown,Unknown,Unknown
juracraveiro,29/08/2015 23:52:41,Labirinto das ararinhas http://t.co/MM4OdmPa6I,0,0.0,0.0,Unknown,Unknown,Unknown,Unknown
juracraveiro,29/08/2015 12:14:59,É o que houve ontem. http://t.co/71uzBAc2Rn,0,0.0,0.0,Unknown,Unknown,Unknown,Unknown
juracraveiro,28/08/2015 21:06:15,O Rio Aquidauana continua lindo.... http://t.co/01hsvwun8M,0,0.0,0.0,Unknown,Unknown,Unknown,Unknown
juracraveiro,28/08/2015 19:48:25,Não alugue carro Movida. Quase 3 horas até socorro na estrada com pane elétrica. Desisti e comprei bateria. Não reembolsam. Querem cobrar!,1,0.0,0.0,Unknown,Unknown,Unknown,Unknown
juracraveiro,28/08/2015 12:33:21,"Ela quase foi extinta. Hoje vai bem, obrigado. Mostrarei mais. http://t.co/hBmyQtlUFw",0,0.0,0.0,Unknown,Unknown,Unknown,Unknown
juracraveiro,27/08/2015 14:05:21,"Beira do Rio Aquidauana, começo da seca. http://t.co/WMCA0q3XMx",0,0.0,0.0,Unknown,Unknown,Unknown,Unknown
juracraveiro,27/08/2015 10:26:15,Revoada de fadas-garças http://t.co/krN6kTgwHM,0,0.0,0.0,Unknown,Unknown,Unknown,Unknown
juracraveiro,26/08/2015 10:00:07,Ninho do tuiuiú http://t.co/cl1MkcIxlK,0,0.0,0.0,Unknown,Unknown,Unknown,Unknown
juracraveiro,25/08/2015 10:03:52,"Rio Aquidauana, MS http://t.co/ExOmAspekO",0,0.0,0.0,Unknown,Unknown,Unknown,Unknown
juracraveiro,24/08/2015 12:55:52,Cheguei em Aquidauana. Fico no Pantanal de Mato Grosso do Sul até a Independência do Brasil. http://t.co/uFyl8tZZ6i,0,0.0,0.0,Unknown,Unknown,Unknown,Unknown
juracraveiro,22/08/2015 12:29:19,Amanhecer em Sampa 06:21 AM http://t.co/zScMmj5yGA,0,0.0,0.0,Unknown,Unknown,Unknown,Unknown
juracraveiro,21/08/2015 22:57:27,Uma praça bonita http://t.co/ZGKb5cE9tb,0,0.0,0.0,Unknown,Unknown,Unknown,Unknown
juracraveiro,21/08/2015 14:21:25,27 bibliotecas que todo amante dos livros gostaria de visitar no mundo. Nenhuma no Brasil. http://t.co/CBAOPolWY4 Dica do @businessinsider,1,0.0,0.0,Unknown,Unknown,Unknown,Unknown
juracraveiro,20/08/2015 21:42:15,Miami deco http://t.co/MVTZhPv4mQ,0,0.0,0.0,Unknown,Unknown,Unknown,Unknown
juracraveiro,20/08/2015 14:50:50,"Conhece """"Mustache &amp; Os Apaches""""? Eu não. Viu o videoclipe """"Twang"""" 2013? Também não. Mas divirta-se como me diverti: http://t.co/8qtsvvkq4d",0,0.0,0.0,Unknown,Unknown,Unknown,Unknown
juracraveiro,19/08/2015 14:17:50,Concurso de Quadrinhos e Cartuns sobre a Igualdade de Gênero (by United Nations Women) http://t.co/xFqvOD6UVA,0,0.0,0.0,Unknown,Unknown,Unknown,Unknown
juracraveiro,18/08/2015 20:59:42,O que as agências fazem bem? E o que fazem mal? Reflexões de um jovem planner by @atatrindade http://t.co/a5RiikHGwr,1,0.0,0.0,Unknown,Unknown,Unknown,Unknown
juracraveiro,18/08/2015 17:41:36,"Cheeseburger do Fifties da Al. Santos vem com pouco molho Pic da casa, queijo frio, não derretido, pão que se desfaz. Pecados mortais. #fail",0,0.0,0.0,Unknown,Unknown,Unknown,Unknown
juracraveiro,18/08/2015 13:42:39,Mapa-mundi da proporção entre homens e mulheres no mundo. http://t.co/0smXj3YWiE,0,0.0,0.0,Unknown,Unknown,Unknown,Unknown
juracraveiro,18/08/2015 13:39:15,"Pedra do Baú, São Bento do Sapucaí http://t.co/RdARyV9b5f",0,0.0,0.0,Unknown,Unknown,Unknown,Unknown
juracraveiro,17/08/2015 20:31:14,Os ratos são excelentes nadadores! E grandes contorcionistas! Entram no seu banheiro pela privada http://t.co/9kXx0yHj9o,0,0.0,0.0,Unknown,Unknown,Unknown,Unknown
juracraveiro,17/08/2015 14:09:02,Repararam como as azaléas estão floridas em São Paulo? http://t.co/qRHhs0sDNX,0,0.0,0.0,Unknown,Unknown,Unknown,Unknown
juracraveiro,16/08/2015 21:01:26,"O lôco sô: """"Comentarista do UFC diz que maioria dos lutadores fuma maconha"""" http://t.co/CDDzZRRBll",0,0.0,0.0,Unknown,Unknown,Unknown,Unknown
juracraveiro,14/08/2015 21:59:37,Jovem aprendiz http://t.co/jdNYl21SJK,0,0.0,0.0,Unknown,Unknown,Unknown,Unknown
juracraveiro,13/08/2015 21:49:59,Pois não é que você um dia poderá lamentar a falta de uma cópia impressa http://t.co/GIXcOV5mE2 [Campanha da impressora Pixma da Canon],0,0.0,0.0,Unknown,Unknown,Unknown,Unknown
juracraveiro,13/08/2015 21:48:11,"Colonialistas: """"Congresso retoma atividades, e ameaças aos direitos indígenas"""" http://t.co/du3yV3Tx5m",1,0.0,0.0,Unknown,Unknown,Unknown,Unknown
juracraveiro,12/08/2015 12:31:51,Tabuado http://t.co/c7eiZfmFCx,0,0.0,0.0,Unknown,Unknown,Unknown,Unknown
juracraveiro,12/08/2015 12:31:48,Sem miopía: “Por que o futebol brasileiro precisa de mais estrangeiros” http://t.co/lCeDiElcqv,0,0.0,0.0,Unknown,Unknown,Unknown,Unknown
juracraveiro,12/08/2015 09:19:11,App amigo: “Waze passa a mostrar rotas para driblar rodízio” http://t.co/pAkEl4tNgm,0,0.0,0.0,Unknown,Unknown,Unknown,Unknown
juracraveiro,11/08/2015 22:19:30,"""""Somos a 1ª geração a sentir os impactos das mudanças climáticas e a última a poder fazer algo a respeito."""" Obama http://t.co/rS9Vs7FxXX",0,0.0,0.0,Unknown,Unknown,Unknown,Unknown
juracraveiro,11/08/2015 13:34:11,"Tupi or not tupi: """"Pesquisadores encontram indícios de que Shakespeare fumava maconha"""" http://t.co/LzbbJmcx35",0,0.0,0.0,Unknown,Unknown,Unknown,Unknown
juracraveiro,10/08/2015 14:10:46,West side story http://t.co/FJd8Vc9oTS,0,0.0,0.0,Unknown,Unknown,Unknown,Unknown
juracraveiro,08/08/2015 16:05:22,"Mais um Rocha Matos? """"Desembargador solta ‘Capuava’, maior traficante do Estado"""" http://t.co/2tmVRBpMAB via @bigcaio",0,0.0,0.0,Unknown,Unknown,Unknown,Unknown
juracraveiro,08/08/2015 09:33:46,"""""Corte e tosa da TV a cabo"""" http://t.co/bXlK20HYNF",1,0.0,0.0,Unknown,Unknown,Unknown,Unknown
juracraveiro,07/08/2015 22:02:46,Sol invernoso http://t.co/upP2DOaFcU,0,0.0,0.0,Unknown,Unknown,Unknown,Unknown
juracraveiro,06/08/2015 22:14:58,"""""Collor, Marin, Teixeira, Maluf, jamais me enganaram. O Zé sim. E como! É imperdoável."""" @BlogdoJuca http://t.co/rlgijK1riQ",0,0.0,0.0,Unknown,Unknown,Unknown,Unknown
juracraveiro,06/08/2015 12:54:46,Chama-se Sanhaçu-do-Encontro-Amarelo. Vi lá em São Bento do Sapucaí. http://t.co/Ex6Sl4SKl8,0,0.0,0.0,Unknown,Unknown,Unknown,Unknown
juracraveiro,06/08/2015 11:31:21,Novo filme da AT&amp;T sobre o perigo de usar celular ao volante http://t.co/UvVQXMUn4n,0,0.0,0.0,Unknown,Unknown,Unknown,Unknown
juracraveiro,06/08/2015 10:20:37,"Golaço do @RomarioOnze: """"Após publicar extrato falso, revista Veja reconhece erro e pede desculpas a Romário"""" http://t.co/HUeC3fJYFO",0,0.0,0.0,Unknown,Unknown,Unknown,Unknown
juracraveiro,06/08/2015 01:29:26,Como viver em Portugal depois de aposentar http://t.co/406O3WBVUg,0,0.0,0.0,Unknown,Unknown,Unknown,Unknown
juracraveiro,05/08/2015 16:57:16,Tábuas de luz http://t.co/glZt1FvQzH,0,0.0,0.0,Unknown,Unknown,Unknown,Unknown
juracraveiro,03/08/2015 20:42:51,Cor de abóbora http://t.co/xHVqtjelnJ,0,0.0,0.0,Unknown,Unknown,Unknown,Unknown
juracraveiro,02/08/2015 13:52:37,Adoro os céus de inverno em São Paulo http://t.co/QHFzSaFEHr,0,0.0,0.0,Unknown,Unknown,Unknown,Unknown
juracraveiro,02/08/2015 12:01:49,"Forte: o Rio """"não passa de uma cidade abandonada numa paisagem bonita rodeada de um mar de cocô"""" http://t.co/YLxcHOR7Ky",0,0.0,0.0,Unknown,Unknown,Unknown,Unknown
juracraveiro,02/08/2015 11:30:45,Tostão dá uma aula para entender o futebol medíocre jogado no Brasil nos últimos tempos: http://t.co/lz2lkGBzUs,0,0.0,0.0,Unknown,Unknown,Unknown,Unknown
juracraveiro,01/08/2015 12:31:11,"“Primeiro país a legalizar maconha, Uruguai declara ‘guerra’ ao álcool” http://t.co/ZoEZjq8alD",0,0.0,0.0,Unknown,Unknown,Unknown,Unknown
juracraveiro,30/07/2015 21:06:02,Campanha de autodefesa da mulher com acessórios de moda -  Revista Preview das Filipinas http://t.co/HY8gFFCCFd,0,0.0,0.0,Unknown,Unknown,Unknown,Unknown
juracraveiro,30/07/2015 19:17:06,Olha a madeira! http://t.co/BN2tCmzUgE,0,0.0,0.0,Unknown,Unknown,Unknown,Unknown
juracraveiro,29/07/2015 21:03:31,O Mini é a primeira marca de carro a adotar a realidade aumentada http://t.co/6uxjlD5Mgf,1,0.0,0.0,Unknown,Unknown,Unknown,Unknown
juracraveiro,29/07/2015 20:46:03,Atenção: 'Calling all creators: submissions to Lexus Short Films are now open!' http://t.co/lM68OOArns,0,0.0,0.0,Unknown,Unknown,Unknown,Unknown
juracraveiro,29/07/2015 20:26:13,"Pergunta a @Forbestech: """"Does Windows 10 Spell The End Of The PC Era Finally?"""" http://t.co/9RwwHXO9Qg",0,0.0,0.0,Unknown,Unknown,Unknown,Unknown
juracraveiro,29/07/2015 20:08:33,"Pompéia, Lapa e Jaraguá http://t.co/au816bIOYG",0,0.0,0.0,Unknown,Unknown,Unknown,Unknown
juracraveiro,28/07/2015 20:57:37,"Lindo, mas não sei seu nome http://t.co/RcJsT5gAc6",0,0.0,0.0,Unknown,Unknown,Unknown,Unknown
juracraveiro,28/07/2015 01:16:32,"Caramba! Chama a Maria da Penha!  """"Alexis and Dorrano in Danse Apache, 1934"""" http://t.co/TGQ0sLsQke",0,0.0,0.0,Unknown,Unknown,Unknown,Unknown
juracraveiro,27/07/2015 18:10:39,"""""Por quem rosna o Brasil"""" @brumelianebrum http://t.co/5DGezTY2xp",0,0.0,0.0,Unknown,Unknown,Unknown,Unknown
juracraveiro,27/07/2015 17:21:57,Fubá 9 meses http://t.co/U84RiqvyBy,0,0.0,0.0,Unknown,Unknown,Unknown,Unknown
juracraveiro,25/07/2015 13:54:08,"A manhã inteira sem luz, que beleza Eletropaulo. A má prestação de serviços de energia, telecom etc. é um câncer, assim como a corrupção",0,0.0,0.0,Unknown,Unknown,Unknown,Unknown
juracraveiro,25/07/2015 13:02:41,"Não basta ser infográfico, tem que ser animado; veja como funciona uma turbina eólica para geração de energia http://t.co/ot1tdns62q",0,0.0,0.0,Unknown,Unknown,Unknown,Unknown
juracraveiro,24/07/2015 20:11:36,2014 foi o ano mais quente da história. Pois 2015 será mais. http://t.co/es5kfqGVdO,0,0.0,0.0,Unknown,Unknown,Unknown,Unknown
juracraveiro,24/07/2015 16:49:05,São Paulo invernal. Nas férias de julho. Na 9 de julho. http://t.co/rU67H8AMJ6,0,0.0,0.0,Unknown,Unknown,Unknown,Unknown
juracraveiro,22/07/2015 11:13:51,Artesanato http://t.co/lwjjAuO6yT,0,0.0,0.0,Unknown,Unknown,Unknown,Unknown
juracraveiro,21/07/2015 20:02:57,"""""Os 50 carros mais roubados do Brasil – Voyage é o mais visado"""" http://t.co/akQ7I7GqAU [em seguida, o Palio, o Uno e o Gol]",0,0.0,0.0,Unknown,Unknown,Unknown,Unknown
juracraveiro,21/07/2015 19:32:10,A melhor jaqueta de viagem do mundo bomba no Kickstarter http://t.co/qZ526DUq5P,0,0.0,0.0,Unknown,Unknown,Unknown,Unknown
juracraveiro,21/07/2015 12:02:39,"Vai Haddad, vai catar coquinhos: """"Radares multam por dia 2 mil nas Marginais do Tietê e do Pinheiros"""" http://t.co/j5tGVtWciS",0,0.0,0.0,Unknown,Unknown,Unknown,Unknown
juracraveiro,21/07/2015 11:31:40,“Junho bate recorde de calor no planeta desde fim do século 19” http://t.co/6Q26xufl8E,1,0.0,0.0,Unknown,Unknown,Unknown,Unknown
juracraveiro,20/07/2015 23:09:17,"Agora vai: a procura definitiva de vida inteligente extraterrestre, liderada por Stephen Hawking http://t.co/gEifrzK8Wl",0,0.0,0.0,Unknown,Unknown,Unknown,Unknown
juracraveiro,20/07/2015 23:06:44,Valioso asteróide de platina passou ontem perto da Terra http://t.co/MbYmFOOHoE,0,0.0,0.0,Unknown,Unknown,Unknown,Unknown
juracraveiro,20/07/2015 19:03:08,"O mestre da fotografia do alto, Jeffrey Milstein: http://t.co/fNep50Ldyu",0,0.0,0.0,Unknown,Unknown,Unknown,Unknown
juracraveiro,20/07/2015 17:39:01,"E se o Jô Soares fosse pra cima do Del Nero? """"Comediante invade reunião da Fifa e atira dinheiro falso em Blatter."""" http://t.co/qO4v3qhzLK",0,0.0,0.0,Unknown,Unknown,Unknown,Unknown
juracraveiro,19/07/2015 00:54:16,"De graça para download,  “História da Física: Artigos, ensaios e resenhas”, novo livro de Cássio Leite Vieira http://t.co/FnGWhI5QWr",0,0.0,0.0,Unknown,Unknown,Unknown,Unknown
juracraveiro,16/07/2015 15:18:47,Casal filma sexo em loja Uniqlo e escandaliza a China http://t.co/lBeQkfWND6,0,0.0,0.0,Unknown,Unknown,Unknown,Unknown
juracraveiro,16/07/2015 13:45:47,Fácil: 1 culpar 2 julgar 3 imitar 4 fingir 5 esperar  Difícil: 1 aprender 2 ensinar 3 inspirar 4 melhorar 5 doar  D'après @ValaAfshar,1,0.0,0.0,Unknown,Unknown,Unknown,Unknown
juracraveiro,15/07/2015 19:27:38,"Madeira se entorta com água, vapor, calor e tensão, né @theocraveiro http://t.co/UDLGT7j7hY",0,0.0,0.0,Unknown,Unknown,Unknown,Unknown
juracraveiro,15/07/2015 16:18:30,"Triste: “Pra mim é o fim de tudo isso”, diz Niéde Guidon sobre o Parque da Serra da Capivara"""" http://t.co/QIWrg7bInh via @todoprosa",0,0.0,0.0,Unknown,Unknown,Unknown,Unknown
juracraveiro,14/07/2015 22:55:29,Os 1001 céus de São Paulo. http://t.co/ZUNGTyFkvi,0,0.0,0.0,Unknown,Unknown,Unknown,Unknown
juracraveiro,12/07/2015 12:26:06,Você já viu propaganda em HD e slow motion. Pessoas em todas as situações. Mas fazendo cocô será a 1ª vez http://t.co/viVaWTgaCz,0,0.0,0.0,Unknown,Unknown,Unknown,Unknown
juracraveiro,11/07/2015 17:39:51,"Das 7.102 línguas vivas existentes no planeta, 23 são faladas por mais da metade da população http://t.co/RznBQkbPgL",0,0.0,0.0,Unknown,Unknown,Unknown,Unknown
juracraveiro,11/07/2015 12:40:07,Inverno paulistano: gavião com neblina no galho metálico http://t.co/w0AUP4cbls,0,0.0,0.0,Unknown,Unknown,Unknown,Unknown
juracraveiro,09/07/2015 21:39:24,Quando o varejo leva um Grand Prix http://t.co/NNOiR2pu3T,0,0.0,0.0,Unknown,Unknown,Unknown,Unknown
juracraveiro,09/07/2015 19:39:59,Nada como voltar pra casa depois da cirurgia. Muita luz. http://t.co/fhSoW3Gn7P,0,0.0,0.0,Unknown,Unknown,Unknown,Unknown
juracraveiro,09/07/2015 12:03:47,Tecnologia tropical: um drone caipira com pipa e câmera fotográfica http://t.co/YpJS1sv8iW,0,0.0,0.0,Unknown,Unknown,Unknown,Unknown
juracraveiro,07/07/2015 23:48:38,"Jornal Nacional faz matéria sobre economia compartilhada e oculta nome da AirBnb, Uber etc. Isso é o jornalismo informativo padrão Globo.",0,0.0,0.0,Unknown,Unknown,Unknown,Unknown
juracraveiro,07/07/2015 21:22:26,Daniel Alves: “Pep Guardiola queria a Seleção. A CBF não quis” http://t.co/iyxbaA8rzE Hoje 21:30 ESPN Brasil,0,0.0,0.0,Unknown,Unknown,Unknown,Unknown
juracraveiro,07/07/2015 13:04:59,"Uia: RT @ForbesTech: Apple has more money, makes more money, grows faster and is more efficient than Google: http://t.co/xD5wk63yto",0,0.0,0.0,Unknown,Unknown,Unknown,Unknown
juracraveiro,07/07/2015 13:02:28,Lobby dos supermercados: “Justiça de SP decide manter cobrança por sacolinha plástica” http://t.co/wwlKFE21jA Mambo não cobrava. Mudará?,0,0.0,0.0,Unknown,Unknown,Unknown,Unknown
juracraveiro,06/07/2015 22:35:04,Ofurô de pedras e água quente a céu aberto. Bom né @fevald :-) http://t.co/nJaxsltEVI,0,0.0,0.0,Unknown,Unknown,Unknown,Unknown
juracraveiro,05/07/2015 17:28:46,Uma casinha pequenina. http://t.co/zqZwKOs49v,0,0.0,0.0,Unknown,Unknown,Unknown,Unknown
juracraveiro,03/07/2015 18:32:30,"Piscina de água corrente muito fria, no sítio da Serra da Estrela, em Cunha. http://t.co/SuHpw9RqI3",0,0.0,0.0,Unknown,Unknown,Unknown,Unknown
juracraveiro,01/07/2015 13:13:55,"Vamos sentar lá fora? Sítio da Estrela, Cunha. http://t.co/mb5DKrRDSs",0,0.0,0.0,Unknown,Unknown,Unknown,Unknown
juracraveiro,30/06/2015 10:39:52,Bom dia. Tudo azul aí em cima? http://t.co/db4u9xFIoN,0,0.0,0.0,Unknown,Unknown,Unknown,Unknown
juracraveiro,29/06/2015 17:10:04,Guardinhas http://t.co/KJFIsIQQtq,0,0.0,0.0,Unknown,Unknown,Unknown,Unknown
juracraveiro,29/06/2015 12:02:03,Sabia que a NBS foi gestada dentro da Propeg em 2001? http://t.co/8YvKnSGzt1,0,0.0,0.0,Unknown,Unknown,Unknown,Unknown
juracraveiro,27/06/2015 22:06:24,O que o Dunga está fazendo com a camiseta vermelha do Paraguai por baixo da camisa?,0,0.0,0.0,Unknown,Unknown,Unknown,Unknown
juracraveiro,27/06/2015 16:43:24,Nos altos de Cunha http://t.co/fdE2fMn2fK,0,0.0,0.0,Unknown,Unknown,Unknown,Unknown
juracraveiro,27/06/2015 15:49:41,"""""Lindamente sueco"""" - bom gosto e bom humor britânicos combinados! http://t.co/bJCPzcgphU",0,0.0,0.0,Unknown,Unknown,Unknown,Unknown
juracraveiro,27/06/2015 13:12:35,“The people who are crazy enough to think they can change the world are the ones who do.”  @Tim_Cook sobre a legalização do casamento gay,0,0.0,0.0,Unknown,Unknown,Unknown,Unknown
juracraveiro,27/06/2015 00:16:31,"Dunga: """"Eu até acho que eu sou afrodescendente de tanto que apanhei e gosto de apanhar."""" Racismo enrustido: http://t.co/OLsOcYgRty",1,0.0,0.0,Unknown,Unknown,Unknown,Unknown
juracraveiro,27/06/2015 00:06:29,Seguidores dos sacerdotes de todas as religiões e pastores evangélicos homofóbicos irão boicotar o Face agora? http://t.co/jlSA7MeLvI,0,0.0,0.0,Unknown,Unknown,Unknown,Unknown
juracraveiro,26/06/2015 12:26:16,"Devo confessar: amo foie gras, bife de tira, leitoa assada, coelho guisado, pernil de cabrito e cordeiro, codorna recheada, frango frito...",0,0.0,0.0,Unknown,Unknown,Unknown,Unknown
juracraveiro,26/06/2015 10:47:57,"Uma hora de espera por um copo d’água no quarto do Einstein. A “copa” não traz. A culpa não é da enfermagem, é da “copa”. Abaixo a copa!",0,0.0,0.0,Unknown,Unknown,Unknown,Unknown
juracraveiro,26/06/2015 09:40:17,"Haddad proibe o foie gras. Vai proibir o abate cruel de bois, frangos, porcos e coelhos também. Ou é jogo cena? http://t.co/mQMinYhRK2",0,0.0,0.0,Unknown,Unknown,Unknown,Unknown
juracraveiro,23/06/2015 22:51:54,Smartphone é melhor do que celular em tudo? http://t.co/Dv3Ji1VzSc,0,0.0,0.0,Unknown,Unknown,Unknown,Unknown
juracraveiro,20/06/2015 13:17:29,Altaneiros http://t.co/MzoCiedKUg,0,0.0,0.0,Unknown,Unknown,Unknown,Unknown
juracraveiro,19/06/2015 22:03:33,Violência contra povos indígenas voltou a crescer em 2014 http://t.co/SnoouR7ghI,0,0.0,0.0,Unknown,Unknown,Unknown,Unknown
juracraveiro,19/06/2015 21:47:43,"""""India's First Ad With a Lesbian Couple Goes Viral"""" http://t.co/9J8tUZdKKg",0,0.0,0.0,Unknown,Unknown,Unknown,Unknown
juracraveiro,19/06/2015 21:13:30,"O mundo gira e tudo muda: """"Opinião: estamos muito chatos?"""" http://t.co/d0MEAqBynS por @jampa",0,0.0,0.0,Unknown,Unknown,Unknown,Unknown
juracraveiro,19/06/2015 16:54:27,Sumarézinho ao anoitecer com a frente fria de outono http://t.co/bitHkT9NI3,0,0.0,0.0,Unknown,Unknown,Unknown,Unknown
juracraveiro,19/06/2015 13:19:03,"UOL educação: """"200 anos de Waterloo. Napoleão foi enterrado sem pênis. Sabia?"""" http://t.co/f1CtntrFNs",1,0.0,0.0,Unknown,Unknown,Unknown,Unknown
juracraveiro,18/06/2015 14:43:53,Chás e sucos. Só não tem chá mate e chá preto. Como os franceses do Pão de Açúcar podem entender tão pouco de BR? http://t.co/ArBfXFJfgl,0,0.0,0.0,Unknown,Unknown,Unknown,Unknown
juracraveiro,17/06/2015 22:17:43,"""""Uma trollagem recorrente"""". Podia ser chamada de pegadinha aérea http://t.co/WkPmbWbg5E",0,0.0,0.0,Unknown,Unknown,Unknown,Unknown
juracraveiro,17/06/2015 13:41:09,Associaçåo Comercial de SP. Computadores lentos. Hora e meia para Certificação Digital. Sabe de quem é a culpa? http://t.co/6vJxdFZh08,0,0.0,0.0,Unknown,Unknown,Unknown,Unknown
juracraveiro,17/06/2015 13:37:09,Vim à ACSP para retirar Certificação Digital. Me avisa a moça simpática que o sistema está lento. Quão lento? Uma hora e meia de espera.,0,0.0,0.0,Unknown,Unknown,Unknown,Unknown
juracraveiro,16/06/2015 21:26:57,Ruralistas pretendem paralisar a demarcação de Terras Indígenas e abrí-las para grandes empreendimentos econômicos http://t.co/CPkkhjPPce,0,0.0,0.0,Unknown,Unknown,Unknown,Unknown
juracraveiro,16/06/2015 21:13:12,Trabalhadores estaiados http://t.co/Nj6jqTrMEw,0,0.0,0.0,Unknown,Unknown,Unknown,Unknown
juracraveiro,15/06/2015 14:05:20,Outono paulistano http://t.co/bNRQjvw7Ml,0,0.0,0.0,Unknown,Unknown,Unknown,Unknown
juracraveiro,15/06/2015 10:33:48,Vamos falar sobre esse tabu que é o luto? http://t.co/A7sCkVlzkZ,0,0.0,0.0,Unknown,Unknown,Unknown,Unknown
juracraveiro,14/06/2015 11:58:54,O que Gibraltar e o Brasil têm em comum? Ambos tomaram de 7 da Alemanha. http://t.co/gSoqFN6Lvl,1,0.0,0.0,Unknown,Unknown,Unknown,Unknown
juracraveiro,13/06/2015 21:40:40,As cidades mais populosas do mundo até 2025 http://t.co/XLYOGM4xQ9,0,0.0,0.0,Unknown,Unknown,Unknown,Unknown
juracraveiro,13/06/2015 14:39:16,A vista olhando de cima #theviewfromabove http://t.co/LcbzXhZsUC,0,0.0,0.0,Unknown,Unknown,Unknown,Unknown
juracraveiro,12/06/2015 20:54:07,Jon Steel bate na mesma tecla: o bom e velho planejamento já era http://t.co/IV5TntRv72,1,0.0,0.0,Unknown,Unknown,Unknown,Unknown
