mauroiasi,25/10/2014 21:20:00,"RT @martajanePCB: Excelente texto de @MauroIasi sobre o panorama eleitoral e as lutas para além das urnas. """" O sexto turno"""" http://t.co/diJ…",0,0.0,0.0,Unknown,Unknown,Unknown,Unknown
mauroiasi,05/10/2014 00:16:27,@eugenio_w não nos convidaram.,0,0.0,0.0,Unknown,Unknown,Unknown,Unknown
mauroiasi,05/10/2014 00:15:18,@D7op3HG escolha da imprensa...,0,0.0,0.0,Unknown,Unknown,Unknown,Unknown
mauroiasi,05/10/2014 00:14:16,"RT @wescleypinheiro: E falando em eleições, que pena que a @lucianagenro ñ falou das ausências de @MauroIasi @zemaria_pstu nos debates. Iss…",0,0.0,0.0,Unknown,Unknown,Unknown,Unknown
mauroiasi,05/10/2014 00:13:38,@opsnxzero também queria saber ... ^^,1,0.0,0.0,Unknown,Unknown,Unknown,Unknown
mauroiasi,03/10/2014 22:54:06,"RT @RafaFontanari: Decidido! @MauroIasi tem meu voto! Ainda vou ler mais sobre as propostas, sobre a história dele e etc., mas já estou con…",0,0.0,0.0,Unknown,Unknown,Unknown,Unknown
mauroiasi,03/10/2014 22:53:54,@eugenio_w Não fomos convidados.,1,0.0,0.0,Unknown,Unknown,Unknown,Unknown
mauroiasi,03/10/2014 04:19:06,Em breve vai ao ar nossa análise após o último bloco do debate na Globo. #quebrandoobloqueio | Mauro Iasi na Internet |,7,0.0,0.0,Unknown,Unknown,Unknown,Unknown
mauroiasi,03/10/2014 04:06:18,"RT @pablomattoso: Debate só reafirmando minha opção para a presidência, um candidato que não foi convidado. Votarei com gosto em @MauroIasi…",0,0.0,0.0,Unknown,Unknown,Unknown,Unknown
mauroiasi,03/10/2014 04:05:54,"RT @brunairineu: @MauroIasi não foi convidado ao debate mas esta furando o bloqueio via twitter comentando o debate, mostrando suas propost…",0,0.0,0.0,Unknown,Unknown,Unknown,Unknown
mauroiasi,03/10/2014 04:05:01,Segue o vídeo com nossos comentários sobre o terceiro bloco do debate na Globo https://t.co/IcQK8NNLCg - #quebrandoobloqueio,17,0.0,0.0,Unknown,Unknown,Unknown,Unknown
mauroiasi,03/10/2014 04:02:16,"""""Nós colocamos os pobres no orçamento""""!!!!!!!!!!!!!!!!!!!!!!! @dilmabr",9,0.0,0.0,Unknown,Unknown,Unknown,Unknown
mauroiasi,03/10/2014 03:58:13,"RT @_karolsaldanha: @MauroIasi inteligentíssimo, uma pena não estar no debate, pois tem mais a acrescentar que os três """"principais"""" candida…",0,0.0,0.0,Unknown,Unknown,Unknown,Unknown
mauroiasi,03/10/2014 03:57:06,@RodrigoRoflin não. O capital se funda na propriedade privada dos meios de produção e na exploração privada da força de trabalho.,0,0.0,0.0,Unknown,Unknown,Unknown,Unknown
mauroiasi,03/10/2014 03:53:00,"RT @bibliozecario: Gente, garanto que os vídeos e os tweets do @MauroIasi estão bem melhores que esse debate absurdo. #capitalprivadomarina…",0,0.0,0.0,Unknown,Unknown,Unknown,Unknown
mauroiasi,03/10/2014 03:50:47,"Eis que os 2 pseudoecologistas defendem o capitalismo, revelando-se ecocapitalistas. Política ecológica séria tem que ser anticapitalista!",54,0.0,0.0,Unknown,Unknown,Unknown,Unknown
mauroiasi,03/10/2014 03:48:32,RT @alojulia: Fiquem de olho nos vídeos publicados pelo @MauroIasi e acompanhem os tweets para comentários que acrescentam mais que esse sh…,0,0.0,0.0,Unknown,Unknown,Unknown,Unknown
mauroiasi,03/10/2014 03:47:41,Capital privado?????????????????????????,32,0.0,0.0,Unknown,Unknown,Unknown,Unknown
mauroiasi,03/10/2014 03:47:18,O @AecioNeves agora propõe privatizar os presídios também. E @levyfidelix concorda...,19,0.0,0.0,Unknown,Unknown,Unknown,Unknown
mauroiasi,03/10/2014 03:43:53,RT @JotaNarciso: Recomendo acompanharem os comentários do @MauroIasi sobre o debate,0,0.0,0.0,Unknown,Unknown,Unknown,Unknown
mauroiasi,03/10/2014 03:43:24,"RT @paulougolini: @MauroIasi, pelo twitter, fazendo um papel muito melhor do que a maioria dos candidatos no estúdio.",0,0.0,0.0,Unknown,Unknown,Unknown,Unknown
mauroiasi,03/10/2014 03:29:44,Não é a falta de uma política de segurança que lota os presídios @silva_marina. É uma política de segurança fundamentada no encarceramento!,64,0.0,0.0,Unknown,Unknown,Unknown,Unknown
mauroiasi,03/10/2014 03:27:19,Estamos acompanhando a troca de amabilidades entre candidatos na TV e furando o bloqueio pela Internet. http://t.co/0ONiQyluLj,20,0.0,0.0,Unknown,Unknown,Unknown,Unknown
mauroiasi,03/10/2014 03:22:08,Marina diz que vai combater a corrupção não nomeando corruptos... qual critério vai usar? Não foi ela que nomeou corruptos também?,25,0.0,0.0,Unknown,Unknown,Unknown,Unknown
mauroiasi,03/10/2014 03:20:41,Comentamos o segundo bloco do debate Global nesse vídeo: https://t.co/iqT9yNQkEQ - #quebrandoobloqueio | Mauro Iasi na Internet |,17,0.0,0.0,Unknown,Unknown,Unknown,Unknown
mauroiasi,03/10/2014 03:14:34,RT @arielboaz: Ainda acho que seria melhor se o @MauroIasi estivesse aí no debate...,0,0.0,0.0,Unknown,Unknown,Unknown,Unknown
mauroiasi,03/10/2014 03:14:01,O @levyfidelix está muito preocupado com os cubanos...,17,0.0,0.0,Unknown,Unknown,Unknown,Unknown
mauroiasi,03/10/2014 03:09:22,A @silva_marina afirma que a segurança avançou em Pernambuco. Ela esqueceu-se de conversar com as famílias que morreram na luta pela terra.,34,0.0,0.0,Unknown,Unknown,Unknown,Unknown
mauroiasi,03/10/2014 03:07:13,"Marina afirma que a segurança melhorou durante a Copa... para quem estava nas ruas, como nós, o que melhorou foi a repressão.",44,0.0,0.0,Unknown,Unknown,Unknown,Unknown
mauroiasi,03/10/2014 03:03:01,Daqui a pouco postaremos nosso terceiro vídeo com os comentários sobre o segundo bloco do debate na Globo. #quebrandoobloqueio,5,0.0,0.0,Unknown,Unknown,Unknown,Unknown
mauroiasi,03/10/2014 02:55:51,Não basta reformar as polícias... o PCB defende o fim da PM! #quebrandoobloqueio | Mauro Iasi na Internet |,12,0.0,0.0,Unknown,Unknown,Unknown,Unknown
mauroiasi,03/10/2014 02:46:38,Vídeo com nosso comentário sobre o primeiro bloco no debate na Globo: https://t.co/gPMsd9lwBt - #quebrandoobloqueio | Mauro Iasi na Internet,22,0.0,0.0,Unknown,Unknown,Unknown,Unknown
mauroiasi,03/10/2014 02:44:12,Aécio propõe privatização de setores que não estão funcionando... ops! já foram privatizados! #quebrandoobloqueio | Mauro Iasi na Internet |,11,0.0,0.0,Unknown,Unknown,Unknown,Unknown
mauroiasi,03/10/2014 02:39:29,@AecioNeves propõe a privatização de setores que não estão funcionando... ops! já foram privatizados!,4,0.0,0.0,Unknown,Unknown,Unknown,Unknown
mauroiasi,03/10/2014 02:37:41,2 - ...quando na verdade sempre foram coniventes com a homofobia.,10,0.0,0.0,Unknown,Unknown,Unknown,Unknown
mauroiasi,03/10/2014 02:37:21,"1 - Além da barbaridade da declaração homofóbica de Levy Fidelix, é revoltante a forma como outros candidatos oportunistas o criticam...",13,0.0,0.0,Unknown,Unknown,Unknown,Unknown
mauroiasi,03/10/2014 02:25:26,Fiquem atentos: daqui a pouco vai ao ar nosso próximo vídeo comentando o 1º bloco do debate na Globo.,10,0.0,0.0,Unknown,Unknown,Unknown,Unknown
mauroiasi,03/10/2014 02:23:34,"Ato falho do @levyfidelix: """"Meu legítimo DEFEITO de defender...""""",15,0.0,0.0,Unknown,Unknown,Unknown,Unknown
mauroiasi,03/10/2014 02:14:55,É fácil Dilma defender a valorização dos professores projetando a questão pro futuro. Enquanto isso no presente destrói a carreira docente.,23,0.0,0.0,Unknown,Unknown,Unknown,Unknown
mauroiasi,03/10/2014 02:11:17,"No PNE, o que o governo fez foi assumir a concepção empresarial do Sistema S para o ensino técnico, abrindo mão da soberania pública.",11,0.0,0.0,Unknown,Unknown,Unknown,Unknown
mauroiasi,03/10/2014 02:07:49,RT @wescleypinheiro: Debate sem todos os candidatos? Debate é com @mauroiasi e a construção do #poderpopular,0,0.0,0.0,Unknown,Unknown,Unknown,Unknown
mauroiasi,03/10/2014 02:04:51,É muito estranho o PSDB criticando o aparelhamento partidário de instituições públicas... exatamente o que fazem há anos no governo em SP.,37,0.0,0.0,Unknown,Unknown,Unknown,Unknown
mauroiasi,03/10/2014 01:57:53,"RT @gabriel_pardal1: Começou a farsa.... eu não me engano, voto @MauroIasi 21 #VotoTudo21 Pelo #poderpopular e por um Brasil Socialista",0,0.0,0.0,Unknown,Unknown,Unknown,Unknown
mauroiasi,03/10/2014 01:53:52,RT @manuel16016: @MauroIasi voto 21 no domingo... e dane-se a mídia...,0,0.0,0.0,Unknown,Unknown,Unknown,Unknown
mauroiasi,03/10/2014 01:45:40,1º comentário: questões anteriores ao debate na TV... #quebrandoobloqueio | Mauro Iasi na Internet | https://t.co/TRVUs6NbA6,7,0.0,0.0,Unknown,Unknown,Unknown,Unknown
mauroiasi,03/10/2014 01:31:41,"RT @jpfotoepoesia: @MauroIasi Conheço as suas propostas e elas me representam. E desde já, declaro meu voto para presidente é 21 Mauro Iasi…",0,0.0,0.0,Unknown,Unknown,Unknown,Unknown
mauroiasi,03/10/2014 01:22:43,"RT @dsthefano: A aberração do processo eleitoral resumida num exemplo: @MauroIasi excluído de todos os debates, enquanto os homofóbicos se …",0,0.0,0.0,Unknown,Unknown,Unknown,Unknown
mauroiasi,03/10/2014 01:22:22,"@vicmagyk no nosso entendimento, porém, a falta de igualdade de condições na disputa fere a constituição.",0,0.0,0.0,Unknown,Unknown,Unknown,Unknown
mauroiasi,03/10/2014 01:20:06,@vicmagyk só é obrigado a ser convidado o candidato cujo partido elegeu deputado federal nas últimas eleições.,0,0.0,0.0,Unknown,Unknown,Unknown,Unknown
mauroiasi,03/10/2014 01:15:52,"RT @ThBortoletto: Tanto Levy, quanto Everaldo, não acrescenta nada em um debate. Seria muito mais proveitoso o @MauroIasi e o Zé Maria do @…",0,0.0,0.0,Unknown,Unknown,Unknown,Unknown
mauroiasi,03/10/2014 01:12:16,"RT @JotaNarciso: @MauroIasi Queria o senhor lá, isso sim.",0,0.0,0.0,Unknown,Unknown,Unknown,Unknown
mauroiasi,03/10/2014 01:11:58,3) as regras eleitorais que excluem candidaturas da esquerda.,5,0.0,0.0,Unknown,Unknown,Unknown,Unknown
mauroiasi,03/10/2014 01:11:39,"2) Porém, antes mesmo dos candidatos que foram convidados começarem a falar, precisamos discutir uma questão prévia...",3,0.0,0.0,Unknown,Unknown,Unknown,Unknown
mauroiasi,03/10/2014 01:10:24,1) Daqui a pouco vamos começar a postar os comentários e vídeos sobre o debate na Globo.,5,0.0,0.0,Unknown,Unknown,Unknown,Unknown
mauroiasi,02/10/2014 14:58:16,"Contra o bloqueio midiático, vamos comentar o debate da Globo pela Internet. Fiquem atentos. http://t.co/MFu92yuyXd",21,0.0,0.0,Unknown,Unknown,Unknown,Unknown
mauroiasi,02/10/2014 14:50:41,"Hoje é dia de atividades no Rio de Janeiro. Mais tarde, comentaremos o debate da Globo. #poderpopular. http://t.co/3Lw1gZewtr",0,0.0,0.0,Unknown,Unknown,Unknown,Unknown
mauroiasi,02/10/2014 14:40:05,"RT @lucas_b07: Nessa eleição vote @MauroIasi  para presidente, aperte 21 e confirma !",0,0.0,0.0,Unknown,Unknown,Unknown,Unknown
mauroiasi,01/10/2014 19:34:20,RT @alojulia: Amanhã tem atividade com o @MauroIasi na UERJ às 19hrs. Pela construção do #poderpopular,0,0.0,0.0,Unknown,Unknown,Unknown,Unknown
mauroiasi,01/10/2014 18:50:33,"RT @marioliveirafk: @MauroIasi estou muito feliz que exista uma pessoa como você à candidatura da presidência, vou votar 21 e fazer campanh…",0,0.0,0.0,Unknown,Unknown,Unknown,Unknown
mauroiasi,01/10/2014 18:48:54,Daqui a pouco estaremos na USP. | #poderpopular http://t.co/aedcEd5B0S,1,0.0,0.0,Unknown,Unknown,Unknown,Unknown
mauroiasi,01/10/2014 13:45:41,Declaração de apoio de Leile Teixeira http://t.co/WFmVl8CQU8,3,0.0,0.0,Unknown,Unknown,Unknown,Unknown
mauroiasi,30/09/2014 20:34:47,"RT @_karolsaldanha: @MauroIasi sabemos que se você estivesse lá, não teria ficado calado. Nossa luta é também contra o preconceito.",0,0.0,0.0,Unknown,Unknown,Unknown,Unknown
mauroiasi,30/09/2014 20:06:11,4) ...diante do qual todos os presentes se silenciam.,11,0.0,0.0,Unknown,Unknown,Unknown,Unknown
mauroiasi,30/09/2014 20:04:39,"3) depois pela impossibilidade de nos posicionarmos no debate a respeito de um episódio tão grave, em razão do bloqueio midiático.",11,0.0,0.0,Unknown,Unknown,Unknown,Unknown
mauroiasi,30/09/2014 20:03:32,"2) No debate da Record, nossa indignação foi dupla: primeiro pela manifestação absurda do candidato Levy Fidelix.",11,0.0,0.0,Unknown,Unknown,Unknown,Unknown
mauroiasi,30/09/2014 20:01:13,1) É conhecida nossa indignação contra toda forma de preconceito e nossa posição política clara de combate à homofobia e transfobia.,10,0.0,0.0,Unknown,Unknown,Unknown,Unknown
mauroiasi,30/09/2014 19:46:07,Declaração de apoio de Wagner Farias http://t.co/dvGz2EZRDj,1,0.0,0.0,Unknown,Unknown,Unknown,Unknown
mauroiasi,30/09/2014 18:12:50,Declaração de apoio do militante Renato Prata Biar | #poderpopular http://t.co/szkvIQ1nJ4,1,0.0,0.0,Unknown,Unknown,Unknown,Unknown
mauroiasi,30/09/2014 18:11:50,O apoio da cantora Nina Rosa http://t.co/voORpN9Lqr,1,0.0,0.0,Unknown,Unknown,Unknown,Unknown
mauroiasi,30/09/2014 18:07:36,"Hoje, reta final, estamos novamente em São Paulo/SP. Acompanhem. #poderpopular | http://t.co/5AeDq9Dywp",1,0.0,0.0,Unknown,Unknown,Unknown,Unknown
mauroiasi,30/09/2014 18:06:41,Declaração de apoio de Paulo Tumolo http://t.co/4tKVp4xoQE,2,0.0,0.0,Unknown,Unknown,Unknown,Unknown
mauroiasi,30/09/2014 18:03:40,Com muito orgulho recebo o apoio de Sérgio Amorim http://t.co/bTwXYwe29C,1,0.0,0.0,Unknown,Unknown,Unknown,Unknown
mauroiasi,30/09/2014 18:01:42,Apoio do professor José Paulo Netto. http://t.co/x2tsfpjLXR,2,0.0,0.0,Unknown,Unknown,Unknown,Unknown
mauroiasi,30/09/2014 17:52:36,"“Reforma política, modelo de desenvolvimento, papel do Estado e agronegócio” | Mauro Iasi http://t.co/yCxPfwpHy3",2,0.0,0.0,Unknown,Unknown,Unknown,Unknown
mauroiasi,30/09/2014 17:50:14,É impressionante como eles se atacam... Assista aqui nosso programa 19 e ajude-nos a divulgá-lo: https://t.co/pgAyTC5rnd,2,0.0,0.0,Unknown,Unknown,Unknown,Unknown
mauroiasi,29/09/2014 21:45:36,Declaração de apoio de Victor Neves http://t.co/iW8ibyFRQL,2,0.0,0.0,Unknown,Unknown,Unknown,Unknown
mauroiasi,29/09/2014 12:33:44,RT @JnSarahRocha: Pela participação democrática de todos candidatos à Presidência da República. @ruicpimenta29 @MauroIasi @zemaria_pstu,0,0.0,0.0,Unknown,Unknown,Unknown,Unknown
mauroiasi,29/09/2014 03:58:04,"RT @arielboaz: O candidato mais bem preparado e com propostas mais firmes pra essas eleições é o @MauroIasi , mas a mídia tem brasileira te…",0,0.0,0.0,Unknown,Unknown,Unknown,Unknown
mauroiasi,29/09/2014 01:06:34,"Queremos uma vida feliz, saudável, decidindo juntos o que fazer e tendo meios coletivos para construir a vida https://t.co/aGJoNoI9mB",4,0.0,0.0,Unknown,Unknown,Unknown,Unknown
mauroiasi,29/09/2014 00:17:56,Concordam? http://t.co/PaoakA6khH,71,0.0,0.0,Unknown,Unknown,Unknown,Unknown
mauroiasi,29/09/2014 00:10:23,Perdeu nosso programa 17? Assista aqui: https://t.co/czAZhbcdJA | #poderpopular,1,0.0,0.0,Unknown,Unknown,Unknown,Unknown
mauroiasi,28/09/2014 22:25:51,"""""Os trabalhadores não têm nada a perder em uma revolução, a não ser suas correntes"""" http://t.co/RMNeOb5LBl",12,0.0,0.0,Unknown,Unknown,Unknown,Unknown
mauroiasi,28/09/2014 18:45:25,Declaração de apoio de Ronaldo Coutinho http://t.co/CTH3bF8BVR,1,0.0,0.0,Unknown,Unknown,Unknown,Unknown
mauroiasi,28/09/2014 00:45:22,Declaração de apoio de Morena Marques http://t.co/r3qnhT9ovM,1,0.0,0.0,Unknown,Unknown,Unknown,Unknown
mauroiasi,28/09/2014 00:34:46,@kirolzita penso que devem ser respeitados. Somos contra a homofobia.,0,0.0,0.0,Unknown,Unknown,Unknown,Unknown
mauroiasi,27/09/2014 03:26:03,RT @liamaiaTIMBETA: COMUNISTA VOTA EM COMUNISTA . VOTO @MauroIasi 21,0,0.0,0.0,Unknown,Unknown,Unknown,Unknown
mauroiasi,26/09/2014 20:40:31,Declaração de apoio de Eduardo Coutinho http://t.co/nu4fZo7AOm,3,0.0,0.0,Unknown,Unknown,Unknown,Unknown
mauroiasi,26/09/2014 17:34:19,RT @martajanePCB: A manipulação das eleições burguesas e a Frente de Esquerda http://t.co/oagDhO1Hcp,0,0.0,0.0,Unknown,Unknown,Unknown,Unknown
mauroiasi,26/09/2014 16:45:10,Confiram nossa agenda de hoje. http://t.co/3IkMbLRv4I,2,0.0,0.0,Unknown,Unknown,Unknown,Unknown
mauroiasi,26/09/2014 12:39:28,"RT @PCB_Baixada: Está sendo gratificante a campanha do @partidao e @MauroIasi. Com limites de dinheiro, mas sem limite de militância!",0,0.0,0.0,Unknown,Unknown,Unknown,Unknown
mauroiasi,25/09/2014 18:16:15,Fica o recado contra as variações do mesmo projeto político http://t.co/BS0JOsjcVf,11,0.0,0.0,Unknown,Unknown,Unknown,Unknown
mauroiasi,25/09/2014 18:11:25,O que representa a candidatura de Aécio? No que ela se diferencia das demais? | https://t.co/6AWY7zYu4D,8,0.0,0.0,Unknown,Unknown,Unknown,Unknown
mauroiasi,25/09/2014 16:40:37,Declaração de apoio de Rodrigo Castelo http://t.co/55HcjKyDAp,3,0.0,0.0,Unknown,Unknown,Unknown,Unknown
mauroiasi,25/09/2014 14:04:22,Pelo controle popular da mídia! http://t.co/bVNS3skENK,2,0.0,0.0,Unknown,Unknown,Unknown,Unknown
mauroiasi,25/09/2014 13:58:15,Acompanhem nossa agenda em Brasília | #poderpopular http://t.co/wbUnfKVrhC,0,0.0,0.0,Unknown,Unknown,Unknown,Unknown
mauroiasi,24/09/2014 22:40:25,Declaração de apoio de Miguel Urbano Rodrigues http://t.co/JfN7GP7CDn,2,0.0,0.0,Unknown,Unknown,Unknown,Unknown
mauroiasi,24/09/2014 18:19:05,RT @correiocid: @MauroIasi - ‘A verdadeira tarefa da esquerda vem depois das eleições: construir a alternativa ao bloco dominante’ http://t…,0,0.0,0.0,Unknown,Unknown,Unknown,Unknown
mauroiasi,24/09/2014 18:16:20,Estamos em Ipatinga | #poderpopular http://t.co/zb6HcJ1C7s,2,0.0,0.0,Unknown,Unknown,Unknown,Unknown
mauroiasi,23/09/2014 19:30:18,@drigotor temos que ter a percepção de que é necessário combater a ideia de que o socialismo é impraticável. Inviável é o capitalismo.,2,0.0,0.0,Unknown,Unknown,Unknown,Unknown
mauroiasi,23/09/2014 19:27:20,PROGRAMA 16: Questão Agrária. #poderpopular | https://t.co/Z3FRLi0HW3,7,0.0,0.0,Unknown,Unknown,Unknown,Unknown
mauroiasi,23/09/2014 16:40:27,Declaração de apoio de Maria Inês Bravo http://t.co/dFoHx6UHFU,2,0.0,0.0,Unknown,Unknown,Unknown,Unknown
mauroiasi,23/09/2014 13:58:27,A chamada guerra às drogas mata mais que as próprias drogas. Assista aqui nosso programa 15. Divulgue retweetando |  https://t.co/i0U6ZSNx94,7,0.0,0.0,Unknown,Unknown,Unknown,Unknown
mauroiasi,23/09/2014 13:47:47,"Nossa agenda começou hoje no Rio, mas continua em Caratinga/MG. E amanhã estaremos em Ipatinga.  #poderpopular. http://t.co/RBRdPLQnV0",0,0.0,0.0,Unknown,Unknown,Unknown,Unknown
mauroiasi,23/09/2014 02:47:36,Socialismo significa mudar profundamente o nosso modo de vida: PROGRAMA 14 | #poderpopular https://t.co/wjBTCTKr7u,2,0.0,0.0,Unknown,Unknown,Unknown,Unknown
mauroiasi,22/09/2014 16:40:22,Declaração de apoio de Jean Salem http://t.co/N1GMX9aRzL,2,0.0,0.0,Unknown,Unknown,Unknown,Unknown
mauroiasi,22/09/2014 13:55:20,Pelo fim da PM! http://t.co/cWjS1t10Vu,2,0.0,0.0,Unknown,Unknown,Unknown,Unknown
mauroiasi,22/09/2014 13:22:01,"Veja aqui o nosso programa 13. Aborto é questão de saúde pública; contra o machismo, racismo, transfobia e homofobia https://t.co/ib88Bkmvej",6,0.0,0.0,Unknown,Unknown,Unknown,Unknown
mauroiasi,22/09/2014 11:49:42,Poesia: Cristão Molotov | #poderpopular http://t.co/Y1w8113J9Y,3,0.0,0.0,Unknown,Unknown,Unknown,Unknown
mauroiasi,22/09/2014 11:38:26,RT @gabriel_pardal1: Vote @MauroIasi Vote @partidao Por um Brasil socialista e anti imperialista #PCB21 #VotoTudo21 http://t.co/4M3aS97I6b,0,0.0,0.0,Unknown,Unknown,Unknown,Unknown
mauroiasi,21/09/2014 22:35:09,Declaração de apoio de Guilherme Vargues http://t.co/fppScvBFdk,1,0.0,0.0,Unknown,Unknown,Unknown,Unknown
mauroiasi,20/09/2014 17:35:15,Declaração de apoio de Fernanda Fortini http://t.co/Qh6eFoD00O,1,0.0,0.0,Unknown,Unknown,Unknown,Unknown
mauroiasi,19/09/2014 15:35:19,Declaração de apoio de Eduardo Serra http://t.co/HX2dQPIJI4,2,0.0,0.0,Unknown,Unknown,Unknown,Unknown
mauroiasi,19/09/2014 14:32:26,Não necessita explicação: http://t.co/iVnE5rVAso,11,0.0,0.0,Unknown,Unknown,Unknown,Unknown
mauroiasi,19/09/2014 13:10:49,Nossa agenda de hoje. Bom dia. http://t.co/UcPq6BR1SJ,2,0.0,0.0,Unknown,Unknown,Unknown,Unknown
mauroiasi,18/09/2014 13:35:22,Declaração de apoio de Marcelo Durão http://t.co/44JCDOMJGt,3,0.0,0.0,Unknown,Unknown,Unknown,Unknown
mauroiasi,17/09/2014 15:10:28,Declaração de apoio de Cezar Maranhão http://t.co/XPaRGO0N5V,1,0.0,0.0,Unknown,Unknown,Unknown,Unknown
mauroiasi,16/09/2014 22:25:16,Somos comunistas! Programa de TV nº 12 http://t.co/Klf2EMieTc,8,0.0,0.0,Unknown,Unknown,Unknown,Unknown
mauroiasi,16/09/2014 16:20:21,A dívida pública brasileira http://t.co/hoCW0dIYHm,5,0.0,0.0,Unknown,Unknown,Unknown,Unknown
mauroiasi,16/09/2014 15:21:34,Acompanhem nossa agenda de hoje em Manaus http://t.co/AV7QSCkOkq,1,0.0,0.0,Unknown,Unknown,Unknown,Unknown
mauroiasi,16/09/2014 02:05:37,"RT @diarioliberdade: Igreja Católica exclui candidaturas de @zemaria_pstu, @MauroIasi  e @Ruicpimenta29 de debate entre presidenciáveis: ht…",0,0.0,0.0,Unknown,Unknown,Unknown,Unknown
mauroiasi,15/09/2014 20:20:30,"Coletivo Gregório Bezerra criado em Santa Catarina, na Comuna Amarildo http://t.co/F0vYhNZBDX",4,0.0,0.0,Unknown,Unknown,Unknown,Unknown
mauroiasi,15/09/2014 13:20:19,Ouça nossa participação no programa Faixa Livre. http://t.co/wG3IChBRbx,2,0.0,0.0,Unknown,Unknown,Unknown,Unknown
mauroiasi,15/09/2014 00:55:11,@franciscarnauba há vários artigos no blog da Boitempo e no meu site da campanha http://t.co/sGHoZ9AU7B,0,0.0,0.0,Unknown,Unknown,Unknown,Unknown
mauroiasi,14/09/2014 23:20:12,Disponibilizamos em nosso site alguns de nossos principais textos dos últimos anos. http://t.co/ySH8qlMiJT,7,0.0,0.0,Unknown,Unknown,Unknown,Unknown
mauroiasi,14/09/2014 20:15:11,"Se você perdeu nosso programa 11, assista aqui. Ajude a divulgar e compartilhar. http://t.co/2cRu75F2OF",7,0.0,0.0,Unknown,Unknown,Unknown,Unknown
mauroiasi,14/09/2014 17:15:13,Chile e a experiência do poder popular. http://t.co/pJdWRXKkO8,10,0.0,0.0,Unknown,Unknown,Unknown,Unknown
mauroiasi,14/09/2014 15:07:10,@Schmidt_paulo o feudalismo também esteve no passado... e mesmo assim acabou.,0,0.0,0.0,Unknown,Unknown,Unknown,Unknown
mauroiasi,14/09/2014 14:50:16,Continuamos na luta pela reforma agrária. http://t.co/oKrtaz44kw,4,0.0,0.0,Unknown,Unknown,Unknown,Unknown
mauroiasi,14/09/2014 12:45:13,"Mais que possível, o socialismo é necessário. http://t.co/UzOfQ1njKQ",12,0.0,0.0,Unknown,Unknown,Unknown,Unknown
mauroiasi,14/09/2014 00:57:59,"Se não assistiu na TV, assista aqui o nosso programa 10. #poderpopular. | https://t.co/czoNx3s0VD",1,0.0,0.0,Unknown,Unknown,Unknown,Unknown
mauroiasi,14/09/2014 00:54:23,Nosso informativo de campanha está disponível para baixar em http://t.co/AcFGpzUpGE,6,0.0,0.0,Unknown,Unknown,Unknown,Unknown
mauroiasi,14/09/2014 00:45:38,Apoio de Samara Marino. http://t.co/3zhKgRg78G,1,0.0,0.0,Unknown,Unknown,Unknown,Unknown
mauroiasi,14/09/2014 00:30:16,Declaração de apoio de Elaine Behring. http://t.co/3APMPNdxjE,1,0.0,0.0,Unknown,Unknown,Unknown,Unknown
mauroiasi,13/09/2014 23:26:01,"Mais do que um programa de governo, temos divulgado nosso programa de lutas. As eleições acabam mês que vem, mas a luta continua.",17,0.0,0.0,Unknown,Unknown,Unknown,Unknown
mauroiasi,12/09/2014 12:31:42,"Para ajudar na campanha, divulguem os conteúdos presentes em nosso site e redes sociais. #poderpopular",3,0.0,0.0,Unknown,Unknown,Unknown,Unknown
mauroiasi,12/09/2014 12:28:41,@fag_dsouza devemos divulgar amplas campanhas contra a homofobia e oferecer programas de proteção. A perseguição a LGBTTs tem que acabar.,1,0.0,0.0,Unknown,Unknown,Unknown,Unknown
mauroiasi,12/09/2014 12:23:01,"@reillow_gudibai sim, mas só isso não basta. Defendemos acesso universal à educação pública e gratuita, com política de permanência.",0,0.0,0.0,Unknown,Unknown,Unknown,Unknown
mauroiasi,11/09/2014 03:45:54,Recebemos com muita satisfação o interesse da juventude em discutir conosco a Conjuntura Política e o Poder Popular.,5,0.0,0.0,Unknown,Unknown,Unknown,Unknown
mauroiasi,09/09/2014 13:27:36,Declaração de apoio da cantora Marina Iris http://t.co/GK1oMxWTg4,4,0.0,0.0,Unknown,Unknown,Unknown,Unknown
mauroiasi,09/09/2014 13:26:21,Declaração de apoio de Atílio Boron: http://t.co/Z8JxaulwRH,5,0.0,0.0,Unknown,Unknown,Unknown,Unknown
mauroiasi,08/09/2014 15:35:29,Veja nossa participação no debate no Instituto Práxis de Educação e Cultura. #poderpopular | https://t.co/z10MTnk8kg,3,0.0,0.0,Unknown,Unknown,Unknown,Unknown
mauroiasi,08/09/2014 13:32:42,Hoje passaremos o dia em Niterói/RJ. Acompanhem. #poderpopular http://t.co/e34OZT5NTk,3,0.0,0.0,Unknown,Unknown,Unknown,Unknown
mauroiasi,08/09/2014 01:51:44,"@novobaiano somos a favor. Sob controle estatal, associado a campanhas de informação e debate popular.",0,0.0,0.0,Unknown,Unknown,Unknown,Unknown
mauroiasi,07/09/2014 22:30:15,@deividconceicao visite nosso site e o site do PCB. Estamos lutando pela construção de uma alternativa de poder: o #poderpopular,0,0.0,0.0,Unknown,Unknown,Unknown,Unknown
mauroiasi,07/09/2014 18:35:22,Dia 09/09: entrevista de Mauro Iasi para o Programa Faixa Livre às 09h45. #poderpopular http://t.co/Q5GCMkuvlo,8,0.0,0.0,Unknown,Unknown,Unknown,Unknown
mauroiasi,07/09/2014 03:06:19,@deividconceicao Temos feito a TV Comuna.,0,0.0,0.0,Unknown,Unknown,Unknown,Unknown
mauroiasi,07/09/2014 01:10:13,"Confiram nossa participação no programa Alerta Geral, na Nova TV Franca http://t.co/2mMCLNKEue",3,0.0,0.0,Unknown,Unknown,Unknown,Unknown
mauroiasi,07/09/2014 00:30:19,Confira nossa posição sobre algumas questões. #poderpopular http://t.co/X6rB7TvrFa,4,0.0,0.0,Unknown,Unknown,Unknown,Unknown
mauroiasi,06/09/2014 23:17:33,"O discurso de Marina é pura ideologia, sua ascensão é a expressão bem acabada de décadas de despolitização no Brasil https://t.co/Kl9NNpq8uE",22,0.0,0.0,Unknown,Unknown,Unknown,Unknown
mauroiasi,06/09/2014 23:12:45,Perdeu nosso programa 9? Assista aqui. Daqui a pouco vai ao ar novamente. https://t.co/kiu7HO7oyE | #poderpopular,1,0.0,0.0,Unknown,Unknown,Unknown,Unknown
