_bot_20_n_5,11/05/2015 07:21:02,ipsum cupidatat ut aliquip in pariatur Excepteur in est incididunt qui non 665,0,0.0,0.0,Unknown,Unknown,Unknown,Unknown,Unknown
_bot_20_n_5,11/05/2015 06:01:02,nisi sed sed nulla voluptas dolore vel velit nulla ex ut consequatur 398,0,0.0,0.0,Unknown,Unknown,Unknown,Unknown,Unknown
_bot_20_n_5,11/05/2015 04:20:02,ea commodo aliquip qui quam nisi iure autem officia 352,0,0.0,0.0,Unknown,Unknown,Unknown,Unknown,Unknown
_bot_20_n_5,11/05/2015 03:51:02,in consequatur anim sit nulla est eum iure nihil 911,0,0.0,0.0,Unknown,Unknown,Unknown,Unknown,Unknown
_bot_20_n_5,11/05/2015 03:39:02,pariatur proident pariatur pariatur elit velit officia commodo veniam molestiae 182,0,0.0,0.0,Unknown,Unknown,Unknown,Unknown,Unknown
_bot_20_n_5,11/05/2015 02:50:02,in Lorem consequat aliquid qui ut illum nisi mollit 825,0,0.0,0.0,Unknown,Unknown,Unknown,Unknown,Unknown
_bot_20_n_5,11/05/2015 02:14:02,Lorem quo vel eu mollit qui deserunt pariatur sunt eum in 580,0,0.0,0.0,Unknown,Unknown,Unknown,Unknown,Unknown
_bot_20_n_5,11/05/2015 00:59:02,consequatur do quam quo consequatur mollit 629,0,0.0,0.0,Unknown,Unknown,Unknown,Unknown,Unknown
_bot_20_n_5,10/05/2015 22:52:02,velit eum ea ea Quis fugiat qui in incididunt fugiat adipiscing 579,0,0.0,0.0,Unknown,Unknown,Unknown,Unknown,Unknown
_bot_20_n_5,10/05/2015 21:23:02,voluptate ad fugiat dolor sunt cillum dolor consequatur est quo irure pariatur 900,0,0.0,0.0,Unknown,Unknown,Unknown,Unknown,Unknown
_bot_20_n_5,10/05/2015 19:49:02,est cupidatat adipiscing deserunt Ut voluptate reprehenderit qui ut aliquid 971,0,0.0,0.0,Unknown,Unknown,Unknown,Unknown,Unknown
_bot_20_n_5,10/05/2015 19:27:02,qui ex velit do ea eum dolorem fugiat enim eu quam 632,0,0.0,0.0,Unknown,Unknown,Unknown,Unknown,Unknown
_bot_20_n_5,10/05/2015 18:27:02,in vel elit id nisi exercitation nulla 171,0,0.0,0.0,Unknown,Unknown,Unknown,Unknown,Unknown
_bot_20_n_5,10/05/2015 16:52:02,irure deserunt in Lorem fugiat aute 418,0,0.0,0.0,Unknown,Unknown,Unknown,Unknown,Unknown
_bot_20_n_5,10/05/2015 16:52:02,aute eum esse dolore do Quis exercitation elit aliquid 811,0,0.0,0.0,Unknown,Unknown,Unknown,Unknown,Unknown
_bot_20_n_5,10/05/2015 16:26:02,laboris ut voluptate et molestiae irure cillum fugiat 788,0,0.0,0.0,Unknown,Unknown,Unknown,Unknown,Unknown
_bot_20_n_5,10/05/2015 14:35:02,esse ullamco dolor veniam sed qui 73,0,0.0,0.0,Unknown,Unknown,Unknown,Unknown,Unknown
_bot_20_n_5,10/05/2015 13:34:02,amet mollit laboris adipiscing qui commodi anim 915,0,0.0,0.0,Unknown,Unknown,Unknown,Unknown,Unknown
_bot_20_n_5,10/05/2015 12:40:02,in iure laborum ullamco nisi ipsum quam ex qui laborum ex 107,0,0.0,0.0,Unknown,Unknown,Unknown,Unknown,Unknown
_bot_20_n_5,10/05/2015 11:40:02,aliquid eu ad aliqua aliquip culpa velit ut elit Quis 943,0,0.0,0.0,Unknown,Unknown,Unknown,Unknown,Unknown
_bot_20_n_5,10/05/2015 11:32:02,esse aliqua commodo sed nostrud voluptate cupidatat Duis dolorem 296,0,0.0,0.0,Unknown,Unknown,Unknown,Unknown,Unknown
_bot_20_n_5,10/05/2015 11:21:02,velit consequat molestiae sed nihil qui 87,0,0.0,0.0,Unknown,Unknown,Unknown,Unknown,Unknown
_bot_20_n_5,10/05/2015 11:07:02,nulla quis qui ex ex dolore 343,0,0.0,0.0,Unknown,Unknown,Unknown,Unknown,Unknown
_bot_20_n_5,10/05/2015 10:07:02,ea vel in voluptate voluptas consectetur Excepteur velit ullamco sit sunt voluptate 95,0,0.0,0.0,Unknown,Unknown,Unknown,Unknown,Unknown
_bot_20_n_5,10/05/2015 08:36:02,adipiscing vel nostrud iure minim vel deserunt ea in eiusmod eiusmod 530,0,0.0,0.0,Unknown,Unknown,Unknown,Unknown,Unknown
_bot_20_n_5,10/05/2015 07:44:02,nihil ut in velit dolorem pariatur illum Duis 534,0,0.0,0.0,Unknown,Unknown,Unknown,Unknown,Unknown
_bot_20_n_5,10/05/2015 05:57:02,consequatur vel pariatur molestiae velit labore 72,0,0.0,0.0,Unknown,Unknown,Unknown,Unknown,Unknown
_bot_20_n_5,10/05/2015 05:33:02,velit voluptas laborum quam sit commodi qui quo 510,0,0.0,0.0,Unknown,Unknown,Unknown,Unknown,Unknown
_bot_20_n_5,10/05/2015 04:52:02,Excepteur cupidatat iure consequatur illum elit amet eu nulla 90,0,0.0,0.0,Unknown,Unknown,Unknown,Unknown,Unknown
_bot_20_n_5,10/05/2015 03:41:02,veniam molestiae vel quo vel Ut 410,0,0.0,0.0,Unknown,Unknown,Unknown,Unknown,Unknown
_bot_20_n_5,10/05/2015 03:22:02,iure minim reprehenderit esse mollit quo vel quam eu quis 272,0,0.0,0.0,Unknown,Unknown,Unknown,Unknown,Unknown
_bot_20_n_5,10/05/2015 02:34:02,consequat tempor anim do anim pariatur sit cupidatat dolore vel 126,0,0.0,0.0,Unknown,Unknown,Unknown,Unknown,Unknown
_bot_20_n_5,10/05/2015 00:58:02,voluptate pariatur Excepteur nostrud vel mollit nulla magna commodo sunt esse ex 541,0,0.0,0.0,Unknown,Unknown,Unknown,Unknown,Unknown
_bot_20_n_5,10/05/2015 00:46:02,culpa nisi nihil velit qui consequatur aliquip velit eiusmod aliquid in veniam 117,0,0.0,0.0,Unknown,Unknown,Unknown,Unknown,Unknown
_bot_20_n_5,09/05/2015 22:57:02,eiusmod est ullamco pariatur fugiat magna velit 736,0,0.0,0.0,Unknown,Unknown,Unknown,Unknown,Unknown
_bot_20_n_5,09/05/2015 21:11:02,aliqua commodo ut exercitation consectetur exercitation Duis elit 877,0,0.0,0.0,Unknown,Unknown,Unknown,Unknown,Unknown
_bot_20_n_5,09/05/2015 20:56:02,qui eu molestiae sint exercitation cillum vel aliquip dolorem 990,0,0.0,0.0,Unknown,Unknown,Unknown,Unknown,Unknown
_bot_20_n_5,09/05/2015 19:48:02,eu qui in ex labore ex do fugiat Excepteur 429,0,0.0,0.0,Unknown,Unknown,Unknown,Unknown,Unknown
_bot_20_n_5,09/05/2015 18:49:02,do aliqua nulla Lorem cillum voluptate laborum 12,0,0.0,0.0,Unknown,Unknown,Unknown,Unknown,Unknown
_bot_20_n_5,09/05/2015 18:44:02,ea reprehenderit laboris labore ut Excepteur fugiat quo 718,0,0.0,0.0,Unknown,Unknown,Unknown,Unknown,Unknown
_bot_20_n_5,09/05/2015 17:03:02,nulla mollit ea quo illum nisi cillum commodo 591,0,0.0,0.0,Unknown,Unknown,Unknown,Unknown,Unknown
_bot_20_n_5,09/05/2015 15:53:02,qui illum quam ea proident non autem dolore magna in eu 973,0,0.0,0.0,Unknown,Unknown,Unknown,Unknown,Unknown
_bot_20_n_5,09/05/2015 14:22:02,molestiae cupidatat quo ipsum nihil dolor voluptate anim 541,0,0.0,0.0,Unknown,Unknown,Unknown,Unknown,Unknown
_bot_20_n_5,09/05/2015 13:58:02,dolore quis mollit Lorem vel eu elit commodi non nulla 964,0,0.0,0.0,Unknown,Unknown,Unknown,Unknown,Unknown
_bot_20_n_5,09/05/2015 12:31:02,ad qui qui eu non pariatur dolor iure 591,0,0.0,0.0,Unknown,Unknown,Unknown,Unknown,Unknown
_bot_20_n_5,09/05/2015 12:19:02,Duis exercitation voluptate elit eu nihil autem voluptate dolorem 915,0,0.0,0.0,Unknown,Unknown,Unknown,Unknown,Unknown
_bot_20_n_5,09/05/2015 10:26:02,tempor esse pariatur quam aliqua vel 89,0,0.0,0.0,Unknown,Unknown,Unknown,Unknown,Unknown
_bot_20_n_5,09/05/2015 10:13:02,nulla esse pariatur commodo laboris magna minim cillum mollit tempor ea nisi 440,0,0.0,0.0,Unknown,Unknown,Unknown,Unknown,Unknown
_bot_20_n_5,09/05/2015 09:45:02,laborum deserunt nulla laborum nisi labore pariatur nostrud fugiat aute 52,0,0.0,0.0,Unknown,Unknown,Unknown,Unknown,Unknown
_bot_20_n_5,09/05/2015 09:43:02,sed eu dolor minim incididunt proident 187,0,0.0,0.0,Unknown,Unknown,Unknown,Unknown,Unknown
_bot_20_n_5,09/05/2015 08:52:02,cupidatat sed molestiae occaecat dolor non et 309,0,0.0,0.0,Unknown,Unknown,Unknown,Unknown,Unknown
_bot_20_n_5,09/05/2015 07:12:02,anim Lorem minim labore illum consequat ad consequatur vel nulla 315,0,0.0,0.0,Unknown,Unknown,Unknown,Unknown,Unknown
_bot_20_n_5,09/05/2015 05:59:02,voluptas laborum consequatur dolorem reprehenderit sunt irure non pariatur dolore 897,0,0.0,0.0,Unknown,Unknown,Unknown,Unknown,Unknown
_bot_20_n_5,09/05/2015 05:10:02,aliquid ex tempor quam ut sint eiusmod qui 760,0,0.0,0.0,Unknown,Unknown,Unknown,Unknown,Unknown
_bot_20_n_5,09/05/2015 03:08:02,reprehenderit sit in illum ea qui commodi sunt eiusmod 317,0,0.0,0.0,Unknown,Unknown,Unknown,Unknown,Unknown
_bot_20_n_5,09/05/2015 02:46:02,Lorem ex nulla dolor pariatur nulla esse Lorem aliquid veniam 374,0,0.0,0.0,Unknown,Unknown,Unknown,Unknown,Unknown
_bot_20_n_5,09/05/2015 01:31:02,in vel consequat velit nulla nulla nisi nisi qui consequat nihil 177,0,0.0,0.0,Unknown,Unknown,Unknown,Unknown,Unknown
_bot_20_n_5,09/05/2015 00:22:02,in id quis nisi laborum in 147,0,0.0,0.0,Unknown,Unknown,Unknown,Unknown,Unknown
_bot_20_n_5,08/05/2015 23:59:02,consequatur laborum velit nisi incididunt illum 724,0,0.0,0.0,Unknown,Unknown,Unknown,Unknown,Unknown
_bot_20_n_5,08/05/2015 22:05:02,ut velit Excepteur sunt sit reprehenderit sint reprehenderit 889,0,0.0,0.0,Unknown,Unknown,Unknown,Unknown,Unknown
_bot_20_n_5,08/05/2015 21:06:02,eum nisi dolor qui est ea esse aliquid aliqua non fugiat 359,0,0.0,0.0,Unknown,Unknown,Unknown,Unknown,Unknown
_bot_20_n_5,08/05/2015 19:49:02,pariatur magna culpa minim Lorem ut ex Ut reprehenderit reprehenderit 122,0,0.0,0.0,Unknown,Unknown,Unknown,Unknown,Unknown
_bot_20_n_5,08/05/2015 18:22:02,amet id enim ex est fugiat commodo ut 221,0,0.0,0.0,Unknown,Unknown,Unknown,Unknown,Unknown
_bot_20_n_5,08/05/2015 16:16:02,amet consequat occaecat quam ea Ut reprehenderit velit 74,0,0.0,0.0,Unknown,Unknown,Unknown,Unknown,Unknown
_bot_20_n_5,08/05/2015 14:25:02,consequat Quis ut mollit deserunt aute 334,0,0.0,0.0,Unknown,Unknown,Unknown,Unknown,Unknown
_bot_20_n_5,08/05/2015 12:26:02,commodo nostrud nulla velit labore Duis ut qui molestiae 847,0,0.0,0.0,Unknown,Unknown,Unknown,Unknown,Unknown
_bot_20_n_5,08/05/2015 12:16:02,adipiscing nulla ut commodo ut reprehenderit illum laboris commodi reprehenderit aliquid 266,0,0.0,0.0,Unknown,Unknown,Unknown,Unknown,Unknown
_bot_20_n_5,08/05/2015 10:16:02,mollit sint fugiat aliqua pariatur ea 428,0,0.0,0.0,Unknown,Unknown,Unknown,Unknown,Unknown
_bot_20_n_5,08/05/2015 08:57:02,velit Duis ut ea aliquid proident 692,0,0.0,0.0,Unknown,Unknown,Unknown,Unknown,Unknown
_bot_20_n_5,08/05/2015 08:24:02,dolore sed officia laboris nulla fugiat nihil ea ut vel 883,0,0.0,0.0,Unknown,Unknown,Unknown,Unknown,Unknown
_bot_20_n_5,08/05/2015 07:58:02,ut Ut et culpa Duis incididunt Excepteur 794,0,0.0,0.0,Unknown,Unknown,Unknown,Unknown,Unknown
_bot_20_n_5,08/05/2015 07:03:02,velit consectetur sed ullamco autem officia minim nisi cillum velit sunt cupidatat 322,0,0.0,0.0,Unknown,Unknown,Unknown,Unknown,Unknown
_bot_20_n_5,08/05/2015 06:33:02,commodo est commodo ex tempor quis velit 754,0,0.0,0.0,Unknown,Unknown,Unknown,Unknown,Unknown
_bot_20_n_5,08/05/2015 04:26:02,tempor vel voluptas aute do incididunt ullamco 437,0,0.0,0.0,Unknown,Unknown,Unknown,Unknown,Unknown
_bot_20_n_5,08/05/2015 02:42:02,cillum nulla dolor anim sunt nihil 915,0,0.0,0.0,Unknown,Unknown,Unknown,Unknown,Unknown
_bot_20_n_5,08/05/2015 01:14:02,consequatur illum voluptate nihil eum amet 731,0,0.0,0.0,Unknown,Unknown,Unknown,Unknown,Unknown
_bot_20_n_5,08/05/2015 00:27:02,commodo quo occaecat dolor eum vel exercitation consequat nisi eiusmod 417,0,0.0,0.0,Unknown,Unknown,Unknown,Unknown,Unknown
_bot_20_n_5,07/05/2015 23:23:02,voluptas ut ea irure reprehenderit Ut ea 813,0,0.0,0.0,Unknown,Unknown,Unknown,Unknown,Unknown
_bot_20_n_5,07/05/2015 21:48:02,tempor occaecat dolore irure eu vel Lorem ut 675,0,0.0,0.0,Unknown,Unknown,Unknown,Unknown,Unknown
_bot_20_n_5,07/05/2015 21:22:02,quo ea sit cillum Quis est ea irure 239,0,0.0,0.0,Unknown,Unknown,Unknown,Unknown,Unknown
_bot_20_n_5,07/05/2015 19:11:02,non in aliqua Lorem ut in pariatur dolor commodi aliquid 390,0,0.0,0.0,Unknown,Unknown,Unknown,Unknown,Unknown
_bot_20_n_5,07/05/2015 18:39:02,exercitation veniam eiusmod illum sit reprehenderit labore minim 366,0,0.0,0.0,Unknown,Unknown,Unknown,Unknown,Unknown
_bot_20_n_5,07/05/2015 18:28:02,consequatur Duis eu quis tempor nihil esse Excepteur 707,0,0.0,0.0,Unknown,Unknown,Unknown,Unknown,Unknown
_bot_20_n_5,07/05/2015 18:03:02,adipiscing ea cillum eiusmod Ut qui Lorem ut veniam eu eum vel 758,0,0.0,0.0,Unknown,Unknown,Unknown,Unknown,Unknown
_bot_20_n_5,07/05/2015 17:20:02,vel elit in Duis quis cillum tempor velit vel Duis aliqua quis 304,0,0.0,0.0,Unknown,Unknown,Unknown,Unknown,Unknown
_bot_20_n_5,07/05/2015 16:58:02,velit in in ipsum ut amet in Quis ea ut 978,0,0.0,0.0,Unknown,Unknown,Unknown,Unknown,Unknown
_bot_20_n_5,07/05/2015 16:36:02,sed Ut adipiscing pariatur ullamco cupidatat nulla officia vel labore et 689,0,0.0,0.0,Unknown,Unknown,Unknown,Unknown,Unknown
_bot_20_n_5,07/05/2015 15:10:02,aute nisi in veniam cillum qui sed ipsum ea dolor aliquid vel 280,0,0.0,0.0,Unknown,Unknown,Unknown,Unknown,Unknown
_bot_20_n_5,07/05/2015 13:19:02,esse Duis quis voluptate nulla consectetur ut 823,0,0.0,0.0,Unknown,Unknown,Unknown,Unknown,Unknown
_bot_20_n_5,07/05/2015 11:57:02,ea aliqua proident mollit et iure consequat aliquip enim consequat ipsum 858,0,0.0,0.0,Unknown,Unknown,Unknown,Unknown,Unknown
_bot_20_n_5,07/05/2015 10:12:02,quo quo voluptas vel Quis incididunt ea molestiae nisi cillum minim nisi 79,0,0.0,0.0,Unknown,Unknown,Unknown,Unknown,Unknown
_bot_20_n_5,07/05/2015 08:16:02,pariatur aute Duis ullamco ut qui commodo proident fugiat tempor 33,0,0.0,0.0,Unknown,Unknown,Unknown,Unknown,Unknown
_bot_20_n_5,07/05/2015 07:56:02,consequat exercitation vel qui dolore Lorem ut sint nulla Lorem 749,0,0.0,0.0,Unknown,Unknown,Unknown,Unknown,Unknown
_bot_20_n_5,07/05/2015 06:36:02,Duis consequat nihil commodi fugiat nisi sunt 916,0,0.0,0.0,Unknown,Unknown,Unknown,Unknown,Unknown
_bot_20_n_5,07/05/2015 05:32:02,aliqua eum ut voluptate voluptate culpa do labore id eiusmod 174,0,0.0,0.0,Unknown,Unknown,Unknown,Unknown,Unknown
_bot_20_n_5,07/05/2015 05:17:02,commodi ut eiusmod id voluptate reprehenderit ut nisi eum eiusmod commodi ad 37,0,0.0,0.0,Unknown,Unknown,Unknown,Unknown,Unknown
_bot_20_n_5,07/05/2015 04:21:02,qui id autem quis autem nostrud eum deserunt quis labore 81,0,0.0,0.0,Unknown,Unknown,Unknown,Unknown,Unknown
_bot_20_n_5,07/05/2015 02:55:02,ex quam sint tempor in dolor ea proident 690,0,0.0,0.0,Unknown,Unknown,Unknown,Unknown,Unknown
_bot_20_n_5,07/05/2015 02:49:02,in dolore ex ut do minim dolorem autem 385,0,0.0,0.0,Unknown,Unknown,Unknown,Unknown,Unknown
_bot_20_n_5,07/05/2015 02:04:02,labore Duis dolore Lorem fugiat ea commodi dolorem occaecat qui ex ex 8,0,0.0,0.0,Unknown,Unknown,Unknown,Unknown,Unknown
_bot_20_n_5,07/05/2015 00:02:02,esse occaecat dolore mollit adipiscing proident ea 646,0,0.0,0.0,Unknown,Unknown,Unknown,Unknown,Unknown
_bot_20_n_5,06/05/2015 23:43:02,ex dolor in pariatur labore nisi eum elit voluptate ea eu 236,0,0.0,0.0,Unknown,Unknown,Unknown,Unknown,Unknown
_bot_20_n_5,06/05/2015 21:38:02,nulla dolor occaecat in sint nulla 591,0,0.0,0.0,Unknown,Unknown,Unknown,Unknown,Unknown
_bot_20_n_5,06/05/2015 20:56:02,illum elit irure fugiat ut eum culpa ad nulla qui 715,0,0.0,0.0,Unknown,Unknown,Unknown,Unknown,Unknown
_bot_20_n_5,06/05/2015 18:54:02,dolor in consequatur occaecat velit eum irure 878,0,0.0,0.0,Unknown,Unknown,Unknown,Unknown,Unknown
_bot_20_n_5,06/05/2015 18:46:02,culpa velit ullamco nostrud in Duis consequat Excepteur 475,0,0.0,0.0,Unknown,Unknown,Unknown,Unknown,Unknown
_bot_20_n_5,06/05/2015 17:37:02,reprehenderit culpa vel non cillum proident nisi quam 281,0,0.0,0.0,Unknown,Unknown,Unknown,Unknown,Unknown
_bot_20_n_5,06/05/2015 16:47:02,ut amet minim vel vel Duis est veniam autem commodo velit 316,0,0.0,0.0,Unknown,Unknown,Unknown,Unknown,Unknown
_bot_20_n_5,06/05/2015 16:08:02,aute quis ipsum aliquip eu quam nostrud 12,0,0.0,0.0,Unknown,Unknown,Unknown,Unknown,Unknown
_bot_20_n_5,06/05/2015 14:42:02,nulla do eu ullamco dolorem fugiat qui veniam dolor mollit 594,0,0.0,0.0,Unknown,Unknown,Unknown,Unknown,Unknown
_bot_20_n_5,06/05/2015 12:41:02,consequat nisi qui incididunt voluptas proident pariatur eum culpa aliqua ut 445,0,0.0,0.0,Unknown,Unknown,Unknown,Unknown,Unknown
_bot_20_n_5,06/05/2015 11:27:02,illum est ut sunt qui sint eiusmod sint adipiscing velit consequat 27,0,0.0,0.0,Unknown,Unknown,Unknown,Unknown,Unknown
_bot_20_n_5,06/05/2015 10:50:02,qui ut consequat qui aliqua consectetur anim 85,0,0.0,0.0,Unknown,Unknown,Unknown,Unknown,Unknown
_bot_20_n_5,06/05/2015 09:48:02,voluptate Quis incididunt laborum voluptas aliqua 960,0,0.0,0.0,Unknown,Unknown,Unknown,Unknown,Unknown
_bot_20_n_5,06/05/2015 09:18:02,molestiae Ut ex pariatur id incididunt qui consequat ut aute pariatur 206,0,0.0,0.0,Unknown,Unknown,Unknown,Unknown,Unknown
_bot_20_n_5,06/05/2015 08:00:02,laboris Lorem reprehenderit in aute in 861,0,0.0,0.0,Unknown,Unknown,Unknown,Unknown,Unknown
_bot_20_n_5,06/05/2015 06:23:02,pariatur ut consequatur quis tempor proident dolore consequatur voluptate in eiusmod aliqua 995,0,0.0,0.0,Unknown,Unknown,Unknown,Unknown,Unknown
_bot_20_n_5,06/05/2015 04:42:02,quam labore aliquip dolor commodi vel iure 145,0,0.0,0.0,Unknown,Unknown,Unknown,Unknown,Unknown
_bot_20_n_5,06/05/2015 03:32:02,quis vel Quis ea velit dolor est vel 288,0,0.0,0.0,Unknown,Unknown,Unknown,Unknown,Unknown
_bot_20_n_5,06/05/2015 02:08:02,Ut ad est ullamco amet id ea 76,0,0.0,0.0,Unknown,Unknown,Unknown,Unknown,Unknown
_bot_20_n_5,06/05/2015 01:16:02,ipsum dolor vel proident eiusmod proident vel in Ut dolore 258,0,0.0,0.0,Unknown,Unknown,Unknown,Unknown,Unknown
_bot_20_n_5,06/05/2015 00:55:02,consequat reprehenderit in esse id aliquid deserunt consequatur nisi nihil sint velit 462,0,0.0,0.0,Unknown,Unknown,Unknown,Unknown,Unknown
_bot_20_n_5,05/05/2015 22:57:02,esse qui est eum ea commodo dolorem 305,0,0.0,0.0,Unknown,Unknown,Unknown,Unknown,Unknown
_bot_20_n_5,05/05/2015 22:34:02,cupidatat eu amet sit voluptate reprehenderit aute ea in est deserunt dolorem 2,0,0.0,0.0,Unknown,Unknown,Unknown,Unknown,Unknown
_bot_20_n_5,05/05/2015 20:54:02,Duis ullamco culpa culpa dolor qui in id in 746,0,0.0,0.0,Unknown,Unknown,Unknown,Unknown,Unknown
_bot_20_n_5,05/05/2015 19:48:02,amet voluptas est Lorem do reprehenderit do exercitation 740,0,0.0,0.0,Unknown,Unknown,Unknown,Unknown,Unknown
_bot_20_n_5,05/05/2015 17:54:02,reprehenderit commodo Ut ut fugiat pariatur aliquid cupidatat minim aliquip 135,0,0.0,0.0,Unknown,Unknown,Unknown,Unknown,Unknown
_bot_20_n_5,05/05/2015 16:18:02,in ut cillum consequatur ipsum Quis velit cupidatat 861,0,0.0,0.0,Unknown,Unknown,Unknown,Unknown,Unknown
_bot_20_n_5,05/05/2015 14:20:02,reprehenderit sint dolor nisi in incididunt pariatur 556,0,0.0,0.0,Unknown,Unknown,Unknown,Unknown,Unknown
_bot_20_n_5,05/05/2015 12:53:02,autem dolore voluptas sunt ut pariatur ut Ut cupidatat 134,0,0.0,0.0,Unknown,Unknown,Unknown,Unknown,Unknown
_bot_20_n_5,05/05/2015 12:36:02,voluptate in ut velit consectetur dolor consequat voluptate esse in 899,0,0.0,0.0,Unknown,Unknown,Unknown,Unknown,Unknown
_bot_20_n_5,05/05/2015 11:20:02,Lorem adipiscing ut voluptate voluptas vel in nulla sed ut dolore 440,0,0.0,0.0,Unknown,Unknown,Unknown,Unknown,Unknown
_bot_20_n_5,05/05/2015 09:44:02,mollit laboris cillum amet esse aliqua cillum fugiat 636,0,0.0,0.0,Unknown,Unknown,Unknown,Unknown,Unknown
_bot_20_n_5,05/05/2015 07:46:02,dolorem esse quam iure cillum dolorem irure cupidatat esse 211,0,0.0,0.0,Unknown,Unknown,Unknown,Unknown,Unknown
_bot_20_n_5,05/05/2015 07:29:02,proident minim adipiscing ullamco id ex Quis sunt tempor qui non in 472,0,0.0,0.0,Unknown,Unknown,Unknown,Unknown,Unknown
_bot_20_n_5,05/05/2015 06:04:02,commodo Ut culpa id fugiat deserunt velit occaecat irure ea 660,0,0.0,0.0,Unknown,Unknown,Unknown,Unknown,Unknown
_bot_20_n_5,05/05/2015 05:49:02,qui molestiae eiusmod pariatur ad ex voluptas aliquip consectetur nulla in 877,0,0.0,0.0,Unknown,Unknown,Unknown,Unknown,Unknown
_bot_20_n_5,05/05/2015 03:57:02,non laborum ut vel fugiat consequat consectetur eum nulla elit eu tempor 755,0,0.0,0.0,Unknown,Unknown,Unknown,Unknown,Unknown
_bot_20_n_5,05/05/2015 03:57:02,in deserunt quo fugiat autem ut 640,0,0.0,0.0,Unknown,Unknown,Unknown,Unknown,Unknown
_bot_20_n_5,05/05/2015 02:11:02,esse pariatur in laboris voluptate molestiae 887,0,0.0,0.0,Unknown,Unknown,Unknown,Unknown,Unknown
_bot_20_n_5,05/05/2015 01:12:02,voluptas aute eiusmod aute sint veniam molestiae Lorem 937,0,0.0,0.0,Unknown,Unknown,Unknown,Unknown,Unknown
_bot_20_n_5,04/05/2015 23:13:02,proident sed ullamco nulla consequat in est 444,0,0.0,0.0,Unknown,Unknown,Unknown,Unknown,Unknown
_bot_20_n_5,04/05/2015 22:54:02,ut in consequatur irure commodi Quis pariatur vel 888,0,0.0,0.0,Unknown,Unknown,Unknown,Unknown,Unknown
_bot_20_n_5,04/05/2015 20:59:02,enim anim ea Duis labore laborum pariatur fugiat et eum minim eu 358,0,0.0,0.0,Unknown,Unknown,Unknown,Unknown,Unknown
_bot_20_n_5,04/05/2015 20:07:02,do qui officia eum Lorem ut consequatur nostrud minim velit 253,0,0.0,0.0,Unknown,Unknown,Unknown,Unknown,Unknown
_bot_20_n_5,04/05/2015 19:14:02,incididunt dolorem occaecat velit eum officia in in 823,0,0.0,0.0,Unknown,Unknown,Unknown,Unknown,Unknown
_bot_20_n_5,04/05/2015 17:54:02,vel vel voluptas velit Excepteur commodi exercitation 643,0,0.0,0.0,Unknown,Unknown,Unknown,Unknown,Unknown
_bot_20_n_5,04/05/2015 17:36:02,Duis velit dolorem enim qui adipiscing proident 896,0,0.0,0.0,Unknown,Unknown,Unknown,Unknown,Unknown
_bot_20_n_5,04/05/2015 17:28:02,commodo ea adipiscing ullamco pariatur dolore eum commodi cupidatat exercitation ullamco cillum 548,0,0.0,0.0,Unknown,Unknown,Unknown,Unknown,Unknown
_bot_20_n_5,04/05/2015 15:44:02,ipsum in laborum adipiscing voluptate velit 699,0,0.0,0.0,Unknown,Unknown,Unknown,Unknown,Unknown
_bot_20_n_5,04/05/2015 15:05:02,voluptate occaecat molestiae exercitation mollit elit in reprehenderit fugiat non 852,0,0.0,0.0,Unknown,Unknown,Unknown,Unknown,Unknown
_bot_20_n_5,04/05/2015 13:35:02,consequatur consequatur quam deserunt anim Duis sunt Excepteur 337,0,0.0,0.0,Unknown,Unknown,Unknown,Unknown,Unknown
_bot_20_n_5,04/05/2015 13:09:02,in vel cillum in pariatur adipiscing 424,0,0.0,0.0,Unknown,Unknown,Unknown,Unknown,Unknown
_bot_20_n_5,04/05/2015 12:11:02,sint voluptas veniam anim quam dolorem in Duis esse aliquip nulla 154,0,0.0,0.0,Unknown,Unknown,Unknown,Unknown,Unknown
_bot_20_n_5,04/05/2015 11:48:02,nihil fugiat pariatur voluptate magna velit velit exercitation do mollit mollit est 0,0,0.0,0.0,Unknown,Unknown,Unknown,Unknown,Unknown
_bot_20_n_5,04/05/2015 09:40:02,veniam nisi eum deserunt illum in 943,0,0.0,0.0,Unknown,Unknown,Unknown,Unknown,Unknown
_bot_20_n_5,04/05/2015 08:09:02,Ut consequatur ex dolorem eiusmod aliqua ipsum velit cupidatat 606,0,0.0,0.0,Unknown,Unknown,Unknown,Unknown,Unknown
_bot_20_n_5,04/05/2015 06:06:02,Ut qui deserunt aute commodi ipsum voluptas ullamco 70,0,0.0,0.0,Unknown,Unknown,Unknown,Unknown,Unknown
_bot_20_n_5,04/05/2015 04:03:02,nostrud consequatur Duis dolore pariatur est 37,0,0.0,0.0,Unknown,Unknown,Unknown,Unknown,Unknown
_bot_20_n_5,04/05/2015 03:39:02,magna tempor ea nisi velit ea 970,0,0.0,0.0,Unknown,Unknown,Unknown,Unknown,Unknown
_bot_20_n_5,04/05/2015 03:25:02,fugiat consequat cillum ea ex cupidatat esse quam amet irure laboris nihil 323,0,0.0,0.0,Unknown,Unknown,Unknown,Unknown,Unknown
_bot_20_n_5,04/05/2015 01:58:02,elit ut irure adipiscing ex ad 40,0,0.0,0.0,Unknown,Unknown,Unknown,Unknown,Unknown
_bot_20_n_5,04/05/2015 00:02:02,qui laboris officia dolore Lorem culpa nihil in Excepteur sunt 341,0,0.0,0.0,Unknown,Unknown,Unknown,Unknown,Unknown
_bot_20_n_5,03/05/2015 22:30:02,quam quo quam dolore in eum quis non Quis sunt 662,0,0.0,0.0,Unknown,Unknown,Unknown,Unknown,Unknown
_bot_20_n_5,03/05/2015 22:11:02,deserunt eum aute quis consequatur reprehenderit sit commodi in minim 811,0,0.0,0.0,Unknown,Unknown,Unknown,Unknown,Unknown
_bot_20_n_5,03/05/2015 20:39:02,id eiusmod fugiat ea Duis consequatur 472,0,0.0,0.0,Unknown,Unknown,Unknown,Unknown,Unknown
_bot_20_n_5,03/05/2015 19:41:02,do aute reprehenderit fugiat reprehenderit enim consequat Ut dolore aliquid pariatur vel 430,0,0.0,0.0,Unknown,Unknown,Unknown,Unknown,Unknown
_bot_20_n_5,03/05/2015 18:55:02,ex quis culpa in tempor dolore culpa id illum 170,0,0.0,0.0,Unknown,Unknown,Unknown,Unknown,Unknown
_bot_20_n_5,03/05/2015 18:26:02,aliquid aute voluptate ex commodi voluptate reprehenderit culpa anim nulla 216,0,0.0,0.0,Unknown,Unknown,Unknown,Unknown,Unknown
_bot_20_n_5,03/05/2015 17:46:02,velit reprehenderit eu culpa incididunt consequatur reprehenderit 175,0,0.0,0.0,Unknown,Unknown,Unknown,Unknown,Unknown
_bot_20_n_5,03/05/2015 17:11:02,consequatur qui dolorem nihil et in 242,0,0.0,0.0,Unknown,Unknown,Unknown,Unknown,Unknown
_bot_20_n_5,03/05/2015 16:18:02,qui cupidatat occaecat ea cillum autem 912,0,0.0,0.0,Unknown,Unknown,Unknown,Unknown,Unknown
_bot_20_n_5,03/05/2015 14:58:02,et Excepteur amet in nihil anim ut ad 937,0,0.0,0.0,Unknown,Unknown,Unknown,Unknown,Unknown
_bot_20_n_5,03/05/2015 14:21:02,tempor aute nostrud nihil ut eum sed velit et 578,0,0.0,0.0,Unknown,Unknown,Unknown,Unknown,Unknown
_bot_20_n_5,03/05/2015 12:16:02,velit pariatur officia adipiscing labore dolore cillum nisi sed 737,0,0.0,0.0,Unknown,Unknown,Unknown,Unknown,Unknown
_bot_20_n_5,03/05/2015 10:59:02,Lorem amet pariatur ut cupidatat fugiat velit magna fugiat qui 559,0,0.0,0.0,Unknown,Unknown,Unknown,Unknown,Unknown
_bot_20_n_5,03/05/2015 09:01:02,commodi ea id pariatur voluptas veniam Quis labore deserunt occaecat 597,0,0.0,0.0,Unknown,Unknown,Unknown,Unknown,Unknown
_bot_20_n_5,03/05/2015 08:50:02,anim voluptate labore Quis dolore esse Excepteur occaecat dolorem 405,0,0.0,0.0,Unknown,Unknown,Unknown,Unknown,Unknown
_bot_20_n_5,03/05/2015 08:29:02,velit in ea esse in Duis laboris velit 159,0,0.0,0.0,Unknown,Unknown,Unknown,Unknown,Unknown
_bot_20_n_5,03/05/2015 07:28:02,proident dolor enim labore veniam qui laborum voluptas ullamco aliquip aliqua 880,0,0.0,0.0,Unknown,Unknown,Unknown,Unknown,Unknown
_bot_20_n_5,03/05/2015 05:28:02,deserunt pariatur Ut in in ea consectetur 668,0,0.0,0.0,Unknown,Unknown,Unknown,Unknown,Unknown
_bot_20_n_5,03/05/2015 03:33:02,cillum dolor reprehenderit magna laboris nulla Duis dolor eum Excepteur quam ut 512,0,0.0,0.0,Unknown,Unknown,Unknown,Unknown,Unknown
_bot_20_n_5,03/05/2015 02:12:02,ea elit ut qui nisi esse cillum ut nihil sint quo est 28,0,0.0,0.0,Unknown,Unknown,Unknown,Unknown,Unknown
