_bot_fixed_5_n_5,29/10/2014 06:36:46,eiusmod exercitation illum aliqua consectetur cupidatat 472,0,0.0,0.0,Unknown,Unknown,Unknown,Unknown
_bot_fixed_5_n_5,28/10/2014 16:45:46,do cillum nihil anim qui do officia officia 559,0,0.0,0.0,Unknown,Unknown,Unknown,Unknown
_bot_fixed_5_n_5,28/10/2014 02:54:46,ullamco consectetur consequatur fugiat deserunt quis ea in 15,0,0.0,0.0,Unknown,Unknown,Unknown,Unknown
_bot_fixed_5_n_5,27/10/2014 13:03:46,dolorem id do nostrud qui quam nulla occaecat est esse nulla 184,0,0.0,0.0,Unknown,Unknown,Unknown,Unknown
_bot_fixed_5_n_5,26/10/2014 23:12:46,eum eu qui sit aute nulla Lorem minim sunt 6,0,0.0,0.0,Unknown,Unknown,Unknown,Unknown
_bot_fixed_5_n_5,26/10/2014 09:21:46,commodi eum quis voluptate ut exercitation sunt esse et qui quo velit 519,0,0.0,0.0,Unknown,Unknown,Unknown,Unknown
_bot_fixed_5_n_5,25/10/2014 19:30:46,qui eu voluptate culpa ipsum esse tempor voluptate dolor 175,0,0.0,0.0,Unknown,Unknown,Unknown,Unknown
_bot_fixed_5_n_5,25/10/2014 05:39:46,ut autem Quis tempor eum laboris commodi 690,0,0.0,0.0,Unknown,Unknown,Unknown,Unknown
_bot_fixed_5_n_5,24/10/2014 15:48:46,ex magna nisi sit voluptate est mollit ullamco aliquip eum sint nulla 607,0,0.0,0.0,Unknown,Unknown,Unknown,Unknown
_bot_fixed_5_n_5,24/10/2014 01:57:46,ea in veniam dolore velit enim 243,0,0.0,0.0,Unknown,Unknown,Unknown,Unknown
_bot_fixed_5_n_5,23/10/2014 12:06:46,nisi ut incididunt commodo qui occaecat pariatur 436,0,0.0,0.0,Unknown,Unknown,Unknown,Unknown
_bot_fixed_5_n_5,22/10/2014 22:15:46,ipsum dolore do consequat tempor consectetur esse pariatur 64,0,0.0,0.0,Unknown,Unknown,Unknown,Unknown
_bot_fixed_5_n_5,22/10/2014 08:24:46,occaecat est consequatur elit molestiae molestiae anim vel 670,0,0.0,0.0,Unknown,Unknown,Unknown,Unknown
