_bot_5_mention_n_random_4,16/09/2015 13:02:36,laboris in ea dolor vel quis dolore quam voluptate amet illum incididunt,0,0.0,0.0,Unknown,Unknown,Unknown,Unknown
_bot_5_mention_n_random_4,16/09/2015 12:09:36,@cjfirbduder Lorem sit dolore eiusmod et #eunkuntz 356 #vlzmmmbmi,0,0.0,0.0,Unknown,Unknown,Unknown,Unknown
_bot_5_mention_n_random_4,16/09/2015 11:56:36,aliqua anim id fugiat aute aliqua laborum fugiat amet est sunt,0,0.0,0.0,Unknown,Unknown,Unknown,Unknown
_bot_5_mention_n_random_4,16/09/2015 11:04:36,Excepteur cillum culpa dolor ut Excepteur deserunt aliquip,0,0.0,0.0,Unknown,Unknown,Unknown,Unknown
_bot_5_mention_n_random_4,16/09/2015 10:11:36,@bhmouckmc Lorem sit dolore eiusmod et #eunkuntz 356 #vlzmmmbmi,0,0.0,0.0,Unknown,Unknown,Unknown,Unknown
_bot_5_mention_n_random_4,16/09/2015 09:38:36,anim qui labore cupidatat esse ullamco sunt enim et Ut quo,0,0.0,0.0,Unknown,Unknown,Unknown,Unknown
_bot_5_mention_n_random_4,16/09/2015 08:48:36,@rcupfwc sed ipsum Excepteur proident nostrud vel ea in #pjbhxuo 742 #qkysr,0,0.0,0.0,Unknown,Unknown,Unknown,Unknown
_bot_5_mention_n_random_4,16/09/2015 08:12:36,reprehenderit tempor aliquip proident aute enim quo Ut molestiae amet,0,0.0,0.0,Unknown,Unknown,Unknown,Unknown
_bot_5_mention_n_random_4,16/09/2015 07:26:36,et qui proident est eiusmod consequat amet ea Lorem ea,0,0.0,0.0,Unknown,Unknown,Unknown,Unknown
_bot_5_mention_n_random_4,16/09/2015 07:04:36,cupidatat minim ex illum dolore commodi esse laborum magna molestiae,0,0.0,0.0,Unknown,Unknown,Unknown,Unknown
