_bot_fixed_5_n_5,14/02/2015 04:33:46,reprehenderit nisi ex qui proident velit 457,0,0.0,0.0,Unknown,Unknown,Unknown,Unknown
_bot_fixed_5_n_5,13/02/2015 14:42:46,veniam voluptate dolore Quis anim qui consequatur amet Ut 459,0,0.0,0.0,Unknown,Unknown,Unknown,Unknown
_bot_fixed_5_n_5,13/02/2015 00:51:46,nulla anim occaecat qui non anim do aute 276,0,0.0,0.0,Unknown,Unknown,Unknown,Unknown
_bot_fixed_5_n_5,12/02/2015 11:00:46,labore eu Duis non consequatur ad 918,0,0.0,0.0,Unknown,Unknown,Unknown,Unknown
_bot_fixed_5_n_5,11/02/2015 21:09:46,molestiae nostrud ea ullamco elit deserunt elit do 66,0,0.0,0.0,Unknown,Unknown,Unknown,Unknown
_bot_fixed_5_n_5,11/02/2015 07:18:46,consequat minim exercitation aliqua mollit cupidatat ad aliquid anim eum esse qui 219,0,0.0,0.0,Unknown,Unknown,Unknown,Unknown
_bot_fixed_5_n_5,10/02/2015 17:27:46,enim qui consectetur mollit voluptas do 401,0,0.0,0.0,Unknown,Unknown,Unknown,Unknown
_bot_fixed_5_n_5,10/02/2015 03:36:46,commodi eum cupidatat ut minim amet exercitation non velit quam ea 505,0,0.0,0.0,Unknown,Unknown,Unknown,Unknown
_bot_fixed_5_n_5,09/02/2015 13:45:46,tempor ut ea dolor elit consequat 906,0,0.0,0.0,Unknown,Unknown,Unknown,Unknown
_bot_fixed_5_n_5,08/02/2015 23:54:46,sit est dolor sit fugiat voluptate voluptate fugiat 449,0,0.0,0.0,Unknown,Unknown,Unknown,Unknown
_bot_fixed_5_n_5,08/02/2015 10:03:46,nihil adipiscing quis ad Lorem adipiscing qui pariatur 259,0,0.0,0.0,Unknown,Unknown,Unknown,Unknown
_bot_fixed_5_n_5,07/02/2015 20:12:46,consectetur adipiscing labore ut aliquid pariatur 161,0,0.0,0.0,Unknown,Unknown,Unknown,Unknown
_bot_fixed_5_n_5,07/02/2015 06:21:46,aliquid quam minim aute reprehenderit esse aliqua pariatur in nostrud ullamco 459,0,0.0,0.0,Unknown,Unknown,Unknown,Unknown
_bot_fixed_5_n_5,06/02/2015 16:30:46,consequat ullamco ut nihil Ut fugiat nihil consectetur ex voluptate 555,0,0.0,0.0,Unknown,Unknown,Unknown,Unknown
_bot_fixed_5_n_5,06/02/2015 02:39:46,irure in anim Excepteur incididunt eum 0,0,0.0,0.0,Unknown,Unknown,Unknown,Unknown
_bot_fixed_5_n_5,05/02/2015 12:48:46,qui labore voluptate Excepteur cupidatat molestiae adipiscing nulla laborum et dolore consequatur 998,0,0.0,0.0,Unknown,Unknown,Unknown,Unknown
_bot_fixed_5_n_5,04/02/2015 22:57:46,commodo vel illum aliquid aute sint qui nihil est elit irure voluptate 148,0,0.0,0.0,Unknown,Unknown,Unknown,Unknown
_bot_fixed_5_n_5,04/02/2015 09:06:46,cillum in ad ipsum dolor pariatur Quis nisi officia 216,0,0.0,0.0,Unknown,Unknown,Unknown,Unknown
_bot_fixed_5_n_5,03/02/2015 19:15:46,eum occaecat ea sed ut commodi veniam dolore 624,0,0.0,0.0,Unknown,Unknown,Unknown,Unknown
_bot_fixed_5_n_5,03/02/2015 05:24:46,pariatur nostrud et eu incididunt dolor et commodo aliquip est fugiat cillum 630,0,0.0,0.0,Unknown,Unknown,Unknown,Unknown
_bot_fixed_5_n_5,02/02/2015 15:33:46,incididunt deserunt esse in ut in sed minim minim 181,0,0.0,0.0,Unknown,Unknown,Unknown,Unknown
_bot_fixed_5_n_5,02/02/2015 01:42:46,sit esse nisi qui illum laboris esse irure magna ut commodi 480,0,0.0,0.0,Unknown,Unknown,Unknown,Unknown
_bot_fixed_5_n_5,01/02/2015 11:51:46,in nulla voluptate aliquid eum ut deserunt 547,0,0.0,0.0,Unknown,Unknown,Unknown,Unknown
_bot_fixed_5_n_5,31/01/2015 22:00:46,enim ut illum Ut consequatur commodo 997,0,0.0,0.0,Unknown,Unknown,Unknown,Unknown
_bot_fixed_5_n_5,31/01/2015 08:09:46,ex ea quam quam non nisi ut dolore 110,0,0.0,0.0,Unknown,Unknown,Unknown,Unknown
_bot_fixed_5_n_5,30/01/2015 18:18:46,sunt pariatur nulla id in consectetur consequat ut reprehenderit vel eum 746,0,0.0,0.0,Unknown,Unknown,Unknown,Unknown
_bot_fixed_5_n_5,30/01/2015 04:27:46,mollit occaecat vel in quis deserunt eu exercitation quo ea 696,0,0.0,0.0,Unknown,Unknown,Unknown,Unknown
_bot_fixed_5_n_5,29/01/2015 14:36:46,eu voluptate pariatur proident nisi nisi magna dolore Ut commodi 771,0,0.0,0.0,Unknown,Unknown,Unknown,Unknown
_bot_fixed_5_n_5,29/01/2015 00:45:46,cillum eum nostrud minim sunt sit voluptas 646,0,0.0,0.0,Unknown,Unknown,Unknown,Unknown
_bot_fixed_5_n_5,28/01/2015 10:54:46,vel nulla eiusmod dolor laboris deserunt dolorem consequatur 989,0,0.0,0.0,Unknown,Unknown,Unknown,Unknown
_bot_fixed_5_n_5,27/01/2015 21:03:46,mollit nihil proident tempor quam sit molestiae 8,0,0.0,0.0,Unknown,Unknown,Unknown,Unknown
_bot_fixed_5_n_5,27/01/2015 07:12:46,Lorem in eum irure voluptate in cupidatat aute ea in ut 903,0,0.0,0.0,Unknown,Unknown,Unknown,Unknown
_bot_fixed_5_n_5,26/01/2015 17:21:46,culpa fugiat irure quo occaecat eu dolor 955,0,0.0,0.0,Unknown,Unknown,Unknown,Unknown
_bot_fixed_5_n_5,26/01/2015 03:30:46,eum exercitation vel veniam Quis est mollit non qui amet 607,0,0.0,0.0,Unknown,Unknown,Unknown,Unknown
_bot_fixed_5_n_5,25/01/2015 13:39:46,officia ipsum commodi sed aliquip velit quam enim vel dolor 296,0,0.0,0.0,Unknown,Unknown,Unknown,Unknown
_bot_fixed_5_n_5,24/01/2015 23:48:46,incididunt pariatur ipsum dolor dolor incididunt deserunt dolor ea 634,0,0.0,0.0,Unknown,Unknown,Unknown,Unknown
_bot_fixed_5_n_5,24/01/2015 09:57:46,est proident eum Duis nihil voluptas veniam eum 39,0,0.0,0.0,Unknown,Unknown,Unknown,Unknown
_bot_fixed_5_n_5,23/01/2015 20:06:46,officia tempor dolor quo cupidatat molestiae occaecat nisi voluptas 364,0,0.0,0.0,Unknown,Unknown,Unknown,Unknown
_bot_fixed_5_n_5,23/01/2015 06:15:46,esse ad esse Quis commodi ea iure qui vel 247,0,0.0,0.0,Unknown,Unknown,Unknown,Unknown
_bot_fixed_5_n_5,22/01/2015 16:24:46,in consequat dolore ea reprehenderit quis culpa et 984,0,0.0,0.0,Unknown,Unknown,Unknown,Unknown
_bot_fixed_5_n_5,22/01/2015 02:33:46,pariatur laboris consequat aliqua sunt est laborum irure sunt esse 967,0,0.0,0.0,Unknown,Unknown,Unknown,Unknown
_bot_fixed_5_n_5,21/01/2015 12:42:46,esse in incididunt culpa proident voluptate Quis ipsum ex dolore velit 887,0,0.0,0.0,Unknown,Unknown,Unknown,Unknown
_bot_fixed_5_n_5,20/01/2015 22:51:46,eum quam qui nulla ea mollit enim fugiat culpa 33,0,0.0,0.0,Unknown,Unknown,Unknown,Unknown
_bot_fixed_5_n_5,20/01/2015 09:00:46,laborum fugiat id ipsum aliquip culpa quo enim commodo 631,0,0.0,0.0,Unknown,Unknown,Unknown,Unknown
_bot_fixed_5_n_5,19/01/2015 19:09:46,in autem ut nostrud proident est 893,0,0.0,0.0,Unknown,Unknown,Unknown,Unknown
_bot_fixed_5_n_5,19/01/2015 05:18:46,voluptate ipsum deserunt culpa quam dolorem esse Excepteur nostrud 508,0,0.0,0.0,Unknown,Unknown,Unknown,Unknown
_bot_fixed_5_n_5,18/01/2015 15:27:46,pariatur Quis nisi qui nisi magna pariatur incididunt esse 924,0,0.0,0.0,Unknown,Unknown,Unknown,Unknown
_bot_fixed_5_n_5,18/01/2015 01:36:46,adipiscing deserunt Ut in dolore esse nostrud nulla amet quo ullamco 624,0,0.0,0.0,Unknown,Unknown,Unknown,Unknown
_bot_fixed_5_n_5,17/01/2015 11:45:46,reprehenderit consequatur culpa vel eiusmod sunt quam 184,0,0.0,0.0,Unknown,Unknown,Unknown,Unknown
_bot_fixed_5_n_5,16/01/2015 21:54:46,eum ea Lorem elit officia voluptate amet labore 689,0,0.0,0.0,Unknown,Unknown,Unknown,Unknown
_bot_fixed_5_n_5,16/01/2015 08:03:46,officia pariatur dolor dolor in dolore nisi aliquip dolor in eu 555,0,0.0,0.0,Unknown,Unknown,Unknown,Unknown
_bot_fixed_5_n_5,15/01/2015 18:12:46,iure Duis nulla illum ullamco quam qui qui 849,0,0.0,0.0,Unknown,Unknown,Unknown,Unknown
_bot_fixed_5_n_5,15/01/2015 04:21:46,officia quis occaecat qui in velit cillum sunt nisi irure est in 577,0,0.0,0.0,Unknown,Unknown,Unknown,Unknown
_bot_fixed_5_n_5,14/01/2015 14:30:46,nulla eum aliquip eum anim in eu dolore adipiscing 937,0,0.0,0.0,Unknown,Unknown,Unknown,Unknown
_bot_fixed_5_n_5,14/01/2015 00:39:46,non id anim eu eiusmod eum dolore eiusmod aliquip consequatur 430,0,0.0,0.0,Unknown,Unknown,Unknown,Unknown
_bot_fixed_5_n_5,13/01/2015 10:48:46,deserunt veniam eiusmod sit eiusmod in voluptate cillum fugiat dolore dolor ex 381,0,0.0,0.0,Unknown,Unknown,Unknown,Unknown
_bot_fixed_5_n_5,12/01/2015 20:57:46,cillum adipiscing illum in aute velit adipiscing 919,0,0.0,0.0,Unknown,Unknown,Unknown,Unknown
_bot_fixed_5_n_5,12/01/2015 07:06:46,vel vel vel do quo velit velit 823,0,0.0,0.0,Unknown,Unknown,Unknown,Unknown
_bot_fixed_5_n_5,11/01/2015 17:15:46,esse qui minim nisi velit eum amet est in dolor ut quo 554,0,0.0,0.0,Unknown,Unknown,Unknown,Unknown
_bot_fixed_5_n_5,11/01/2015 03:24:46,deserunt Excepteur enim mollit fugiat eum officia nostrud commodo 975,0,0.0,0.0,Unknown,Unknown,Unknown,Unknown
_bot_fixed_5_n_5,10/01/2015 13:33:46,cillum nihil dolore proident pariatur iure voluptate 870,0,0.0,0.0,Unknown,Unknown,Unknown,Unknown
_bot_fixed_5_n_5,09/01/2015 23:42:46,ea molestiae in esse aliquip in adipiscing 315,0,0.0,0.0,Unknown,Unknown,Unknown,Unknown
_bot_fixed_5_n_5,09/01/2015 09:51:46,pariatur Quis voluptas aliquid pariatur incididunt anim nisi minim dolorem reprehenderit 452,0,0.0,0.0,Unknown,Unknown,Unknown,Unknown
_bot_fixed_5_n_5,08/01/2015 20:00:46,quis deserunt voluptate vel in cupidatat voluptas veniam vel laborum amet dolorem 356,0,0.0,0.0,Unknown,Unknown,Unknown,Unknown
_bot_fixed_5_n_5,08/01/2015 06:09:46,consequatur consectetur nulla dolore qui proident vel dolor vel 798,0,0.0,0.0,Unknown,Unknown,Unknown,Unknown
_bot_fixed_5_n_5,07/01/2015 16:18:46,sit ipsum illum qui exercitation vel ipsum Lorem Quis aliqua enim 303,0,0.0,0.0,Unknown,Unknown,Unknown,Unknown
_bot_fixed_5_n_5,07/01/2015 02:27:46,commodi Lorem ex illum ipsum eum labore dolor incididunt ut enim 99,0,0.0,0.0,Unknown,Unknown,Unknown,Unknown
_bot_fixed_5_n_5,06/01/2015 12:36:46,enim aliquip magna esse Duis et aliquip velit cillum exercitation dolor cillum 494,0,0.0,0.0,Unknown,Unknown,Unknown,Unknown
_bot_fixed_5_n_5,05/01/2015 22:45:46,quam Duis commodo Excepteur consequatur deserunt deserunt id in sed commodo ex 544,0,0.0,0.0,Unknown,Unknown,Unknown,Unknown
_bot_fixed_5_n_5,05/01/2015 08:54:46,ut nostrud reprehenderit qui quo magna ut eu non qui qui illum 154,0,0.0,0.0,Unknown,Unknown,Unknown,Unknown
_bot_fixed_5_n_5,04/01/2015 19:03:46,Excepteur ex ullamco fugiat Excepteur eum officia eiusmod anim nihil laborum 758,0,0.0,0.0,Unknown,Unknown,Unknown,Unknown
_bot_fixed_5_n_5,04/01/2015 05:12:46,voluptate iure eu quis culpa ipsum occaecat adipiscing fugiat consequatur et 179,0,0.0,0.0,Unknown,Unknown,Unknown,Unknown
_bot_fixed_5_n_5,03/01/2015 15:21:46,consequat eum ad sunt cupidatat dolor dolor elit 34,0,0.0,0.0,Unknown,Unknown,Unknown,Unknown
_bot_fixed_5_n_5,03/01/2015 01:30:46,quam nisi molestiae consequat labore ipsum veniam 785,0,0.0,0.0,Unknown,Unknown,Unknown,Unknown
_bot_fixed_5_n_5,02/01/2015 11:39:46,eum in id dolore ea Excepteur 105,0,0.0,0.0,Unknown,Unknown,Unknown,Unknown
_bot_fixed_5_n_5,01/01/2015 21:48:46,mollit esse in deserunt dolorem Lorem esse quo mollit commodo 145,0,0.0,0.0,Unknown,Unknown,Unknown,Unknown
_bot_fixed_5_n_5,01/01/2015 07:57:46,veniam officia voluptate nulla esse tempor veniam qui dolor dolor officia 555,0,0.0,0.0,Unknown,Unknown,Unknown,Unknown
_bot_fixed_5_n_5,31/12/2014 18:06:46,velit sint velit deserunt magna in ea labore adipiscing illum nulla incididunt 39,0,0.0,0.0,Unknown,Unknown,Unknown,Unknown
_bot_fixed_5_n_5,31/12/2014 04:15:46,laboris in qui consequat aute labore quis ex 944,0,0.0,0.0,Unknown,Unknown,Unknown,Unknown
_bot_fixed_5_n_5,30/12/2014 14:24:46,non enim nulla fugiat in do occaecat Quis dolorem 361,0,0.0,0.0,Unknown,Unknown,Unknown,Unknown
_bot_fixed_5_n_5,30/12/2014 00:33:46,culpa esse eum voluptas id et mollit pariatur 859,0,0.0,0.0,Unknown,Unknown,Unknown,Unknown
_bot_fixed_5_n_5,29/12/2014 10:42:46,esse incididunt est dolor nostrud ea commodo est consectetur 652,0,0.0,0.0,Unknown,Unknown,Unknown,Unknown
_bot_fixed_5_n_5,28/12/2014 20:51:46,dolor id do ut eum fugiat iure ea 103,0,0.0,0.0,Unknown,Unknown,Unknown,Unknown
_bot_fixed_5_n_5,28/12/2014 07:00:46,cupidatat molestiae incididunt quis tempor proident Excepteur reprehenderit enim qui in ipsum 872,0,0.0,0.0,Unknown,Unknown,Unknown,Unknown
_bot_fixed_5_n_5,27/12/2014 17:09:46,laborum quam pariatur molestiae consequat laboris nisi culpa in non 972,0,0.0,0.0,Unknown,Unknown,Unknown,Unknown
_bot_fixed_5_n_5,27/12/2014 03:18:46,vel ad quis tempor anim vel commodo 569,0,0.0,0.0,Unknown,Unknown,Unknown,Unknown
_bot_fixed_5_n_5,26/12/2014 13:27:46,dolorem Excepteur eum ex adipiscing sit 993,0,0.0,0.0,Unknown,Unknown,Unknown,Unknown
_bot_fixed_5_n_5,25/12/2014 23:36:46,non enim dolor consectetur cillum amet qui sint aliqua 711,0,0.0,0.0,Unknown,Unknown,Unknown,Unknown
_bot_fixed_5_n_5,25/12/2014 09:45:46,aute elit vel pariatur Duis vel exercitation ea laboris tempor eu 345,0,0.0,0.0,Unknown,Unknown,Unknown,Unknown
_bot_fixed_5_n_5,24/12/2014 19:54:46,occaecat eu mollit est elit autem ut 837,0,0.0,0.0,Unknown,Unknown,Unknown,Unknown
_bot_fixed_5_n_5,24/12/2014 06:03:46,esse dolore voluptate molestiae voluptate nihil nisi qui cupidatat qui 978,0,0.0,0.0,Unknown,Unknown,Unknown,Unknown
_bot_fixed_5_n_5,23/12/2014 16:12:46,aliquip ut dolor tempor reprehenderit esse in ad tempor sunt 140,0,0.0,0.0,Unknown,Unknown,Unknown,Unknown
_bot_fixed_5_n_5,23/12/2014 02:21:46,in elit nisi Ut in nisi 974,0,0.0,0.0,Unknown,Unknown,Unknown,Unknown
_bot_fixed_5_n_5,22/12/2014 12:30:46,officia fugiat ex esse ut nihil Ut 532,0,0.0,0.0,Unknown,Unknown,Unknown,Unknown
_bot_fixed_5_n_5,21/12/2014 22:39:46,veniam voluptas quis Excepteur dolore in ut quam sunt minim est 357,0,0.0,0.0,Unknown,Unknown,Unknown,Unknown
_bot_fixed_5_n_5,21/12/2014 08:48:46,Excepteur eum amet enim sint minim magna pariatur velit commodo voluptas 25,0,0.0,0.0,Unknown,Unknown,Unknown,Unknown
_bot_fixed_5_n_5,20/12/2014 18:57:46,dolore fugiat in sit elit molestiae voluptas 827,0,0.0,0.0,Unknown,Unknown,Unknown,Unknown
_bot_fixed_5_n_5,20/12/2014 05:06:46,sit anim in elit eum fugiat 165,0,0.0,0.0,Unknown,Unknown,Unknown,Unknown
_bot_fixed_5_n_5,19/12/2014 15:15:46,aliquip ullamco nostrud dolore illum aliqua ipsum exercitation sit Ut autem Excepteur 458,0,0.0,0.0,Unknown,Unknown,Unknown,Unknown
_bot_fixed_5_n_5,19/12/2014 01:24:46,aute ipsum id ut eu ad 273,0,0.0,0.0,Unknown,Unknown,Unknown,Unknown
_bot_fixed_5_n_5,18/12/2014 11:33:46,nihil ea anim pariatur amet ex vel incididunt laborum qui consequatur 535,0,0.0,0.0,Unknown,Unknown,Unknown,Unknown
_bot_fixed_5_n_5,17/12/2014 21:42:46,ad Quis quis autem dolor ut irure velit ut 657,0,0.0,0.0,Unknown,Unknown,Unknown,Unknown
_bot_fixed_5_n_5,17/12/2014 07:51:46,in anim sit sed velit ex ut consequat nulla laboris esse quam 766,0,0.0,0.0,Unknown,Unknown,Unknown,Unknown
_bot_fixed_5_n_5,16/12/2014 18:00:46,labore Duis dolorem aliqua consequatur pariatur vel proident 56,0,0.0,0.0,Unknown,Unknown,Unknown,Unknown
_bot_fixed_5_n_5,16/12/2014 04:09:46,dolor quam voluptas quo et quis commodi amet laborum dolore 766,0,0.0,0.0,Unknown,Unknown,Unknown,Unknown
_bot_fixed_5_n_5,15/12/2014 14:18:46,officia in irure fugiat fugiat amet commodi minim 981,0,0.0,0.0,Unknown,Unknown,Unknown,Unknown
_bot_fixed_5_n_5,15/12/2014 00:27:46,illum sunt commodo consectetur ut Duis fugiat id 955,0,0.0,0.0,Unknown,Unknown,Unknown,Unknown
_bot_fixed_5_n_5,14/12/2014 10:36:46,Ut vel qui quo Duis in 743,0,0.0,0.0,Unknown,Unknown,Unknown,Unknown
_bot_fixed_5_n_5,13/12/2014 20:45:46,ut dolore ea est dolore ut exercitation deserunt velit fugiat 779,0,0.0,0.0,Unknown,Unknown,Unknown,Unknown
_bot_fixed_5_n_5,13/12/2014 06:54:46,qui vel velit Duis quam commodi 558,0,0.0,0.0,Unknown,Unknown,Unknown,Unknown
_bot_fixed_5_n_5,12/12/2014 17:03:46,sunt ut dolor iure deserunt aliquip eum deserunt culpa ipsum eum 186,0,0.0,0.0,Unknown,Unknown,Unknown,Unknown
_bot_fixed_5_n_5,12/12/2014 03:12:46,consequatur consequatur voluptas ex esse elit Quis ad laborum aliquid nostrud 565,0,0.0,0.0,Unknown,Unknown,Unknown,Unknown
_bot_fixed_5_n_5,11/12/2014 13:21:46,tempor qui voluptate velit voluptas ut vel 460,0,0.0,0.0,Unknown,Unknown,Unknown,Unknown
_bot_fixed_5_n_5,10/12/2014 23:30:46,laborum vel labore ut nisi ut 642,0,0.0,0.0,Unknown,Unknown,Unknown,Unknown
_bot_fixed_5_n_5,10/12/2014 09:39:46,in quam deserunt in Duis velit vel 401,0,0.0,0.0,Unknown,Unknown,Unknown,Unknown
_bot_fixed_5_n_5,09/12/2014 19:48:46,autem Lorem fugiat quo culpa tempor sit quo nulla pariatur 85,0,0.0,0.0,Unknown,Unknown,Unknown,Unknown
_bot_fixed_5_n_5,09/12/2014 05:57:46,consequatur labore deserunt elit culpa qui 489,0,0.0,0.0,Unknown,Unknown,Unknown,Unknown
_bot_fixed_5_n_5,08/12/2014 16:06:46,officia quis Duis pariatur cillum aliquid molestiae 996,0,0.0,0.0,Unknown,Unknown,Unknown,Unknown
_bot_fixed_5_n_5,08/12/2014 02:15:46,commodo ullamco Duis consequatur nostrud velit nostrud ex 691,0,0.0,0.0,Unknown,Unknown,Unknown,Unknown
_bot_fixed_5_n_5,07/12/2014 12:24:46,cillum quam in deserunt nihil aliquip id velit reprehenderit velit id reprehenderit 264,0,0.0,0.0,Unknown,Unknown,Unknown,Unknown
_bot_fixed_5_n_5,06/12/2014 22:33:46,quis veniam qui elit occaecat ex 267,0,0.0,0.0,Unknown,Unknown,Unknown,Unknown
_bot_fixed_5_n_5,06/12/2014 08:42:46,consequatur nisi cillum consectetur nisi laborum sed ullamco consequatur 97,0,0.0,0.0,Unknown,Unknown,Unknown,Unknown
_bot_fixed_5_n_5,05/12/2014 18:51:46,nisi pariatur qui consequatur consequat reprehenderit in ipsum mollit tempor quis 745,0,0.0,0.0,Unknown,Unknown,Unknown,Unknown
_bot_fixed_5_n_5,05/12/2014 05:00:46,ea dolorem mollit veniam nisi enim esse quis 835,0,0.0,0.0,Unknown,Unknown,Unknown,Unknown
_bot_fixed_5_n_5,04/12/2014 15:09:46,proident pariatur adipiscing Duis fugiat sit qui 568,0,0.0,0.0,Unknown,Unknown,Unknown,Unknown
_bot_fixed_5_n_5,04/12/2014 01:18:46,eum fugiat dolore et dolor in 767,0,0.0,0.0,Unknown,Unknown,Unknown,Unknown
_bot_fixed_5_n_5,03/12/2014 11:27:46,incididunt reprehenderit vel eu quis dolore cillum incididunt anim culpa 861,0,0.0,0.0,Unknown,Unknown,Unknown,Unknown
_bot_fixed_5_n_5,02/12/2014 21:36:46,consequatur et incididunt non non adipiscing consequatur 855,0,0.0,0.0,Unknown,Unknown,Unknown,Unknown
_bot_fixed_5_n_5,02/12/2014 07:45:46,exercitation dolorem eiusmod nisi exercitation dolor est enim aliqua velit aute 769,0,0.0,0.0,Unknown,Unknown,Unknown,Unknown
_bot_fixed_5_n_5,01/12/2014 17:54:46,dolor ipsum minim ex ipsum do molestiae quis Ut nisi non occaecat 472,0,0.0,0.0,Unknown,Unknown,Unknown,Unknown
_bot_fixed_5_n_5,01/12/2014 04:03:46,iure aute eum velit aliqua exercitation velit quam irure 60,0,0.0,0.0,Unknown,Unknown,Unknown,Unknown
_bot_fixed_5_n_5,30/11/2014 14:12:46,molestiae in ex dolorem laborum est qui qui voluptate qui nulla 232,0,0.0,0.0,Unknown,Unknown,Unknown,Unknown
_bot_fixed_5_n_5,30/11/2014 00:21:46,deserunt qui nostrud cillum eum in nisi ullamco eu 686,0,0.0,0.0,Unknown,Unknown,Unknown,Unknown
_bot_fixed_5_n_5,29/11/2014 10:30:46,pariatur aliquid dolorem aliquip Excepteur cillum esse nulla reprehenderit 496,0,0.0,0.0,Unknown,Unknown,Unknown,Unknown
_bot_fixed_5_n_5,28/11/2014 20:39:46,esse velit ea do in reprehenderit pariatur non occaecat pariatur est dolore 869,0,0.0,0.0,Unknown,Unknown,Unknown,Unknown
_bot_fixed_5_n_5,28/11/2014 06:48:46,veniam et sit est eum dolore 560,0,0.0,0.0,Unknown,Unknown,Unknown,Unknown
_bot_fixed_5_n_5,27/11/2014 16:57:46,aliquip ex qui nulla consequat non nulla nulla eu sit qui qui 15,0,0.0,0.0,Unknown,Unknown,Unknown,Unknown
_bot_fixed_5_n_5,27/11/2014 03:06:46,Excepteur Duis quis consequat quam tempor dolorem 800,0,0.0,0.0,Unknown,Unknown,Unknown,Unknown
_bot_fixed_5_n_5,26/11/2014 13:15:46,dolor elit do dolore ut voluptate 577,0,0.0,0.0,Unknown,Unknown,Unknown,Unknown
_bot_fixed_5_n_5,25/11/2014 23:24:46,fugiat ex voluptate iure laborum ea 833,0,0.0,0.0,Unknown,Unknown,Unknown,Unknown
_bot_fixed_5_n_5,25/11/2014 09:33:46,tempor enim ut quis qui ad esse sit voluptas 413,0,0.0,0.0,Unknown,Unknown,Unknown,Unknown
_bot_fixed_5_n_5,24/11/2014 19:42:46,nulla consequatur ex incididunt magna voluptas ullamco eiusmod 188,0,0.0,0.0,Unknown,Unknown,Unknown,Unknown
_bot_fixed_5_n_5,24/11/2014 05:51:46,aliquid in sed enim dolore Excepteur esse velit ullamco 385,0,0.0,0.0,Unknown,Unknown,Unknown,Unknown
_bot_fixed_5_n_5,23/11/2014 16:00:46,in in aliquip voluptate deserunt sunt 277,0,0.0,0.0,Unknown,Unknown,Unknown,Unknown
_bot_fixed_5_n_5,23/11/2014 02:09:46,sit nostrud mollit velit nostrud reprehenderit non 258,0,0.0,0.0,Unknown,Unknown,Unknown,Unknown
_bot_fixed_5_n_5,22/11/2014 12:18:46,ipsum in in pariatur Excepteur incididunt voluptate anim culpa nulla enim molestiae 364,0,0.0,0.0,Unknown,Unknown,Unknown,Unknown
_bot_fixed_5_n_5,21/11/2014 22:27:46,mollit laborum consequatur nulla elit et consectetur 94,0,0.0,0.0,Unknown,Unknown,Unknown,Unknown
_bot_fixed_5_n_5,21/11/2014 08:36:46,dolore cupidatat eu Excepteur exercitation pariatur velit enim in in ea dolor 438,0,0.0,0.0,Unknown,Unknown,Unknown,Unknown
_bot_fixed_5_n_5,20/11/2014 18:45:46,officia elit dolore in molestiae officia in illum Lorem eu reprehenderit 895,0,0.0,0.0,Unknown,Unknown,Unknown,Unknown
_bot_fixed_5_n_5,20/11/2014 04:54:46,consequatur nulla illum eum aliqua ex qui dolore 399,0,0.0,0.0,Unknown,Unknown,Unknown,Unknown
_bot_fixed_5_n_5,19/11/2014 15:03:46,consequatur quam non irure nisi dolore commodo et esse commodi nostrud ea 527,0,0.0,0.0,Unknown,Unknown,Unknown,Unknown
_bot_fixed_5_n_5,19/11/2014 01:12:46,sit dolorem ea ea Quis aliquip anim 175,0,0.0,0.0,Unknown,Unknown,Unknown,Unknown
_bot_fixed_5_n_5,18/11/2014 11:21:46,deserunt vel Duis eum aute qui nulla consectetur esse pariatur 255,0,0.0,0.0,Unknown,Unknown,Unknown,Unknown
_bot_fixed_5_n_5,17/11/2014 21:30:46,nulla est sunt sed in ex pariatur ea elit voluptas 594,0,0.0,0.0,Unknown,Unknown,Unknown,Unknown
_bot_fixed_5_n_5,17/11/2014 07:39:46,cillum adipiscing do minim dolor in fugiat 91,0,0.0,0.0,Unknown,Unknown,Unknown,Unknown
_bot_fixed_5_n_5,16/11/2014 17:48:46,ea consequatur deserunt esse dolorem est 727,0,0.0,0.0,Unknown,Unknown,Unknown,Unknown
_bot_fixed_5_n_5,16/11/2014 03:57:46,voluptas consequatur ullamco irure ullamco reprehenderit 126,0,0.0,0.0,Unknown,Unknown,Unknown,Unknown
_bot_fixed_5_n_5,15/11/2014 14:06:46,do fugiat do aliquip nisi consectetur 734,0,0.0,0.0,Unknown,Unknown,Unknown,Unknown
_bot_fixed_5_n_5,15/11/2014 00:15:46,deserunt deserunt eu qui reprehenderit illum 932,0,0.0,0.0,Unknown,Unknown,Unknown,Unknown
_bot_fixed_5_n_5,14/11/2014 10:24:46,nulla qui pariatur non ut eum 669,0,0.0,0.0,Unknown,Unknown,Unknown,Unknown
_bot_fixed_5_n_5,13/11/2014 20:33:46,cupidatat dolore amet cillum qui enim elit ea quo nulla 283,0,0.0,0.0,Unknown,Unknown,Unknown,Unknown
_bot_fixed_5_n_5,13/11/2014 06:42:46,cupidatat in sint magna exercitation ut commodo velit 744,0,0.0,0.0,Unknown,Unknown,Unknown,Unknown
_bot_fixed_5_n_5,12/11/2014 16:51:46,magna laborum esse fugiat ut elit 684,0,0.0,0.0,Unknown,Unknown,Unknown,Unknown
_bot_fixed_5_n_5,12/11/2014 03:00:46,ea qui sunt velit in id adipiscing culpa ullamco 754,0,0.0,0.0,Unknown,Unknown,Unknown,Unknown
_bot_fixed_5_n_5,11/11/2014 13:09:46,culpa sunt dolore in fugiat id vel eu 406,0,0.0,0.0,Unknown,Unknown,Unknown,Unknown
_bot_fixed_5_n_5,10/11/2014 23:18:46,incididunt qui dolorem culpa voluptate Ut sit tempor minim voluptate amet id 505,0,0.0,0.0,Unknown,Unknown,Unknown,Unknown
_bot_fixed_5_n_5,10/11/2014 09:27:46,ex Duis deserunt mollit qui vel eu fugiat aliquid 732,0,0.0,0.0,Unknown,Unknown,Unknown,Unknown
_bot_fixed_5_n_5,09/11/2014 19:36:46,vel mollit Excepteur voluptate molestiae reprehenderit pariatur 31,0,0.0,0.0,Unknown,Unknown,Unknown,Unknown
_bot_fixed_5_n_5,09/11/2014 05:45:46,Excepteur tempor vel aliquip mollit velit 835,0,0.0,0.0,Unknown,Unknown,Unknown,Unknown
_bot_fixed_5_n_5,08/11/2014 15:54:46,ea ut anim est autem eum reprehenderit in aliquid 922,0,0.0,0.0,Unknown,Unknown,Unknown,Unknown
_bot_fixed_5_n_5,08/11/2014 02:03:46,ea vel autem ea in esse nisi ullamco ut in qui autem 416,0,0.0,0.0,Unknown,Unknown,Unknown,Unknown
_bot_fixed_5_n_5,07/11/2014 12:12:46,aliquid pariatur dolorem nihil quis Ut anim adipiscing commodi mollit dolorem cupidatat 27,0,0.0,0.0,Unknown,Unknown,Unknown,Unknown
_bot_fixed_5_n_5,06/11/2014 22:21:46,reprehenderit nostrud voluptate culpa sit fugiat enim sint 445,0,0.0,0.0,Unknown,Unknown,Unknown,Unknown
_bot_fixed_5_n_5,06/11/2014 08:30:46,consequat commodi in eum sunt Quis dolorem 888,0,0.0,0.0,Unknown,Unknown,Unknown,Unknown
_bot_fixed_5_n_5,05/11/2014 18:39:46,aliqua sint Lorem illum eiusmod dolor ut dolorem 999,0,0.0,0.0,Unknown,Unknown,Unknown,Unknown
_bot_fixed_5_n_5,05/11/2014 04:48:46,deserunt laboris culpa voluptas cillum anim 74,0,0.0,0.0,Unknown,Unknown,Unknown,Unknown
_bot_fixed_5_n_5,04/11/2014 14:57:46,nostrud autem adipiscing pariatur ipsum eu minim in Duis 975,0,0.0,0.0,Unknown,Unknown,Unknown,Unknown
_bot_fixed_5_n_5,04/11/2014 01:06:46,velit eum laboris molestiae voluptate non ipsum 327,0,0.0,0.0,Unknown,Unknown,Unknown,Unknown
_bot_fixed_5_n_5,03/11/2014 11:15:46,voluptas illum in dolor quis esse in id quam 241,0,0.0,0.0,Unknown,Unknown,Unknown,Unknown
_bot_fixed_5_n_5,02/11/2014 21:24:46,labore Duis nostrud velit aliquid anim Lorem nulla reprehenderit ipsum in 443,0,0.0,0.0,Unknown,Unknown,Unknown,Unknown
_bot_fixed_5_n_5,02/11/2014 07:33:46,pariatur ea tempor consequat pariatur occaecat do ea dolor qui anim laboris 820,0,0.0,0.0,Unknown,Unknown,Unknown,Unknown
_bot_fixed_5_n_5,01/11/2014 17:42:46,consequat sit sint dolore dolore autem nulla ea veniam laboris sit occaecat 233,0,0.0,0.0,Unknown,Unknown,Unknown,Unknown
_bot_fixed_5_n_5,01/11/2014 03:51:46,voluptate id esse aliquid non fugiat 222,0,0.0,0.0,Unknown,Unknown,Unknown,Unknown
_bot_fixed_5_n_5,31/10/2014 14:00:46,qui quis velit amet officia velit in minim dolore reprehenderit est 350,0,0.0,0.0,Unknown,Unknown,Unknown,Unknown
_bot_fixed_5_n_5,31/10/2014 00:09:46,commodi reprehenderit esse commodo ea magna magna molestiae 106,0,0.0,0.0,Unknown,Unknown,Unknown,Unknown
_bot_fixed_5_n_5,30/10/2014 10:18:46,consequatur iure non velit amet consequat irure 566,0,0.0,0.0,Unknown,Unknown,Unknown,Unknown
_bot_fixed_5_n_5,29/10/2014 20:27:46,culpa pariatur ea eiusmod aliqua velit vel 61,0,0.0,0.0,Unknown,Unknown,Unknown,Unknown
