_bot_20_n_3,21/06/2015 13:29:02,iure ut in quam velit voluptate 530,0,0.0,0.0,Unknown,Unknown,Unknown,Unknown
_bot_20_n_3,21/06/2015 09:57:02,ut cillum fugiat aute proident aliquid exercitation quam eiusmod laboris eu pariatur 283,0,0.0,0.0,Unknown,Unknown,Unknown,Unknown
_bot_20_n_3,21/06/2015 04:16:02,nostrud eiusmod illum deserunt in proident laborum sint qui iure quis ea 934,0,0.0,0.0,Unknown,Unknown,Unknown,Unknown
_bot_20_n_3,20/06/2015 23:21:02,proident nisi ea eum quo deserunt sed amet ut 597,0,0.0,0.0,Unknown,Unknown,Unknown,Unknown
_bot_20_n_3,20/06/2015 21:31:02,voluptate eu esse laborum sunt occaecat 652,0,0.0,0.0,Unknown,Unknown,Unknown,Unknown
_bot_20_n_3,20/06/2015 21:00:02,dolor exercitation anim nisi labore aute molestiae velit nulla reprehenderit velit 384,0,0.0,0.0,Unknown,Unknown,Unknown,Unknown
