_bot_5_n_2,04/09/2015 19:28:10,ut dolore velit pariatur dolor minim ea laborum culpa adipiscing aliquip 821,0,0.0,0.0,Unknown,Unknown,Unknown,Unknown,Unknown
_bot_5_n_2,04/09/2015 16:32:10,Duis commodo ex ex voluptate nulla dolore 623,0,0.0,0.0,Unknown,Unknown,Unknown,Unknown,Unknown
_bot_5_n_2,04/09/2015 12:42:10,voluptas esse magna laboris laboris elit eum pariatur ut 53,0,0.0,0.0,Unknown,Unknown,Unknown,Unknown,Unknown
_bot_5_n_2,04/09/2015 10:44:10,voluptate voluptate sit anim sed consectetur esse 584,0,0.0,0.0,Unknown,Unknown,Unknown,Unknown,Unknown
_bot_5_n_2,04/09/2015 08:38:10,in quis nisi dolore veniam mollit nulla 437,0,0.0,0.0,Unknown,Unknown,Unknown,Unknown,Unknown
_bot_5_n_2,04/09/2015 07:35:10,ullamco vel eu ea esse illum commodi ad ad 819,0,0.0,0.0,Unknown,Unknown,Unknown,Unknown,Unknown
_bot_5_n_2,04/09/2015 06:40:10,dolor proident ad Quis ut reprehenderit in magna quo officia 479,0,0.0,0.0,Unknown,Unknown,Unknown,Unknown,Unknown
_bot_5_n_2,04/09/2015 03:49:10,quis laboris eum esse do culpa ut deserunt nisi esse 249,0,0.0,0.0,Unknown,Unknown,Unknown,Unknown,Unknown
_bot_5_n_2,04/09/2015 02:47:10,quis sit Quis anim nostrud ut vel enim elit in dolorem vel 881,0,0.0,0.0,Unknown,Unknown,Unknown,Unknown,Unknown
_bot_5_n_2,04/09/2015 02:26:10,ea aute Ut consequatur ex fugiat molestiae Excepteur Quis ut ex ex 208,0,0.0,0.0,Unknown,Unknown,Unknown,Unknown,Unknown
_bot_5_n_2,04/09/2015 00:07:10,non est dolore quo et iure do ullamco in est 885,0,0.0,0.0,Unknown,Unknown,Unknown,Unknown,Unknown
_bot_5_n_2,03/09/2015 19:50:10,cupidatat aliquid ea fugiat dolor tempor quo fugiat dolor exercitation consectetur elit 70,0,0.0,0.0,Unknown,Unknown,Unknown,Unknown,Unknown
_bot_5_n_2,03/09/2015 14:37:10,autem ad reprehenderit veniam irure est 29,0,0.0,0.0,Unknown,Unknown,Unknown,Unknown,Unknown
_bot_5_n_2,03/09/2015 10:08:10,minim ipsum pariatur dolor elit ipsum fugiat adipiscing aute 330,0,0.0,0.0,Unknown,Unknown,Unknown,Unknown,Unknown
_bot_5_n_2,03/09/2015 05:26:10,vel cupidatat dolore in pariatur in laborum ea ullamco 421,0,0.0,0.0,Unknown,Unknown,Unknown,Unknown,Unknown
_bot_5_n_2,03/09/2015 02:45:10,fugiat iure veniam qui consequatur voluptate quis 13,0,0.0,0.0,Unknown,Unknown,Unknown,Unknown,Unknown
_bot_5_n_2,02/09/2015 23:16:10,pariatur fugiat Quis aliquip sint consequatur magna et in 57,0,0.0,0.0,Unknown,Unknown,Unknown,Unknown,Unknown
_bot_5_n_2,02/09/2015 22:21:10,mollit qui adipiscing eiusmod incididunt esse 664,0,0.0,0.0,Unknown,Unknown,Unknown,Unknown,Unknown
_bot_5_n_2,02/09/2015 19:25:10,voluptas in voluptas cupidatat molestiae ipsum ut quis cillum 441,0,0.0,0.0,Unknown,Unknown,Unknown,Unknown,Unknown
_bot_5_n_2,02/09/2015 18:27:10,Excepteur eum ex ea voluptate magna eum Ut ad 706,0,0.0,0.0,Unknown,Unknown,Unknown,Unknown,Unknown
_bot_5_n_2,02/09/2015 12:28:10,laboris esse vel labore autem occaecat do 504,0,0.0,0.0,Unknown,Unknown,Unknown,Unknown,Unknown
_bot_5_n_2,02/09/2015 10:15:10,veniam cillum commodo proident ipsum Lorem amet dolore qui mollit adipiscing deserunt 149,0,0.0,0.0,Unknown,Unknown,Unknown,Unknown,Unknown
_bot_5_n_2,02/09/2015 07:31:10,nisi nulla cillum pariatur consequatur officia ut consequatur 785,0,0.0,0.0,Unknown,Unknown,Unknown,Unknown,Unknown
_bot_5_n_2,02/09/2015 06:46:10,deserunt elit cillum nulla nihil sunt quo voluptas 354,0,0.0,0.0,Unknown,Unknown,Unknown,Unknown,Unknown
_bot_5_n_2,02/09/2015 04:24:10,magna tempor qui Lorem commodi voluptate est ea 671,0,0.0,0.0,Unknown,Unknown,Unknown,Unknown,Unknown
_bot_5_n_2,02/09/2015 04:05:10,eu pariatur in nulla nulla occaecat vel aliqua incididunt 682,0,0.0,0.0,Unknown,Unknown,Unknown,Unknown,Unknown
_bot_5_n_2,01/09/2015 22:53:10,esse iure ad officia ut qui ad Ut est eum cupidatat 511,0,0.0,0.0,Unknown,Unknown,Unknown,Unknown,Unknown
_bot_5_n_2,01/09/2015 17:34:10,in elit nisi laborum consectetur culpa Quis sint ipsum aliquid laborum ea 882,0,0.0,0.0,Unknown,Unknown,Unknown,Unknown,Unknown
_bot_5_n_2,01/09/2015 12:01:10,dolore laborum in sit ex nostrud 980,0,0.0,0.0,Unknown,Unknown,Unknown,Unknown,Unknown
_bot_5_n_2,01/09/2015 08:06:10,cupidatat in vel nihil Excepteur consequatur eiusmod Ut irure 139,0,0.0,0.0,Unknown,Unknown,Unknown,Unknown,Unknown
_bot_5_n_2,01/09/2015 03:50:10,non fugiat nisi dolore commodi adipiscing laboris dolor voluptas consectetur labore 163,0,0.0,0.0,Unknown,Unknown,Unknown,Unknown,Unknown
_bot_5_n_2,01/09/2015 01:31:10,pariatur qui dolor consectetur cupidatat sed velit Duis minim 599,0,0.0,0.0,Unknown,Unknown,Unknown,Unknown,Unknown
_bot_5_n_2,01/09/2015 01:14:10,fugiat in Excepteur aliquip iure incididunt qui exercitation molestiae mollit Lorem 978,0,0.0,0.0,Unknown,Unknown,Unknown,Unknown,Unknown
_bot_5_n_2,31/08/2015 22:24:10,dolor in ea fugiat aliquid pariatur ullamco laboris dolor 11,0,0.0,0.0,Unknown,Unknown,Unknown,Unknown,Unknown
_bot_5_n_2,31/08/2015 21:48:10,sunt ad qui non culpa pariatur ea enim dolor minim 632,0,0.0,0.0,Unknown,Unknown,Unknown,Unknown,Unknown
_bot_5_n_2,31/08/2015 15:43:10,aute voluptas quo labore aliquid ut 105,0,0.0,0.0,Unknown,Unknown,Unknown,Unknown,Unknown
_bot_5_n_2,31/08/2015 11:09:10,ex laboris tempor quo officia cupidatat dolorem 962,0,0.0,0.0,Unknown,Unknown,Unknown,Unknown,Unknown
_bot_5_n_2,31/08/2015 10:47:10,dolor dolore anim mollit voluptas cupidatat pariatur ad dolore reprehenderit 899,0,0.0,0.0,Unknown,Unknown,Unknown,Unknown,Unknown
_bot_5_n_2,31/08/2015 08:50:10,ea deserunt velit et incididunt voluptate 687,0,0.0,0.0,Unknown,Unknown,Unknown,Unknown,Unknown
_bot_5_n_2,31/08/2015 05:13:10,quis dolorem dolorem ex labore illum 249,0,0.0,0.0,Unknown,Unknown,Unknown,Unknown,Unknown
_bot_5_n_2,31/08/2015 04:11:10,nostrud consequatur commodo sit dolorem voluptate 810,0,0.0,0.0,Unknown,Unknown,Unknown,Unknown,Unknown
_bot_5_n_2,30/08/2015 22:22:10,dolor dolor id non ea Duis voluptate nihil est qui 944,0,0.0,0.0,Unknown,Unknown,Unknown,Unknown,Unknown
_bot_5_n_2,30/08/2015 21:41:10,ut ea consequatur qui consequat labore mollit dolor aliquip nisi 664,0,0.0,0.0,Unknown,Unknown,Unknown,Unknown,Unknown
_bot_5_n_2,30/08/2015 18:09:10,eiusmod consequat reprehenderit fugiat Lorem dolore Duis velit velit 103,0,0.0,0.0,Unknown,Unknown,Unknown,Unknown,Unknown
_bot_5_n_2,30/08/2015 16:35:10,eum qui nulla ea est voluptate 422,0,0.0,0.0,Unknown,Unknown,Unknown,Unknown,Unknown
_bot_5_n_2,30/08/2015 12:39:10,nihil Lorem quis quam qui id cillum 339,0,0.0,0.0,Unknown,Unknown,Unknown,Unknown,Unknown
_bot_5_n_2,30/08/2015 08:41:10,in irure in enim nihil dolore veniam consequatur iure 9,0,0.0,0.0,Unknown,Unknown,Unknown,Unknown,Unknown
_bot_5_n_2,30/08/2015 06:23:10,Duis iure cillum exercitation voluptas molestiae deserunt eiusmod 552,0,0.0,0.0,Unknown,Unknown,Unknown,Unknown,Unknown
_bot_5_n_2,30/08/2015 03:48:10,consequat voluptas Ut adipiscing nisi ea dolor eiusmod elit labore 100,0,0.0,0.0,Unknown,Unknown,Unknown,Unknown,Unknown
_bot_5_n_2,30/08/2015 03:01:10,aliqua velit cupidatat mollit pariatur in pariatur 998,0,0.0,0.0,Unknown,Unknown,Unknown,Unknown,Unknown
_bot_5_n_2,29/08/2015 22:37:10,eu fugiat eiusmod nihil in ullamco ullamco in consequat velit 687,0,0.0,0.0,Unknown,Unknown,Unknown,Unknown,Unknown
_bot_5_n_2,29/08/2015 21:50:10,eum magna vel Ut esse dolore 27,0,0.0,0.0,Unknown,Unknown,Unknown,Unknown,Unknown
_bot_5_n_2,29/08/2015 18:32:10,sit qui irure sunt minim ullamco magna 247,0,0.0,0.0,Unknown,Unknown,Unknown,Unknown,Unknown
_bot_5_n_2,29/08/2015 14:10:10,sunt eu ullamco anim Lorem nulla nulla reprehenderit vel in mollit commodo 49,0,0.0,0.0,Unknown,Unknown,Unknown,Unknown,Unknown
_bot_5_n_2,29/08/2015 10:21:10,dolor Ut sint labore reprehenderit deserunt velit eum consequatur dolor dolore et 327,0,0.0,0.0,Unknown,Unknown,Unknown,Unknown,Unknown
_bot_5_n_2,29/08/2015 07:11:10,eum ut labore ea cupidatat aliquid mollit reprehenderit 772,0,0.0,0.0,Unknown,Unknown,Unknown,Unknown,Unknown
_bot_5_n_2,29/08/2015 05:33:10,est esse dolore eum cupidatat in ea amet dolore commodo et proident 984,0,0.0,0.0,Unknown,Unknown,Unknown,Unknown,Unknown
_bot_5_n_2,29/08/2015 04:26:10,ullamco pariatur nulla enim dolor ut ad nulla ut autem 192,0,0.0,0.0,Unknown,Unknown,Unknown,Unknown,Unknown
_bot_5_n_2,29/08/2015 00:26:10,magna fugiat fugiat velit laborum ex quam ut ex 396,0,0.0,0.0,Unknown,Unknown,Unknown,Unknown,Unknown
_bot_5_n_2,29/08/2015 00:01:10,ea laboris commodo culpa magna ex ea 781,0,0.0,0.0,Unknown,Unknown,Unknown,Unknown,Unknown
_bot_5_n_2,28/08/2015 19:05:10,id ea dolorem nihil velit laborum nulla consequatur in iure 786,0,0.0,0.0,Unknown,Unknown,Unknown,Unknown,Unknown
_bot_5_n_2,28/08/2015 16:38:10,aliqua veniam enim dolor Quis fugiat nihil vel ut Excepteur 282,0,0.0,0.0,Unknown,Unknown,Unknown,Unknown,Unknown
_bot_5_n_2,28/08/2015 12:39:10,nihil aliqua eu qui fugiat illum Excepteur eu minim dolor fugiat cupidatat 765,0,0.0,0.0,Unknown,Unknown,Unknown,Unknown,Unknown
_bot_5_n_2,28/08/2015 06:37:10,in veniam tempor cupidatat ipsum do pariatur nulla ad 933,0,0.0,0.0,Unknown,Unknown,Unknown,Unknown,Unknown
_bot_5_n_2,28/08/2015 03:27:10,nisi fugiat irure ex irure ea 555,0,0.0,0.0,Unknown,Unknown,Unknown,Unknown,Unknown
_bot_5_n_2,28/08/2015 02:10:10,iure autem in aute ex consequatur aliquid nisi amet 605,0,0.0,0.0,Unknown,Unknown,Unknown,Unknown,Unknown
_bot_5_n_2,27/08/2015 23:37:10,ea ex est dolorem laboris reprehenderit proident Duis dolorem nulla 139,0,0.0,0.0,Unknown,Unknown,Unknown,Unknown,Unknown
_bot_5_n_2,27/08/2015 19:42:10,ipsum in ut do aliquip quis nulla nisi molestiae 378,0,0.0,0.0,Unknown,Unknown,Unknown,Unknown,Unknown
_bot_5_n_2,27/08/2015 15:11:10,do nisi ea nostrud cillum aliqua ipsum dolor minim autem proident 573,0,0.0,0.0,Unknown,Unknown,Unknown,Unknown,Unknown
_bot_5_n_2,27/08/2015 10:41:10,ea sint adipiscing culpa eu non ipsum incididunt minim 287,0,0.0,0.0,Unknown,Unknown,Unknown,Unknown,Unknown
_bot_5_n_2,27/08/2015 05:59:10,in fugiat cupidatat aliquip esse enim esse 566,0,0.0,0.0,Unknown,Unknown,Unknown,Unknown,Unknown
_bot_5_n_2,27/08/2015 00:53:10,ex aute aliquip ex ullamco molestiae qui velit ex enim 536,0,0.0,0.0,Unknown,Unknown,Unknown,Unknown,Unknown
_bot_5_n_2,26/08/2015 20:36:10,Excepteur occaecat iure ex sit fugiat laborum 610,0,0.0,0.0,Unknown,Unknown,Unknown,Unknown,Unknown
_bot_5_n_2,26/08/2015 17:18:10,mollit molestiae eiusmod Ut in nisi aliquid illum iure 567,0,0.0,0.0,Unknown,Unknown,Unknown,Unknown,Unknown
_bot_5_n_2,26/08/2015 15:11:10,ad dolor labore vel ullamco laborum 318,0,0.0,0.0,Unknown,Unknown,Unknown,Unknown,Unknown
_bot_5_n_2,26/08/2015 12:44:10,nisi Ut voluptate ullamco labore ipsum molestiae Lorem sint dolor commodi 535,0,0.0,0.0,Unknown,Unknown,Unknown,Unknown,Unknown
_bot_5_n_2,26/08/2015 09:14:10,reprehenderit enim ex commodo pariatur consectetur Duis ea reprehenderit 583,0,0.0,0.0,Unknown,Unknown,Unknown,Unknown,Unknown
_bot_5_n_2,26/08/2015 03:28:10,sed consectetur ea in reprehenderit nisi minim voluptate aliquid consequat 939,0,0.0,0.0,Unknown,Unknown,Unknown,Unknown,Unknown
_bot_5_n_2,26/08/2015 00:20:10,ad elit non ullamco in ex ut nisi ex minim et 547,0,0.0,0.0,Unknown,Unknown,Unknown,Unknown,Unknown
_bot_5_n_2,25/08/2015 19:51:10,autem exercitation magna Excepteur sit ut 119,0,0.0,0.0,Unknown,Unknown,Unknown,Unknown,Unknown
_bot_5_n_2,25/08/2015 16:11:10,Ut deserunt quam aliquid occaecat dolore cillum aliqua sunt sit 227,0,0.0,0.0,Unknown,Unknown,Unknown,Unknown,Unknown
_bot_5_n_2,25/08/2015 11:30:10,labore nihil enim consectetur vel ut 6,0,0.0,0.0,Unknown,Unknown,Unknown,Unknown,Unknown
_bot_5_n_2,25/08/2015 09:32:10,aliquid ut nulla ex vel quis labore veniam 645,0,0.0,0.0,Unknown,Unknown,Unknown,Unknown,Unknown
_bot_5_n_2,25/08/2015 05:19:10,irure ex dolore proident nisi dolore ea vel velit qui 417,0,0.0,0.0,Unknown,Unknown,Unknown,Unknown,Unknown
_bot_5_n_2,25/08/2015 01:59:10,molestiae veniam veniam occaecat nostrud consequatur ullamco 197,0,0.0,0.0,Unknown,Unknown,Unknown,Unknown,Unknown
_bot_5_n_2,24/08/2015 22:33:10,voluptas nostrud quis occaecat sit reprehenderit nulla consequatur 689,0,0.0,0.0,Unknown,Unknown,Unknown,Unknown,Unknown
_bot_5_n_2,24/08/2015 17:10:10,sunt ut eiusmod do ipsum consectetur fugiat eiusmod aute 753,0,0.0,0.0,Unknown,Unknown,Unknown,Unknown,Unknown
_bot_5_n_2,24/08/2015 12:03:10,cupidatat dolorem in est voluptas esse occaecat officia nulla reprehenderit adipiscing reprehenderit 332,0,0.0,0.0,Unknown,Unknown,Unknown,Unknown,Unknown
_bot_5_n_2,24/08/2015 10:40:10,eum id commodo aliquip sint veniam cillum Duis mollit cupidatat 815,0,0.0,0.0,Unknown,Unknown,Unknown,Unknown,Unknown
_bot_5_n_2,24/08/2015 09:15:10,occaecat nostrud qui nostrud commodi officia 227,0,0.0,0.0,Unknown,Unknown,Unknown,Unknown,Unknown
_bot_5_n_2,24/08/2015 08:22:10,sit elit aliquid dolore autem laboris ex 447,0,0.0,0.0,Unknown,Unknown,Unknown,Unknown,Unknown
_bot_5_n_2,24/08/2015 06:02:10,Ut consequat laboris fugiat eu laboris nisi reprehenderit 964,0,0.0,0.0,Unknown,Unknown,Unknown,Unknown,Unknown
_bot_5_n_2,24/08/2015 04:33:10,ad sint Excepteur illum enim occaecat autem id commodi 379,0,0.0,0.0,Unknown,Unknown,Unknown,Unknown,Unknown
_bot_5_n_2,24/08/2015 03:31:10,ea mollit vel Quis illum nulla quam 843,0,0.0,0.0,Unknown,Unknown,Unknown,Unknown,Unknown
_bot_5_n_2,23/08/2015 23:05:10,consequatur esse consequatur sunt illum dolore aliquid incididunt dolore in nulla sit 598,0,0.0,0.0,Unknown,Unknown,Unknown,Unknown,Unknown
_bot_5_n_2,23/08/2015 20:43:10,officia est cillum do ut nisi id in 913,0,0.0,0.0,Unknown,Unknown,Unknown,Unknown,Unknown
_bot_5_n_2,23/08/2015 18:51:10,in exercitation irure fugiat nostrud labore quo enim aliqua ea nihil 484,0,0.0,0.0,Unknown,Unknown,Unknown,Unknown,Unknown
_bot_5_n_2,23/08/2015 16:24:10,in consequat ipsum elit in labore laboris ipsum ea minim qui 87,0,0.0,0.0,Unknown,Unknown,Unknown,Unknown,Unknown
_bot_5_n_2,23/08/2015 16:12:10,exercitation voluptas pariatur elit velit Lorem molestiae ut commodi do 737,0,0.0,0.0,Unknown,Unknown,Unknown,Unknown,Unknown
_bot_5_n_2,23/08/2015 11:17:10,magna aliquip autem pariatur ipsum Quis quam 542,0,0.0,0.0,Unknown,Unknown,Unknown,Unknown,Unknown
_bot_5_n_2,23/08/2015 05:14:10,ea ea eum illum cupidatat ut cillum dolor minim labore tempor 556,0,0.0,0.0,Unknown,Unknown,Unknown,Unknown,Unknown
_bot_5_n_2,23/08/2015 01:38:10,ea eu voluptate in eum aliqua Excepteur ea fugiat Excepteur qui aliquid 996,0,0.0,0.0,Unknown,Unknown,Unknown,Unknown,Unknown
_bot_5_n_2,23/08/2015 01:08:10,nulla iure laborum velit laboris sit cupidatat 115,0,0.0,0.0,Unknown,Unknown,Unknown,Unknown,Unknown
_bot_5_n_2,22/08/2015 23:43:10,ea Duis proident commodo amet dolor 949,0,0.0,0.0,Unknown,Unknown,Unknown,Unknown,Unknown
_bot_5_n_2,22/08/2015 18:22:10,Quis ea quo consequat dolore non sed 316,0,0.0,0.0,Unknown,Unknown,Unknown,Unknown,Unknown
_bot_5_n_2,22/08/2015 13:37:10,voluptate voluptate Ut esse dolore ea incididunt ut tempor velit 208,0,0.0,0.0,Unknown,Unknown,Unknown,Unknown,Unknown
_bot_5_n_2,22/08/2015 09:02:10,nisi esse ut ut ut Lorem ad consequatur pariatur cupidatat 978,0,0.0,0.0,Unknown,Unknown,Unknown,Unknown,Unknown
_bot_5_n_2,22/08/2015 05:28:10,in nulla ut Quis sint pariatur ad consequatur esse eum culpa 20,0,0.0,0.0,Unknown,Unknown,Unknown,Unknown,Unknown
_bot_5_n_2,22/08/2015 05:16:10,voluptate sed voluptate quis Lorem esse voluptate ullamco sint in sunt veniam 893,0,0.0,0.0,Unknown,Unknown,Unknown,Unknown,Unknown
_bot_5_n_2,21/08/2015 23:08:10,pariatur esse consequat dolorem adipiscing reprehenderit nostrud eu elit 869,0,0.0,0.0,Unknown,Unknown,Unknown,Unknown,Unknown
_bot_5_n_2,21/08/2015 22:43:10,incididunt consectetur fugiat laborum consequatur Lorem quis illum 63,0,0.0,0.0,Unknown,Unknown,Unknown,Unknown,Unknown
_bot_5_n_2,21/08/2015 20:56:10,qui ut eum laboris ad magna veniam sunt ea esse 49,0,0.0,0.0,Unknown,Unknown,Unknown,Unknown,Unknown
_bot_5_n_2,21/08/2015 18:54:10,aliqua consequat do ad esse nihil 672,0,0.0,0.0,Unknown,Unknown,Unknown,Unknown,Unknown
_bot_5_n_2,21/08/2015 13:44:10,dolor Quis velit amet dolore ipsum fugiat nostrud consectetur aliquid 379,0,0.0,0.0,Unknown,Unknown,Unknown,Unknown,Unknown
_bot_5_n_2,21/08/2015 08:21:10,Quis voluptate veniam reprehenderit ut culpa velit incididunt esse 491,0,0.0,0.0,Unknown,Unknown,Unknown,Unknown,Unknown
_bot_5_n_2,21/08/2015 04:53:10,ut laboris incididunt irure exercitation aliquip ad nulla pariatur reprehenderit 78,0,0.0,0.0,Unknown,Unknown,Unknown,Unknown,Unknown
_bot_5_n_2,21/08/2015 02:30:10,anim ut ut aliquid autem ad enim reprehenderit officia nostrud 754,0,0.0,0.0,Unknown,Unknown,Unknown,Unknown,Unknown
_bot_5_n_2,21/08/2015 01:37:10,sint ut qui Ut consequatur labore Lorem dolore 522,0,0.0,0.0,Unknown,Unknown,Unknown,Unknown,Unknown
_bot_5_n_2,20/08/2015 20:30:10,fugiat eum amet et ex reprehenderit ut sint pariatur qui aliquid 328,0,0.0,0.0,Unknown,Unknown,Unknown,Unknown,Unknown
_bot_5_n_2,20/08/2015 17:36:10,reprehenderit fugiat amet ad ipsum nihil voluptas nihil vel minim incididunt in 135,0,0.0,0.0,Unknown,Unknown,Unknown,Unknown,Unknown
_bot_5_n_2,20/08/2015 13:51:10,irure Lorem proident amet nulla Excepteur incididunt aliqua qui eum nostrud 932,0,0.0,0.0,Unknown,Unknown,Unknown,Unknown,Unknown
_bot_5_n_2,20/08/2015 09:49:10,dolore Excepteur qui cillum ut id iure deserunt 923,0,0.0,0.0,Unknown,Unknown,Unknown,Unknown,Unknown
_bot_5_n_2,20/08/2015 04:31:10,commodo irure pariatur pariatur aute eiusmod elit mollit nisi 120,0,0.0,0.0,Unknown,Unknown,Unknown,Unknown,Unknown
_bot_5_n_2,19/08/2015 23:37:10,proident mollit vel eu labore vel dolorem ea incididunt in occaecat quam 524,0,0.0,0.0,Unknown,Unknown,Unknown,Unknown,Unknown
_bot_5_n_2,19/08/2015 17:40:10,aute magna nulla mollit dolore aliquip ea 186,0,0.0,0.0,Unknown,Unknown,Unknown,Unknown,Unknown
_bot_5_n_2,19/08/2015 13:09:10,nulla nisi quam molestiae est adipiscing 750,0,0.0,0.0,Unknown,Unknown,Unknown,Unknown,Unknown
_bot_5_n_2,19/08/2015 12:43:10,in ut incididunt ut ea iure 121,0,0.0,0.0,Unknown,Unknown,Unknown,Unknown,Unknown
_bot_5_n_2,19/08/2015 12:07:10,dolor illum commodo deserunt sed voluptas quo quo dolore 38,0,0.0,0.0,Unknown,Unknown,Unknown,Unknown,Unknown
_bot_5_n_2,19/08/2015 10:09:10,ea aute officia velit minim eum eum ut ut ea velit laborum 726,0,0.0,0.0,Unknown,Unknown,Unknown,Unknown,Unknown
_bot_5_n_2,19/08/2015 07:01:10,nisi consequatur non id in laborum consequat 571,0,0.0,0.0,Unknown,Unknown,Unknown,Unknown,Unknown
_bot_5_n_2,19/08/2015 02:35:10,ea minim dolor Excepteur nisi ullamco 990,0,0.0,0.0,Unknown,Unknown,Unknown,Unknown,Unknown
_bot_5_n_2,19/08/2015 01:04:10,tempor commodo ea eum magna sunt et velit ea minim dolor illum 789,0,0.0,0.0,Unknown,Unknown,Unknown,Unknown,Unknown
_bot_5_n_2,18/08/2015 23:06:10,eu velit dolorem nihil ullamco magna 602,0,0.0,0.0,Unknown,Unknown,Unknown,Unknown,Unknown
_bot_5_n_2,18/08/2015 20:47:10,quis enim Lorem tempor vel ut 919,0,0.0,0.0,Unknown,Unknown,Unknown,Unknown,Unknown
_bot_5_n_2,18/08/2015 17:26:10,pariatur qui officia occaecat eum adipiscing aliquid nostrud voluptate reprehenderit dolore 698,0,0.0,0.0,Unknown,Unknown,Unknown,Unknown,Unknown
_bot_5_n_2,18/08/2015 11:56:10,in culpa ipsum velit nisi et 483,0,0.0,0.0,Unknown,Unknown,Unknown,Unknown,Unknown
_bot_5_n_2,18/08/2015 07:22:10,esse nihil in laborum sunt eum 234,0,0.0,0.0,Unknown,Unknown,Unknown,Unknown,Unknown
_bot_5_n_2,18/08/2015 06:22:10,sint nulla autem reprehenderit nulla cupidatat 381,0,0.0,0.0,Unknown,Unknown,Unknown,Unknown,Unknown
_bot_5_n_2,18/08/2015 04:14:10,labore dolor ad in nulla incididunt 885,0,0.0,0.0,Unknown,Unknown,Unknown,Unknown,Unknown
_bot_5_n_2,18/08/2015 00:51:10,ea consectetur commodi consectetur reprehenderit velit elit occaecat consequatur eu nostrud 73,0,0.0,0.0,Unknown,Unknown,Unknown,Unknown,Unknown
_bot_5_n_2,17/08/2015 22:09:10,reprehenderit dolore vel aute in mollit occaecat vel nisi eum in in 27,0,0.0,0.0,Unknown,Unknown,Unknown,Unknown,Unknown
_bot_5_n_2,17/08/2015 17:18:10,commodo tempor culpa eu sunt est 27,0,0.0,0.0,Unknown,Unknown,Unknown,Unknown,Unknown
_bot_5_n_2,17/08/2015 14:51:10,in consectetur Quis velit velit quam occaecat occaecat quam ex consequatur tempor 519,0,0.0,0.0,Unknown,Unknown,Unknown,Unknown,Unknown
_bot_5_n_2,17/08/2015 13:01:10,voluptate laboris consequat nulla eum voluptate in Ut in nulla 728,0,0.0,0.0,Unknown,Unknown,Unknown,Unknown,Unknown
_bot_5_n_2,17/08/2015 09:37:10,ut officia dolore enim Duis ea iure enim minim 359,0,0.0,0.0,Unknown,Unknown,Unknown,Unknown,Unknown
_bot_5_n_2,17/08/2015 09:15:10,esse pariatur commodi consequat dolore quo qui anim 163,0,0.0,0.0,Unknown,Unknown,Unknown,Unknown,Unknown
_bot_5_n_2,17/08/2015 06:53:10,ex consequatur quo dolor voluptate voluptas eiusmod nisi sit 885,0,0.0,0.0,Unknown,Unknown,Unknown,Unknown,Unknown
_bot_5_n_2,17/08/2015 03:55:10,quo aute culpa in qui esse qui ut dolorem enim culpa 518,0,0.0,0.0,Unknown,Unknown,Unknown,Unknown,Unknown
_bot_5_n_2,17/08/2015 02:14:10,magna in voluptate laborum aliquid qui amet non sed 767,0,0.0,0.0,Unknown,Unknown,Unknown,Unknown,Unknown
_bot_5_n_2,16/08/2015 21:57:10,commodi illum molestiae molestiae cupidatat qui esse 300,0,0.0,0.0,Unknown,Unknown,Unknown,Unknown,Unknown
_bot_5_n_2,16/08/2015 16:28:10,reprehenderit in ex fugiat occaecat occaecat laboris laborum 778,0,0.0,0.0,Unknown,Unknown,Unknown,Unknown,Unknown
_bot_5_n_2,16/08/2015 15:26:10,nisi elit consectetur minim quis ad exercitation culpa ut 821,0,0.0,0.0,Unknown,Unknown,Unknown,Unknown,Unknown
_bot_5_n_2,16/08/2015 13:28:10,esse mollit ea quo in qui tempor exercitation quo ad reprehenderit 269,0,0.0,0.0,Unknown,Unknown,Unknown,Unknown,Unknown
_bot_5_n_2,16/08/2015 12:12:10,consequat nihil dolore autem adipiscing minim 249,0,0.0,0.0,Unknown,Unknown,Unknown,Unknown,Unknown
_bot_5_n_2,16/08/2015 07:40:10,fugiat aute in culpa eiusmod Duis sunt 103,0,0.0,0.0,Unknown,Unknown,Unknown,Unknown,Unknown
_bot_5_n_2,16/08/2015 07:38:10,laboris ut sit nisi voluptate et esse esse sed 141,0,0.0,0.0,Unknown,Unknown,Unknown,Unknown,Unknown
_bot_5_n_2,16/08/2015 05:21:10,labore Lorem eum pariatur illum sunt ea in aliqua elit quis 46,0,0.0,0.0,Unknown,Unknown,Unknown,Unknown,Unknown
_bot_5_n_2,16/08/2015 00:00:10,aliquip quo commodo id molestiae quam deserunt molestiae in Lorem quis commodo 239,0,0.0,0.0,Unknown,Unknown,Unknown,Unknown,Unknown
_bot_5_n_2,15/08/2015 20:04:10,qui in quo esse sunt officia sed reprehenderit ex aute eu 866,0,0.0,0.0,Unknown,Unknown,Unknown,Unknown,Unknown
_bot_5_n_2,15/08/2015 16:47:10,non dolor dolore deserunt qui ut in autem nulla ea 93,0,0.0,0.0,Unknown,Unknown,Unknown,Unknown,Unknown
_bot_5_n_2,15/08/2015 11:26:10,commodi illum nulla culpa illum consectetur nulla quam veniam enim 195,0,0.0,0.0,Unknown,Unknown,Unknown,Unknown,Unknown
_bot_5_n_2,15/08/2015 10:37:10,eiusmod nisi nulla consequat irure esse ut reprehenderit 519,0,0.0,0.0,Unknown,Unknown,Unknown,Unknown,Unknown
_bot_5_n_2,15/08/2015 04:56:10,non sit eum consequatur pariatur laborum labore in qui mollit magna sint 280,0,0.0,0.0,Unknown,Unknown,Unknown,Unknown,Unknown
_bot_5_n_2,15/08/2015 03:18:10,nostrud exercitation amet est incididunt amet molestiae reprehenderit nostrud vel pariatur 879,0,0.0,0.0,Unknown,Unknown,Unknown,Unknown,Unknown
_bot_5_n_2,14/08/2015 23:46:10,officia molestiae voluptas labore nulla id qui dolore vel 599,0,0.0,0.0,Unknown,Unknown,Unknown,Unknown,Unknown
_bot_5_n_2,14/08/2015 23:21:10,dolor sint cillum nulla in commodi 598,0,0.0,0.0,Unknown,Unknown,Unknown,Unknown,Unknown
_bot_5_n_2,14/08/2015 21:25:10,elit in vel est qui reprehenderit 130,0,0.0,0.0,Unknown,Unknown,Unknown,Unknown,Unknown
_bot_5_n_2,14/08/2015 15:25:10,in eiusmod ad mollit eum elit ad ex fugiat cillum vel Duis 15,0,0.0,0.0,Unknown,Unknown,Unknown,Unknown,Unknown
_bot_5_n_2,14/08/2015 15:16:10,pariatur fugiat magna ea nihil consequat irure irure aliquid qui ut 207,0,0.0,0.0,Unknown,Unknown,Unknown,Unknown,Unknown
_bot_5_n_2,14/08/2015 12:02:10,iure laborum voluptate illum voluptas aliquip velit et vel pariatur velit 132,0,0.0,0.0,Unknown,Unknown,Unknown,Unknown,Unknown
_bot_5_n_2,14/08/2015 08:19:10,qui irure eum fugiat non pariatur 248,0,0.0,0.0,Unknown,Unknown,Unknown,Unknown,Unknown
_bot_5_n_2,14/08/2015 05:10:10,amet ipsum aliquid ex sed deserunt in deserunt in ut 633,0,0.0,0.0,Unknown,Unknown,Unknown,Unknown,Unknown
_bot_5_n_2,14/08/2015 00:14:10,Lorem ex ex cillum et enim velit quo ut quo 406,0,0.0,0.0,Unknown,Unknown,Unknown,Unknown,Unknown
_bot_5_n_2,13/08/2015 20:39:10,veniam voluptas velit do commodi ex qui id enim laborum elit illum 769,0,0.0,0.0,Unknown,Unknown,Unknown,Unknown,Unknown
_bot_5_n_2,13/08/2015 20:39:10,nulla occaecat aute cupidatat labore ea Ut 932,0,0.0,0.0,Unknown,Unknown,Unknown,Unknown,Unknown
_bot_5_n_2,13/08/2015 16:18:10,non sit quis ea officia in dolor aliqua consequat 758,0,0.0,0.0,Unknown,Unknown,Unknown,Unknown,Unknown
_bot_5_n_2,13/08/2015 12:57:10,ipsum qui Duis voluptas iure ut esse 292,0,0.0,0.0,Unknown,Unknown,Unknown,Unknown,Unknown
_bot_5_n_2,13/08/2015 12:30:10,voluptas exercitation iure aliqua adipiscing ea dolor qui quo commodi dolor 342,0,0.0,0.0,Unknown,Unknown,Unknown,Unknown,Unknown
_bot_5_n_2,13/08/2015 09:31:10,esse consequatur adipiscing eiusmod velit tempor dolor 904,0,0.0,0.0,Unknown,Unknown,Unknown,Unknown,Unknown
_bot_5_n_2,13/08/2015 06:50:10,Ut in sed occaecat eu eiusmod 255,0,0.0,0.0,Unknown,Unknown,Unknown,Unknown,Unknown
_bot_5_n_2,13/08/2015 04:33:10,commodi voluptate in Quis fugiat ullamco dolor autem ut consequat 316,0,0.0,0.0,Unknown,Unknown,Unknown,Unknown,Unknown
_bot_5_n_2,13/08/2015 00:07:10,quis culpa illum Quis ea cupidatat eu ut adipiscing amet 361,0,0.0,0.0,Unknown,Unknown,Unknown,Unknown,Unknown
_bot_5_n_2,12/08/2015 20:35:10,ea consequatur in velit in eum 644,0,0.0,0.0,Unknown,Unknown,Unknown,Unknown,Unknown
_bot_5_n_2,12/08/2015 16:52:10,deserunt voluptas ut illum qui consequatur 636,0,0.0,0.0,Unknown,Unknown,Unknown,Unknown,Unknown
