_bot_20_n_3,13/09/2015 09:24:58,ipsum esse veniam dolore quo Excepteur 120,0,0.0,0.0,Unknown,Unknown,Unknown,Unknown
_bot_20_n_3,13/09/2015 07:36:58,eum dolore proident nulla qui laboris pariatur qui in ut esse 253,0,0.0,0.0,Unknown,Unknown,Unknown,Unknown
_bot_20_n_3,13/09/2015 05:22:58,mollit qui cillum in reprehenderit ut nostrud dolor occaecat amet amet elit 158,0,0.0,0.0,Unknown,Unknown,Unknown,Unknown
_bot_20_n_3,13/09/2015 05:11:58,quo voluptate nisi commodo sed adipiscing 282,0,0.0,0.0,Unknown,Unknown,Unknown,Unknown
_bot_20_n_3,13/09/2015 01:43:58,ex cupidatat ea magna Excepteur cillum nisi ex voluptate Excepteur 464,0,0.0,0.0,Unknown,Unknown,Unknown,Unknown
_bot_20_n_3,12/09/2015 22:22:58,proident in aliquip officia quam in ut esse 456,0,0.0,0.0,Unknown,Unknown,Unknown,Unknown
_bot_20_n_3,12/09/2015 20:07:58,fugiat aute ad esse quo sint id et autem officia fugiat 824,0,0.0,0.0,Unknown,Unknown,Unknown,Unknown
_bot_20_n_3,12/09/2015 19:13:58,anim fugiat ea ut dolor velit deserunt sint esse dolorem ea nihil 289,0,0.0,0.0,Unknown,Unknown,Unknown,Unknown
_bot_20_n_3,12/09/2015 17:30:58,aliqua dolor ad cupidatat ipsum non enim Quis 177,0,0.0,0.0,Unknown,Unknown,Unknown,Unknown
_bot_20_n_3,12/09/2015 17:22:58,magna quam anim tempor occaecat enim nostrud 914,0,0.0,0.0,Unknown,Unknown,Unknown,Unknown
