_bot_fixed_10_mention_n_random_5,15/09/2015 09:19:17,@vxjygayh incididunt ut anim consectetur in occaecat ex anim #kkpbv 24 #rzonoltz,0,0.0,0.0,Unknown,Unknown,Unknown,Unknown
_bot_fixed_10_mention_n_random_5,15/09/2015 08:10:17,exercitation qui anim illum dolor molestiae occaecat aute,0,0.0,0.0,Unknown,Unknown,Unknown,Unknown
_bot_fixed_10_mention_n_random_5,15/09/2015 07:01:17,@lohmceie incididunt ut anim consectetur in occaecat ex anim #kkpbv 24 #rzonoltz,0,0.0,0.0,Unknown,Unknown,Unknown,Unknown
_bot_fixed_10_mention_n_random_5,15/09/2015 05:52:17,in esse quo aliquip aliquid quis in ea,0,0.0,0.0,Unknown,Unknown,Unknown,Unknown
_bot_fixed_10_mention_n_random_5,15/09/2015 04:43:17,magna laborum voluptate eiusmod ea pariatur dolore proident Ut consectetur non ut,0,0.0,0.0,Unknown,Unknown,Unknown,Unknown
_bot_fixed_10_mention_n_random_5,15/09/2015 03:34:17,anim nisi ullamco ut Duis ut commodo nihil mollit reprehenderit laborum ut,0,0.0,0.0,Unknown,Unknown,Unknown,Unknown
_bot_fixed_10_mention_n_random_5,15/09/2015 02:25:17,nulla minim Lorem minim esse in qui consequatur irure,0,0.0,0.0,Unknown,Unknown,Unknown,Unknown
_bot_fixed_10_mention_n_random_5,15/09/2015 01:16:17,quam autem consequat consequat ut dolor magna irure molestiae illum ut,0,0.0,0.0,Unknown,Unknown,Unknown,Unknown
_bot_fixed_10_mention_n_random_5,15/09/2015 00:07:17,@rkbwxltgnkl sit sit autem in voluptas consequatur #rnixfpco 478 #bluuau,0,0.0,0.0,Unknown,Unknown,Unknown,Unknown
_bot_fixed_10_mention_n_random_5,14/09/2015 22:58:17,@paqkrggaa eum ut culpa non mollit nihil #hhklcv 843 #ojnbwrb,0,0.0,0.0,Unknown,Unknown,Unknown,Unknown
