_bot_20_n_5,10/09/2015 17:22:58,quo proident quo veniam Excepteur sed voluptate 445,0,0.0,0.0,Unknown,Unknown,Unknown,Unknown
_bot_20_n_5,10/09/2015 14:32:58,eiusmod cillum proident laboris aliquip ut 479,0,0.0,0.0,Unknown,Unknown,Unknown,Unknown
_bot_20_n_5,10/09/2015 04:56:58,labore fugiat cupidatat nulla pariatur eum 434,0,0.0,0.0,Unknown,Unknown,Unknown,Unknown
_bot_20_n_5,09/09/2015 14:27:58,fugiat anim iure molestiae do magna cillum 234,0,0.0,0.0,Unknown,Unknown,Unknown,Unknown
_bot_20_n_5,09/09/2015 05:01:58,labore velit elit enim ipsum reprehenderit dolor ut tempor in 988,0,0.0,0.0,Unknown,Unknown,Unknown,Unknown
_bot_20_n_5,08/09/2015 17:07:58,iure irure exercitation vel eum exercitation culpa esse Excepteur qui 192,0,0.0,0.0,Unknown,Unknown,Unknown,Unknown
_bot_20_n_5,08/09/2015 17:02:58,occaecat aliquip ut fugiat reprehenderit elit in 667,0,0.0,0.0,Unknown,Unknown,Unknown,Unknown
_bot_20_n_5,08/09/2015 05:52:58,pariatur vel vel veniam in sed deserunt illum proident anim mollit 193,0,0.0,0.0,Unknown,Unknown,Unknown,Unknown
_bot_20_n_5,07/09/2015 22:35:58,dolorem occaecat sit aliquip reprehenderit mollit in fugiat laboris nisi culpa eum 163,0,0.0,0.0,Unknown,Unknown,Unknown,Unknown
_bot_20_n_5,07/09/2015 18:31:58,elit eum labore Quis et dolore occaecat ex qui veniam esse ea 900,0,0.0,0.0,Unknown,Unknown,Unknown,Unknown
