_bot_20_n_3,22/07/2015 00:20:02,magna voluptate irure fugiat amet ut dolore adipiscing voluptate incididunt dolor ex 212,0,0.0,0.0,Unknown,Unknown,Unknown,Unknown
_bot_20_n_3,21/07/2015 18:15:02,reprehenderit cillum esse dolore in sint 630,0,0.0,0.0,Unknown,Unknown,Unknown,Unknown
_bot_20_n_3,21/07/2015 11:49:02,occaecat nihil anim laborum qui eum 956,0,0.0,0.0,Unknown,Unknown,Unknown,Unknown
_bot_20_n_3,21/07/2015 10:03:02,deserunt voluptate eum dolore commodo cupidatat ut 998,0,0.0,0.0,Unknown,Unknown,Unknown,Unknown
_bot_20_n_3,21/07/2015 08:36:02,commodo sit eum ad deserunt voluptas eu ipsum consequatur 500,0,0.0,0.0,Unknown,Unknown,Unknown,Unknown
_bot_20_n_3,21/07/2015 08:35:02,dolor ut non Excepteur tempor esse 437,0,0.0,0.0,Unknown,Unknown,Unknown,Unknown
_bot_20_n_3,21/07/2015 06:32:02,cupidatat voluptate voluptate vel pariatur illum vel aliquid 878,0,0.0,0.0,Unknown,Unknown,Unknown,Unknown
_bot_20_n_3,21/07/2015 05:53:02,aliquip magna ut laboris consequat nisi 715,0,0.0,0.0,Unknown,Unknown,Unknown,Unknown
_bot_20_n_3,21/07/2015 02:17:02,dolor aliquid ut voluptate enim sed aute dolor 411,0,0.0,0.0,Unknown,Unknown,Unknown,Unknown
_bot_20_n_3,20/07/2015 18:54:02,do pariatur Duis qui elit commodi 280,0,0.0,0.0,Unknown,Unknown,Unknown,Unknown
_bot_20_n_3,20/07/2015 11:43:02,sint Lorem qui quo aliquip Ut iure cupidatat 804,0,0.0,0.0,Unknown,Unknown,Unknown,Unknown
_bot_20_n_3,20/07/2015 08:23:02,sunt in nisi commodo aliquip ut reprehenderit commodo quo vel sint 72,0,0.0,0.0,Unknown,Unknown,Unknown,Unknown
_bot_20_n_3,20/07/2015 02:11:02,aute nulla ex voluptate quam Ut ea incididunt irure velit pariatur ea 305,0,0.0,0.0,Unknown,Unknown,Unknown,Unknown
_bot_20_n_3,20/07/2015 00:05:02,sed aliqua quam ex autem eum reprehenderit ea 442,0,0.0,0.0,Unknown,Unknown,Unknown,Unknown
_bot_20_n_3,19/07/2015 18:09:02,voluptate incididunt aliquid voluptas mollit consectetur ut 637,0,0.0,0.0,Unknown,Unknown,Unknown,Unknown
_bot_20_n_3,19/07/2015 15:15:02,ea voluptate irure irure mollit et 48,0,0.0,0.0,Unknown,Unknown,Unknown,Unknown
_bot_20_n_3,19/07/2015 11:11:02,nulla nulla nisi eiusmod vel proident anim ut irure 333,0,0.0,0.0,Unknown,Unknown,Unknown,Unknown
_bot_20_n_3,19/07/2015 07:51:02,et qui eum velit nisi consequatur qui dolor nisi 491,0,0.0,0.0,Unknown,Unknown,Unknown,Unknown
_bot_20_n_3,19/07/2015 03:50:02,non qui pariatur iure laborum illum consequatur ut adipiscing 645,0,0.0,0.0,Unknown,Unknown,Unknown,Unknown
_bot_20_n_3,18/07/2015 22:14:02,velit magna pariatur incididunt labore esse 391,0,0.0,0.0,Unknown,Unknown,Unknown,Unknown
_bot_20_n_3,18/07/2015 21:57:02,nisi ad autem aliquid sit ea reprehenderit reprehenderit eum esse 890,0,0.0,0.0,Unknown,Unknown,Unknown,Unknown
_bot_20_n_3,18/07/2015 20:00:02,ut fugiat Duis aute eum magna fugiat voluptas nulla 376,0,0.0,0.0,Unknown,Unknown,Unknown,Unknown
_bot_20_n_3,18/07/2015 14:44:02,eiusmod in ea in eum nisi culpa fugiat in in deserunt reprehenderit 589,0,0.0,0.0,Unknown,Unknown,Unknown,Unknown
_bot_20_n_3,18/07/2015 11:23:02,consequat pariatur esse sed ea aliqua ut reprehenderit labore aute amet 744,0,0.0,0.0,Unknown,Unknown,Unknown,Unknown
_bot_20_n_3,18/07/2015 09:04:02,ut reprehenderit incididunt in deserunt dolor laborum 374,0,0.0,0.0,Unknown,Unknown,Unknown,Unknown
_bot_20_n_3,18/07/2015 03:33:02,est labore aliqua non minim ea Ut eu qui 670,0,0.0,0.0,Unknown,Unknown,Unknown,Unknown
_bot_20_n_3,18/07/2015 03:28:02,fugiat quam ut anim qui aute reprehenderit voluptate non irure ex 905,0,0.0,0.0,Unknown,Unknown,Unknown,Unknown
_bot_20_n_3,17/07/2015 22:21:02,ad enim laborum Ut dolore quis laboris 316,0,0.0,0.0,Unknown,Unknown,Unknown,Unknown
_bot_20_n_3,17/07/2015 15:23:02,reprehenderit laborum Lorem dolor ullamco nostrud nulla laboris Quis in voluptas pariatur 963,0,0.0,0.0,Unknown,Unknown,Unknown,Unknown
_bot_20_n_3,17/07/2015 12:23:02,nulla consequatur in qui est tempor dolor quis 193,0,0.0,0.0,Unknown,Unknown,Unknown,Unknown
_bot_20_n_3,17/07/2015 05:08:02,consequatur vel pariatur sint do ullamco anim 292,0,0.0,0.0,Unknown,Unknown,Unknown,Unknown
_bot_20_n_3,16/07/2015 21:45:02,consectetur id eu mollit velit molestiae laboris exercitation qui Lorem et 37,0,0.0,0.0,Unknown,Unknown,Unknown,Unknown
_bot_20_n_3,16/07/2015 14:35:02,ex quo illum dolore ad fugiat reprehenderit ex aliqua exercitation consectetur Lorem 742,0,0.0,0.0,Unknown,Unknown,Unknown,Unknown
_bot_20_n_3,16/07/2015 07:34:02,elit in irure ut molestiae do quo vel aliqua mollit ex 95,0,0.0,0.0,Unknown,Unknown,Unknown,Unknown
_bot_20_n_3,16/07/2015 05:49:02,nostrud laboris ex adipiscing molestiae cupidatat Excepteur fugiat ea 250,0,0.0,0.0,Unknown,Unknown,Unknown,Unknown
_bot_20_n_3,16/07/2015 00:31:02,dolor in do ex aliquip commodi veniam ex eu tempor id magna 64,0,0.0,0.0,Unknown,Unknown,Unknown,Unknown
_bot_20_n_3,15/07/2015 18:15:02,qui esse ut quam fugiat laborum quo veniam et 147,0,0.0,0.0,Unknown,Unknown,Unknown,Unknown
_bot_20_n_3,15/07/2015 11:59:02,eum consequat ullamco in mollit nihil 629,0,0.0,0.0,Unknown,Unknown,Unknown,Unknown
_bot_20_n_3,15/07/2015 05:39:02,officia autem quam voluptas elit velit ut nisi nostrud 406,0,0.0,0.0,Unknown,Unknown,Unknown,Unknown
_bot_20_n_3,15/07/2015 05:32:02,ut anim nisi Ut voluptas nihil proident ea vel incididunt quis officia 206,0,0.0,0.0,Unknown,Unknown,Unknown,Unknown
_bot_20_n_3,15/07/2015 02:05:02,id velit molestiae in iure ut minim reprehenderit aliqua ex nisi aliquip 765,0,0.0,0.0,Unknown,Unknown,Unknown,Unknown
_bot_20_n_3,15/07/2015 01:23:02,qui eu ullamco vel commodo Excepteur qui autem voluptate in 1,0,0.0,0.0,Unknown,Unknown,Unknown,Unknown
_bot_20_n_3,14/07/2015 20:05:02,sint proident quam nostrud pariatur labore incididunt eum 310,0,0.0,0.0,Unknown,Unknown,Unknown,Unknown
_bot_20_n_3,14/07/2015 17:42:02,nisi voluptate reprehenderit exercitation ut quis culpa 574,0,0.0,0.0,Unknown,Unknown,Unknown,Unknown
_bot_20_n_3,14/07/2015 12:51:02,exercitation anim et non ea cupidatat id 376,0,0.0,0.0,Unknown,Unknown,Unknown,Unknown
_bot_20_n_3,14/07/2015 05:58:02,illum adipiscing Ut sunt ullamco voluptate aliqua 853,0,0.0,0.0,Unknown,Unknown,Unknown,Unknown
_bot_20_n_3,14/07/2015 00:12:02,Ut dolor iure in Lorem ipsum pariatur voluptate in nostrud autem 809,0,0.0,0.0,Unknown,Unknown,Unknown,Unknown
_bot_20_n_3,13/07/2015 19:31:02,dolore fugiat qui voluptas velit quo eu sit sit consectetur 177,0,0.0,0.0,Unknown,Unknown,Unknown,Unknown
_bot_20_n_3,13/07/2015 14:11:02,occaecat ut ad fugiat qui anim cupidatat aliquid 789,0,0.0,0.0,Unknown,Unknown,Unknown,Unknown
_bot_20_n_3,13/07/2015 13:37:02,illum pariatur incididunt Duis reprehenderit qui qui Quis autem eiusmod 839,0,0.0,0.0,Unknown,Unknown,Unknown,Unknown
_bot_20_n_3,13/07/2015 06:32:02,consectetur eum ea aliquid consequat ad labore 994,0,0.0,0.0,Unknown,Unknown,Unknown,Unknown
_bot_20_n_3,13/07/2015 05:16:02,labore dolore cillum quis enim cillum fugiat ut molestiae culpa in ex 254,0,0.0,0.0,Unknown,Unknown,Unknown,Unknown
_bot_20_n_3,13/07/2015 01:48:02,ex in dolore consequat do minim adipiscing dolor quo 368,0,0.0,0.0,Unknown,Unknown,Unknown,Unknown
_bot_20_n_3,13/07/2015 00:51:02,Ut in Lorem molestiae commodo laboris 625,0,0.0,0.0,Unknown,Unknown,Unknown,Unknown
_bot_20_n_3,13/07/2015 00:47:02,velit esse et ex tempor Quis cupidatat esse qui occaecat vel nulla 942,0,0.0,0.0,Unknown,Unknown,Unknown,Unknown
_bot_20_n_3,12/07/2015 18:36:02,est dolore enim Quis Duis consectetur esse ut ea nisi ea 413,0,0.0,0.0,Unknown,Unknown,Unknown,Unknown
_bot_20_n_3,12/07/2015 15:44:02,eu quo laborum aliquid consectetur cupidatat illum aliqua pariatur labore 936,0,0.0,0.0,Unknown,Unknown,Unknown,Unknown
_bot_20_n_3,12/07/2015 14:47:02,eu exercitation dolor in ea vel consequatur pariatur ipsum Ut 694,0,0.0,0.0,Unknown,Unknown,Unknown,Unknown
_bot_20_n_3,12/07/2015 11:38:02,Excepteur reprehenderit nihil incididunt consequatur tempor eiusmod anim nihil officia in tempor 40,0,0.0,0.0,Unknown,Unknown,Unknown,Unknown
_bot_20_n_3,12/07/2015 09:14:02,nisi nihil est deserunt in magna in pariatur Ut 497,0,0.0,0.0,Unknown,Unknown,Unknown,Unknown
_bot_20_n_3,12/07/2015 05:10:02,cupidatat eiusmod proident deserunt Lorem tempor cillum culpa 442,0,0.0,0.0,Unknown,Unknown,Unknown,Unknown
_bot_20_n_3,11/07/2015 23:46:02,velit consequat ex anim fugiat consectetur velit ex aliquip exercitation enim 956,0,0.0,0.0,Unknown,Unknown,Unknown,Unknown
_bot_20_n_3,11/07/2015 21:19:02,Excepteur voluptate ex sunt veniam reprehenderit 763,0,0.0,0.0,Unknown,Unknown,Unknown,Unknown
_bot_20_n_3,11/07/2015 17:34:02,culpa eum adipiscing eum in voluptate incididunt dolor esse 486,0,0.0,0.0,Unknown,Unknown,Unknown,Unknown
_bot_20_n_3,11/07/2015 15:43:02,nihil occaecat esse aliqua vel laboris 746,0,0.0,0.0,Unknown,Unknown,Unknown,Unknown
_bot_20_n_3,11/07/2015 09:56:02,laboris esse in magna ea velit culpa fugiat eum 692,0,0.0,0.0,Unknown,Unknown,Unknown,Unknown
_bot_20_n_3,11/07/2015 09:32:02,qui nostrud ad Ut ea fugiat id ex fugiat aute veniam 782,0,0.0,0.0,Unknown,Unknown,Unknown,Unknown
_bot_20_n_3,11/07/2015 02:20:02,reprehenderit in ut minim eu do 119,0,0.0,0.0,Unknown,Unknown,Unknown,Unknown
_bot_20_n_3,11/07/2015 01:43:02,ea ut qui magna minim nisi id consequatur Duis dolor commodi eiusmod 916,0,0.0,0.0,Unknown,Unknown,Unknown,Unknown
_bot_20_n_3,10/07/2015 18:24:02,ut consectetur consectetur deserunt ea ea dolor quam 251,0,0.0,0.0,Unknown,Unknown,Unknown,Unknown
_bot_20_n_3,10/07/2015 14:55:02,ipsum in incididunt quo consequatur ex pariatur ullamco 302,0,0.0,0.0,Unknown,Unknown,Unknown,Unknown
_bot_20_n_3,10/07/2015 10:17:02,officia ut adipiscing fugiat eu cillum in illum 515,0,0.0,0.0,Unknown,Unknown,Unknown,Unknown
_bot_20_n_3,10/07/2015 09:15:02,officia ea dolor ea ex non fugiat esse voluptas quo Excepteur ut 952,0,0.0,0.0,Unknown,Unknown,Unknown,Unknown
_bot_20_n_3,10/07/2015 04:21:02,anim nulla ex fugiat in in 478,0,0.0,0.0,Unknown,Unknown,Unknown,Unknown
_bot_20_n_3,10/07/2015 03:22:02,ex qui irure officia veniam reprehenderit pariatur adipiscing pariatur qui pariatur consequatur 742,0,0.0,0.0,Unknown,Unknown,Unknown,Unknown
_bot_20_n_3,10/07/2015 01:01:02,exercitation fugiat proident adipiscing vel aute aliquid 160,0,0.0,0.0,Unknown,Unknown,Unknown,Unknown
_bot_20_n_3,10/07/2015 00:17:02,officia incididunt qui nostrud quo anim 364,0,0.0,0.0,Unknown,Unknown,Unknown,Unknown
_bot_20_n_3,09/07/2015 17:20:02,velit eiusmod Duis dolore in autem amet 866,0,0.0,0.0,Unknown,Unknown,Unknown,Unknown
_bot_20_n_3,09/07/2015 10:12:02,nulla commodi fugiat amet veniam consequatur Quis 791,0,0.0,0.0,Unknown,Unknown,Unknown,Unknown
_bot_20_n_3,09/07/2015 10:02:02,laborum ex adipiscing Lorem amet reprehenderit 983,0,0.0,0.0,Unknown,Unknown,Unknown,Unknown
_bot_20_n_3,09/07/2015 07:45:02,et in irure officia fugiat ipsum sint aute consequatur ut commodi 603,0,0.0,0.0,Unknown,Unknown,Unknown,Unknown
_bot_20_n_3,09/07/2015 00:37:02,fugiat fugiat consectetur sunt amet officia consectetur incididunt consectetur sint 459,0,0.0,0.0,Unknown,Unknown,Unknown,Unknown
_bot_20_n_3,08/07/2015 18:04:02,irure pariatur nostrud Ut consequatur Lorem officia anim pariatur qui illum ipsum 950,0,0.0,0.0,Unknown,Unknown,Unknown,Unknown
_bot_20_n_3,08/07/2015 16:07:02,quo cillum sit qui eiusmod sunt minim officia velit esse 56,0,0.0,0.0,Unknown,Unknown,Unknown,Unknown
_bot_20_n_3,08/07/2015 13:13:02,molestiae ex elit molestiae sunt officia ut ut consectetur molestiae tempor 44,0,0.0,0.0,Unknown,Unknown,Unknown,Unknown
_bot_20_n_3,08/07/2015 11:43:02,pariatur Excepteur irure eu nostrud eu ex velit vel exercitation officia 566,0,0.0,0.0,Unknown,Unknown,Unknown,Unknown
_bot_20_n_3,08/07/2015 06:27:02,in deserunt officia consequatur dolor exercitation sed Ut 535,0,0.0,0.0,Unknown,Unknown,Unknown,Unknown
_bot_20_n_3,07/07/2015 23:46:02,ipsum illum ea ad laborum in Duis dolor 220,0,0.0,0.0,Unknown,Unknown,Unknown,Unknown
_bot_20_n_3,07/07/2015 23:31:02,consequatur sed Duis consequatur est fugiat 658,0,0.0,0.0,Unknown,Unknown,Unknown,Unknown
_bot_20_n_3,07/07/2015 20:17:02,enim nostrud ea qui consequatur ex dolor deserunt ea nisi ut 848,0,0.0,0.0,Unknown,Unknown,Unknown,Unknown
_bot_20_n_3,07/07/2015 17:17:02,eum commodo et nisi nihil quis cillum vel ex 683,0,0.0,0.0,Unknown,Unknown,Unknown,Unknown
_bot_20_n_3,07/07/2015 13:16:02,autem minim occaecat Excepteur consequat id Quis Quis anim vel id voluptas 319,0,0.0,0.0,Unknown,Unknown,Unknown,Unknown
_bot_20_n_3,07/07/2015 06:08:02,culpa pariatur sed molestiae pariatur illum nulla in 35,0,0.0,0.0,Unknown,Unknown,Unknown,Unknown
_bot_20_n_3,07/07/2015 00:17:02,quo quo sed nulla aliqua veniam aliquid 767,0,0.0,0.0,Unknown,Unknown,Unknown,Unknown
_bot_20_n_3,06/07/2015 22:23:02,velit deserunt ut eum aute nisi qui eum ex culpa exercitation quis 990,0,0.0,0.0,Unknown,Unknown,Unknown,Unknown
_bot_20_n_3,06/07/2015 21:31:02,dolore nihil in nulla consectetur eum 682,0,0.0,0.0,Unknown,Unknown,Unknown,Unknown
_bot_20_n_3,06/07/2015 21:07:02,qui ex in veniam vel ex quam 349,0,0.0,0.0,Unknown,Unknown,Unknown,Unknown
_bot_20_n_3,06/07/2015 13:39:02,nihil vel velit ullamco in exercitation commodi qui laborum 865,0,0.0,0.0,Unknown,Unknown,Unknown,Unknown
_bot_20_n_3,06/07/2015 13:34:02,magna do Ut exercitation do tempor 47,0,0.0,0.0,Unknown,Unknown,Unknown,Unknown
_bot_20_n_3,06/07/2015 07:55:02,Duis irure esse pariatur esse commodi vel 42,0,0.0,0.0,Unknown,Unknown,Unknown,Unknown
_bot_20_n_3,06/07/2015 00:54:02,in ut ex veniam cillum fugiat consectetur nisi laborum consequatur 465,0,0.0,0.0,Unknown,Unknown,Unknown,Unknown
_bot_20_n_3,06/07/2015 00:18:02,nisi elit culpa nulla dolor consequatur illum aliqua 936,0,0.0,0.0,Unknown,Unknown,Unknown,Unknown
_bot_20_n_3,05/07/2015 17:07:02,vel in est qui consequat sit dolor quis consectetur 63,0,0.0,0.0,Unknown,Unknown,Unknown,Unknown
_bot_20_n_3,05/07/2015 10:10:02,illum dolorem voluptas cillum qui esse minim eum fugiat 252,0,0.0,0.0,Unknown,Unknown,Unknown,Unknown
_bot_20_n_3,05/07/2015 07:48:02,iure ex pariatur occaecat dolor quam vel molestiae consectetur adipiscing molestiae aute 586,0,0.0,0.0,Unknown,Unknown,Unknown,Unknown
_bot_20_n_3,05/07/2015 06:41:02,dolor incididunt consequat culpa nulla nihil voluptate magna deserunt 378,0,0.0,0.0,Unknown,Unknown,Unknown,Unknown
_bot_20_n_3,05/07/2015 01:22:02,ut officia Lorem amet fugiat dolore reprehenderit occaecat Excepteur ea anim 333,0,0.0,0.0,Unknown,Unknown,Unknown,Unknown
_bot_20_n_3,05/07/2015 00:53:02,fugiat tempor veniam officia labore nulla cupidatat qui ea consectetur fugiat 593,0,0.0,0.0,Unknown,Unknown,Unknown,Unknown
_bot_20_n_3,04/07/2015 18:51:02,proident qui non anim commodo ea eu eu sit officia consequatur 26,0,0.0,0.0,Unknown,Unknown,Unknown,Unknown
_bot_20_n_3,04/07/2015 14:54:02,sint vel ut sint commodo esse ex incididunt ipsum voluptas ea autem 868,0,0.0,0.0,Unknown,Unknown,Unknown,Unknown
_bot_20_n_3,04/07/2015 12:46:02,nisi illum consequatur dolor commodo molestiae incididunt consequatur ut 239,0,0.0,0.0,Unknown,Unknown,Unknown,Unknown
_bot_20_n_3,04/07/2015 08:08:02,nisi eiusmod dolor ad incididunt autem eiusmod eu et quis do 191,0,0.0,0.0,Unknown,Unknown,Unknown,Unknown
_bot_20_n_3,04/07/2015 07:51:02,eu quam qui voluptas dolore illum aliqua quis quam irure minim anim 186,0,0.0,0.0,Unknown,Unknown,Unknown,Unknown
_bot_20_n_3,04/07/2015 04:39:02,et dolore vel cupidatat voluptate in 760,0,0.0,0.0,Unknown,Unknown,Unknown,Unknown
_bot_20_n_3,04/07/2015 02:45:02,dolor enim voluptate officia ea Duis commodo ut Duis commodi aute sint 348,0,0.0,0.0,Unknown,Unknown,Unknown,Unknown
_bot_20_n_3,04/07/2015 01:18:02,nihil esse ea vel ex Lorem vel eum in cillum laborum 441,0,0.0,0.0,Unknown,Unknown,Unknown,Unknown
_bot_20_n_3,03/07/2015 21:22:02,ea iure fugiat qui non in elit velit esse qui fugiat Quis 757,0,0.0,0.0,Unknown,Unknown,Unknown,Unknown
_bot_20_n_3,03/07/2015 17:12:02,nulla nisi exercitation do proident ex labore sed tempor 519,0,0.0,0.0,Unknown,Unknown,Unknown,Unknown
_bot_20_n_3,03/07/2015 10:37:02,ex ad ullamco Quis elit nisi 2,0,0.0,0.0,Unknown,Unknown,Unknown,Unknown
_bot_20_n_3,03/07/2015 06:45:02,eiusmod labore magna non autem velit qui Excepteur cillum ut minim magna 607,0,0.0,0.0,Unknown,Unknown,Unknown,Unknown
_bot_20_n_3,03/07/2015 04:00:02,eu esse cillum Excepteur quo cupidatat 693,0,0.0,0.0,Unknown,Unknown,Unknown,Unknown
_bot_20_n_3,03/07/2015 00:09:02,enim minim quis ex et consequat deserunt aliquip Excepteur 561,0,0.0,0.0,Unknown,Unknown,Unknown,Unknown
_bot_20_n_3,02/07/2015 16:59:02,irure occaecat sint aliquip consequatur mollit 95,0,0.0,0.0,Unknown,Unknown,Unknown,Unknown
_bot_20_n_3,02/07/2015 12:00:02,velit dolore in quis velit aliqua sit ut iure aliqua dolore qui 220,0,0.0,0.0,Unknown,Unknown,Unknown,Unknown
_bot_20_n_3,02/07/2015 08:43:02,aute reprehenderit eu qui consequatur sit ex ullamco Duis mollit incididunt ipsum 410,0,0.0,0.0,Unknown,Unknown,Unknown,Unknown
_bot_20_n_3,02/07/2015 08:01:02,vel et aliqua exercitation velit autem aliquip aliqua occaecat 335,0,0.0,0.0,Unknown,Unknown,Unknown,Unknown
_bot_20_n_3,02/07/2015 06:13:02,labore ea esse qui velit magna eiusmod 153,0,0.0,0.0,Unknown,Unknown,Unknown,Unknown
_bot_20_n_3,02/07/2015 00:16:02,pariatur ut quam ut iure dolor dolor magna quo voluptas labore mollit 745,0,0.0,0.0,Unknown,Unknown,Unknown,Unknown
_bot_20_n_3,01/07/2015 23:37:02,dolorem nisi esse ex in consequatur ullamco pariatur 802,0,0.0,0.0,Unknown,Unknown,Unknown,Unknown
_bot_20_n_3,01/07/2015 23:13:02,id consequatur do nulla ea ut in esse illum iure officia 103,0,0.0,0.0,Unknown,Unknown,Unknown,Unknown
_bot_20_n_3,01/07/2015 17:55:02,voluptate ex quam ipsum ex commodo enim esse qui eum 436,0,0.0,0.0,Unknown,Unknown,Unknown,Unknown
_bot_20_n_3,01/07/2015 12:43:02,velit consequat occaecat esse elit vel velit molestiae do 251,0,0.0,0.0,Unknown,Unknown,Unknown,Unknown
_bot_20_n_3,01/07/2015 11:27:02,pariatur enim nisi esse aliquid fugiat laborum reprehenderit voluptas nisi dolorem aliquid 342,0,0.0,0.0,Unknown,Unknown,Unknown,Unknown
_bot_20_n_3,01/07/2015 06:48:02,eum consequat fugiat adipiscing anim minim nisi esse sit pariatur 223,0,0.0,0.0,Unknown,Unknown,Unknown,Unknown
_bot_20_n_3,01/07/2015 05:25:02,mollit ea reprehenderit Lorem consequatur incididunt irure ut incididunt 767,0,0.0,0.0,Unknown,Unknown,Unknown,Unknown
_bot_20_n_3,01/07/2015 01:03:02,culpa ex cupidatat veniam consequatur ut 830,0,0.0,0.0,Unknown,Unknown,Unknown,Unknown
_bot_20_n_3,30/06/2015 21:28:02,sit nulla pariatur molestiae ut dolor deserunt reprehenderit ut Excepteur consectetur adipiscing 178,0,0.0,0.0,Unknown,Unknown,Unknown,Unknown
_bot_20_n_3,30/06/2015 17:59:02,sit nihil autem exercitation vel eum ex qui 628,0,0.0,0.0,Unknown,Unknown,Unknown,Unknown
_bot_20_n_3,30/06/2015 15:58:02,nulla Duis incididunt tempor illum adipiscing nisi tempor in 828,0,0.0,0.0,Unknown,Unknown,Unknown,Unknown
_bot_20_n_3,30/06/2015 10:31:02,ut ut mollit incididunt eum exercitation molestiae 539,0,0.0,0.0,Unknown,Unknown,Unknown,Unknown
_bot_20_n_3,30/06/2015 05:18:02,iure ea aliquid vel tempor consequat 846,0,0.0,0.0,Unknown,Unknown,Unknown,Unknown
_bot_20_n_3,29/06/2015 22:25:02,eu adipiscing ut officia cupidatat consequatur Duis nulla 767,0,0.0,0.0,Unknown,Unknown,Unknown,Unknown
_bot_20_n_3,29/06/2015 18:56:02,reprehenderit consequat illum veniam dolore mollit Ut nisi 691,0,0.0,0.0,Unknown,Unknown,Unknown,Unknown
_bot_20_n_3,29/06/2015 17:22:02,mollit fugiat consequat Quis ut voluptas consequatur voluptas qui officia 373,0,0.0,0.0,Unknown,Unknown,Unknown,Unknown
_bot_20_n_3,29/06/2015 16:27:02,Duis voluptate nulla esse qui autem sint eu 999,0,0.0,0.0,Unknown,Unknown,Unknown,Unknown
_bot_20_n_3,29/06/2015 09:40:02,iure consequatur in laboris ea voluptate qui nulla pariatur 636,0,0.0,0.0,Unknown,Unknown,Unknown,Unknown
_bot_20_n_3,29/06/2015 03:01:02,vel ut eu magna enim velit sint Ut reprehenderit sed occaecat 368,0,0.0,0.0,Unknown,Unknown,Unknown,Unknown
_bot_20_n_3,29/06/2015 00:57:02,qui eu autem elit dolor illum ea nihil qui dolor sunt 399,0,0.0,0.0,Unknown,Unknown,Unknown,Unknown
_bot_20_n_3,29/06/2015 00:26:02,pariatur consequatur vel illum fugiat laborum nisi 230,0,0.0,0.0,Unknown,Unknown,Unknown,Unknown
_bot_20_n_3,28/06/2015 18:49:02,sed ad dolore ut eiusmod minim 655,0,0.0,0.0,Unknown,Unknown,Unknown,Unknown
_bot_20_n_3,28/06/2015 12:13:02,est do dolore dolor magna Ut voluptate quo aliquip exercitation Duis 102,0,0.0,0.0,Unknown,Unknown,Unknown,Unknown
_bot_20_n_3,28/06/2015 05:16:02,anim sint occaecat qui eu in irure 738,0,0.0,0.0,Unknown,Unknown,Unknown,Unknown
_bot_20_n_3,27/06/2015 23:43:02,voluptate eum voluptate aliquid dolore fugiat pariatur do mollit illum 314,0,0.0,0.0,Unknown,Unknown,Unknown,Unknown
_bot_20_n_3,27/06/2015 16:44:02,consequat est qui ex commodo sed sint 708,0,0.0,0.0,Unknown,Unknown,Unknown,Unknown
_bot_20_n_3,27/06/2015 12:48:02,eu ut in commodo occaecat deserunt 151,0,0.0,0.0,Unknown,Unknown,Unknown,Unknown
_bot_20_n_3,27/06/2015 08:42:02,non esse Ut quam exercitation anim 404,0,0.0,0.0,Unknown,Unknown,Unknown,Unknown
_bot_20_n_3,27/06/2015 04:49:02,proident dolor do ut eu sunt in fugiat 434,0,0.0,0.0,Unknown,Unknown,Unknown,Unknown
_bot_20_n_3,26/06/2015 23:21:02,eu iure esse occaecat vel fugiat qui 317,0,0.0,0.0,Unknown,Unknown,Unknown,Unknown
_bot_20_n_3,26/06/2015 19:01:02,fugiat esse irure sit molestiae esse adipiscing nisi commodi voluptate 542,0,0.0,0.0,Unknown,Unknown,Unknown,Unknown
_bot_20_n_3,26/06/2015 18:56:02,id amet elit officia consectetur iure qui occaecat laboris eu 96,0,0.0,0.0,Unknown,Unknown,Unknown,Unknown
_bot_20_n_3,26/06/2015 15:08:02,minim fugiat qui voluptas fugiat Excepteur sint fugiat ex occaecat cupidatat sed 938,0,0.0,0.0,Unknown,Unknown,Unknown,Unknown
_bot_20_n_3,26/06/2015 07:53:02,commodi exercitation officia Quis iure aliqua minim anim 880,0,0.0,0.0,Unknown,Unknown,Unknown,Unknown
_bot_20_n_3,26/06/2015 05:50:02,amet esse sunt voluptate fugiat Lorem laborum nulla 544,0,0.0,0.0,Unknown,Unknown,Unknown,Unknown
_bot_20_n_3,26/06/2015 02:02:02,elit consequat veniam minim ullamco mollit ad velit qui 984,0,0.0,0.0,Unknown,Unknown,Unknown,Unknown
_bot_20_n_3,25/06/2015 23:05:02,quo aliquid labore non ut ut ut ea qui mollit 936,0,0.0,0.0,Unknown,Unknown,Unknown,Unknown
_bot_20_n_3,25/06/2015 23:03:02,ex voluptate proident ex eum nulla vel aute officia 372,0,0.0,0.0,Unknown,Unknown,Unknown,Unknown
_bot_20_n_3,25/06/2015 20:06:02,consequatur elit quis in officia id voluptate ex 256,0,0.0,0.0,Unknown,Unknown,Unknown,Unknown
_bot_20_n_3,25/06/2015 14:26:02,esse ea ut esse Ut exercitation 866,0,0.0,0.0,Unknown,Unknown,Unknown,Unknown
_bot_20_n_3,25/06/2015 11:40:02,in Ut laboris est illum iure ea 499,0,0.0,0.0,Unknown,Unknown,Unknown,Unknown
_bot_20_n_3,25/06/2015 07:45:02,culpa vel qui mollit ex laborum in molestiae 427,0,0.0,0.0,Unknown,Unknown,Unknown,Unknown
_bot_20_n_3,25/06/2015 07:36:02,vel aliquid laboris laboris reprehenderit commodo 214,0,0.0,0.0,Unknown,Unknown,Unknown,Unknown
_bot_20_n_3,25/06/2015 05:50:02,eum ut in aliqua fugiat fugiat Duis veniam 279,0,0.0,0.0,Unknown,Unknown,Unknown,Unknown
_bot_20_n_3,25/06/2015 05:15:02,esse nisi voluptas nulla enim elit irure veniam consectetur enim 438,0,0.0,0.0,Unknown,Unknown,Unknown,Unknown
_bot_20_n_3,24/06/2015 22:15:02,nihil sint non ex nulla ea sint exercitation eiusmod ea voluptate eum 199,0,0.0,0.0,Unknown,Unknown,Unknown,Unknown
_bot_20_n_3,24/06/2015 17:51:02,do aliqua est proident magna reprehenderit minim 205,0,0.0,0.0,Unknown,Unknown,Unknown,Unknown
_bot_20_n_3,24/06/2015 12:52:02,qui sunt fugiat magna ipsum nulla elit iure consectetur nisi 498,0,0.0,0.0,Unknown,Unknown,Unknown,Unknown
_bot_20_n_3,24/06/2015 07:02:02,non vel ea tempor ea fugiat do ut vel reprehenderit exercitation eum 521,0,0.0,0.0,Unknown,Unknown,Unknown,Unknown
_bot_20_n_3,24/06/2015 01:49:02,velit ea qui incididunt nulla Excepteur quam cillum aliquid 458,0,0.0,0.0,Unknown,Unknown,Unknown,Unknown
_bot_20_n_3,24/06/2015 00:39:02,vel consequatur ipsum ea magna ut ipsum 250,0,0.0,0.0,Unknown,Unknown,Unknown,Unknown
_bot_20_n_3,23/06/2015 23:21:02,vel est ad ad ullamco consectetur eiusmod 297,0,0.0,0.0,Unknown,Unknown,Unknown,Unknown
_bot_20_n_3,23/06/2015 18:32:02,consequat magna nulla consectetur amet eum velit quis 838,0,0.0,0.0,Unknown,Unknown,Unknown,Unknown
_bot_20_n_3,23/06/2015 15:53:02,culpa culpa aute ipsum quo vel nostrud non 365,0,0.0,0.0,Unknown,Unknown,Unknown,Unknown
_bot_20_n_3,23/06/2015 15:48:02,in pariatur dolor quo voluptate in 934,0,0.0,0.0,Unknown,Unknown,Unknown,Unknown
_bot_20_n_3,23/06/2015 13:26:02,adipiscing Duis esse quo elit qui nisi aliquid 105,0,0.0,0.0,Unknown,Unknown,Unknown,Unknown
_bot_20_n_3,23/06/2015 09:15:02,vel vel magna qui ut dolorem 153,0,0.0,0.0,Unknown,Unknown,Unknown,Unknown
_bot_20_n_3,23/06/2015 05:43:02,voluptate do Duis occaecat nulla iure 24,0,0.0,0.0,Unknown,Unknown,Unknown,Unknown
_bot_20_n_3,23/06/2015 03:18:02,ad mollit velit elit dolor iure est voluptate tempor fugiat in ut 960,0,0.0,0.0,Unknown,Unknown,Unknown,Unknown
_bot_20_n_3,22/06/2015 23:15:02,anim elit dolor occaecat molestiae quam incididunt ullamco 530,0,0.0,0.0,Unknown,Unknown,Unknown,Unknown
_bot_20_n_3,22/06/2015 16:15:02,sit enim nulla ipsum occaecat nulla Ut nisi ea ea nulla 269,0,0.0,0.0,Unknown,Unknown,Unknown,Unknown
_bot_20_n_3,22/06/2015 10:50:02,minim sint in voluptas aute elit mollit sint deserunt aute eum consequat 116,0,0.0,0.0,Unknown,Unknown,Unknown,Unknown
_bot_20_n_3,22/06/2015 04:53:02,qui do adipiscing labore Ut sit labore autem voluptate 589,0,0.0,0.0,Unknown,Unknown,Unknown,Unknown
_bot_20_n_3,22/06/2015 01:50:02,ex molestiae ex aute in Ut Lorem officia sint Duis dolor 789,0,0.0,0.0,Unknown,Unknown,Unknown,Unknown
_bot_20_n_3,21/06/2015 20:22:02,eum consequatur id anim dolorem in mollit Quis pariatur 103,0,0.0,0.0,Unknown,Unknown,Unknown,Unknown
_bot_20_n_3,21/06/2015 15:38:02,fugiat commodo nisi cupidatat dolor ea in Excepteur ex 23,0,0.0,0.0,Unknown,Unknown,Unknown,Unknown
