_bot_10_n_5,13/05/2015 01:58:07,ut deserunt molestiae commodo Ut fugiat qui mollit cillum qui commodi 354,0,0.0,0.0,Unknown,Unknown,Unknown,Unknown
_bot_10_n_5,12/05/2015 22:28:07,labore sint ex aliquid autem aliqua vel commodi ex Duis ut 741,0,0.0,0.0,Unknown,Unknown,Unknown,Unknown
_bot_10_n_5,12/05/2015 21:34:07,irure irure nulla proident voluptate esse ex enim 378,0,0.0,0.0,Unknown,Unknown,Unknown,Unknown
_bot_10_n_5,12/05/2015 18:31:07,anim aliquid Excepteur nihil ad consequatur pariatur illum aliqua dolorem deserunt 417,0,0.0,0.0,Unknown,Unknown,Unknown,Unknown
_bot_10_n_5,12/05/2015 16:37:07,consequatur dolore id aliqua reprehenderit Lorem 858,0,0.0,0.0,Unknown,Unknown,Unknown,Unknown
_bot_10_n_5,12/05/2015 14:11:07,in officia autem sit dolor ea aliquip dolore et 823,0,0.0,0.0,Unknown,Unknown,Unknown,Unknown
_bot_10_n_5,12/05/2015 10:58:07,qui aute voluptas reprehenderit veniam consequatur 612,0,0.0,0.0,Unknown,Unknown,Unknown,Unknown
_bot_10_n_5,12/05/2015 08:08:07,magna dolor pariatur mollit in dolor 578,0,0.0,0.0,Unknown,Unknown,Unknown,Unknown
_bot_10_n_5,12/05/2015 07:58:07,dolore ut Excepteur irure Duis sed ullamco enim sit vel ea 407,0,0.0,0.0,Unknown,Unknown,Unknown,Unknown
_bot_10_n_5,12/05/2015 06:14:07,ea ex consectetur commodo Quis Duis quo 392,0,0.0,0.0,Unknown,Unknown,Unknown,Unknown
_bot_10_n_5,12/05/2015 04:33:07,nulla exercitation ea anim Lorem quis ex et quam Quis 550,0,0.0,0.0,Unknown,Unknown,Unknown,Unknown
_bot_10_n_5,12/05/2015 01:08:07,pariatur velit Duis nulla nisi molestiae cupidatat anim eiusmod Excepteur non 803,0,0.0,0.0,Unknown,Unknown,Unknown,Unknown
_bot_10_n_5,11/05/2015 22:06:07,aliqua consequatur sed anim nulla irure 650,0,0.0,0.0,Unknown,Unknown,Unknown,Unknown
_bot_10_n_5,11/05/2015 19:49:07,qui nulla qui qui nulla commodi Excepteur dolore eu aliquip 748,0,0.0,0.0,Unknown,Unknown,Unknown,Unknown
_bot_10_n_5,11/05/2015 17:44:07,commodi Ut est voluptate eum voluptas molestiae non Excepteur voluptate quis 316,0,0.0,0.0,Unknown,Unknown,Unknown,Unknown
_bot_10_n_5,11/05/2015 14:36:07,nihil culpa ut ea deserunt voluptate minim aliquip sit nisi 655,0,0.0,0.0,Unknown,Unknown,Unknown,Unknown
_bot_10_n_5,11/05/2015 13:26:07,qui cillum dolore deserunt deserunt qui qui enim elit nulla nulla 295,0,0.0,0.0,Unknown,Unknown,Unknown,Unknown
_bot_10_n_5,11/05/2015 11:34:07,non do eiusmod aliquip in voluptate sed iure eu qui aliquid amet 872,0,0.0,0.0,Unknown,Unknown,Unknown,Unknown
_bot_10_n_5,11/05/2015 08:59:07,sunt ea dolore mollit commodi nisi ex officia id voluptas cupidatat voluptas 638,0,0.0,0.0,Unknown,Unknown,Unknown,Unknown
_bot_10_n_5,11/05/2015 06:06:07,reprehenderit quo dolor veniam proident nulla 652,0,0.0,0.0,Unknown,Unknown,Unknown,Unknown
_bot_10_n_5,11/05/2015 04:42:07,illum eu velit pariatur commodo qui consequatur 286,0,0.0,0.0,Unknown,Unknown,Unknown,Unknown
_bot_10_n_5,11/05/2015 03:40:07,voluptate eum ut aliquid quam Excepteur est 30,0,0.0,0.0,Unknown,Unknown,Unknown,Unknown
_bot_10_n_5,11/05/2015 02:14:07,nulla ut magna velit deserunt quis 441,0,0.0,0.0,Unknown,Unknown,Unknown,Unknown
_bot_10_n_5,10/05/2015 23:41:07,ex cupidatat aliquid illum exercitation in 150,0,0.0,0.0,Unknown,Unknown,Unknown,Unknown
_bot_10_n_5,10/05/2015 21:51:07,aliqua nisi veniam non voluptas cillum aliquid cillum autem velit exercitation 590,0,0.0,0.0,Unknown,Unknown,Unknown,Unknown
_bot_10_n_5,10/05/2015 19:55:07,exercitation ut deserunt vel cupidatat labore 710,0,0.0,0.0,Unknown,Unknown,Unknown,Unknown
_bot_10_n_5,10/05/2015 18:46:07,esse do dolore consectetur consequatur adipiscing in 642,0,0.0,0.0,Unknown,Unknown,Unknown,Unknown
_bot_10_n_5,10/05/2015 17:15:07,consectetur ipsum vel fugiat dolorem est dolor quam ut qui 529,0,0.0,0.0,Unknown,Unknown,Unknown,Unknown
_bot_10_n_5,10/05/2015 15:43:07,sint et commodo ea laboris veniam ut voluptate cupidatat in culpa ipsum 509,0,0.0,0.0,Unknown,Unknown,Unknown,Unknown
_bot_10_n_5,10/05/2015 13:28:07,qui vel commodo aliquid anim in fugiat eum consectetur autem qui 155,0,0.0,0.0,Unknown,Unknown,Unknown,Unknown
_bot_10_n_5,10/05/2015 13:20:07,eum quo fugiat voluptate aute commodi adipiscing 752,0,0.0,0.0,Unknown,Unknown,Unknown,Unknown
_bot_10_n_5,10/05/2015 12:49:07,Excepteur minim dolore in non in dolore 483,0,0.0,0.0,Unknown,Unknown,Unknown,Unknown
_bot_10_n_5,10/05/2015 12:42:07,occaecat consequat Ut voluptate deserunt quo 288,0,0.0,0.0,Unknown,Unknown,Unknown,Unknown
_bot_10_n_5,10/05/2015 10:36:07,ad et labore tempor molestiae irure magna commodi aliqua vel 145,0,0.0,0.0,Unknown,Unknown,Unknown,Unknown
_bot_10_n_5,10/05/2015 08:31:07,dolor pariatur veniam est magna Excepteur sint 763,0,0.0,0.0,Unknown,Unknown,Unknown,Unknown
_bot_10_n_5,10/05/2015 07:29:07,sunt ut fugiat sunt dolor quam nisi vel irure voluptas tempor fugiat 658,0,0.0,0.0,Unknown,Unknown,Unknown,Unknown
_bot_10_n_5,10/05/2015 04:22:07,consequatur irure illum Duis fugiat cupidatat commodo officia 911,0,0.0,0.0,Unknown,Unknown,Unknown,Unknown
_bot_10_n_5,10/05/2015 04:20:07,in eu ex eum aliqua occaecat anim cupidatat Excepteur ea Ut non 66,0,0.0,0.0,Unknown,Unknown,Unknown,Unknown
_bot_10_n_5,10/05/2015 02:20:07,eum pariatur voluptate dolor Duis incididunt qui iure quo irure 458,0,0.0,0.0,Unknown,Unknown,Unknown,Unknown
_bot_10_n_5,10/05/2015 02:17:07,aute incididunt est officia elit est ea est sit quo in est 815,0,0.0,0.0,Unknown,Unknown,Unknown,Unknown
_bot_10_n_5,09/05/2015 23:57:07,ea consequatur quis elit voluptate Excepteur est ut 656,0,0.0,0.0,Unknown,Unknown,Unknown,Unknown
_bot_10_n_5,09/05/2015 22:44:07,mollit dolore ex ut mollit ut cupidatat Ut enim veniam nulla 774,0,0.0,0.0,Unknown,Unknown,Unknown,Unknown
_bot_10_n_5,09/05/2015 21:32:07,qui laboris fugiat sit mollit do ut sint commodo 174,0,0.0,0.0,Unknown,Unknown,Unknown,Unknown
_bot_10_n_5,09/05/2015 19:22:07,dolorem velit eum ad in qui voluptate aliquid sunt deserunt culpa 978,0,0.0,0.0,Unknown,Unknown,Unknown,Unknown
_bot_10_n_5,09/05/2015 16:17:07,fugiat voluptate quo ex officia anim quam consectetur dolor eiusmod id 868,0,0.0,0.0,Unknown,Unknown,Unknown,Unknown
_bot_10_n_5,09/05/2015 14:13:07,sint velit reprehenderit minim aliqua sunt qui velit 546,0,0.0,0.0,Unknown,Unknown,Unknown,Unknown
_bot_10_n_5,09/05/2015 11:14:07,reprehenderit reprehenderit dolorem sint quo occaecat pariatur 153,0,0.0,0.0,Unknown,Unknown,Unknown,Unknown
_bot_10_n_5,09/05/2015 11:12:07,consequatur dolor do ea vel aute exercitation 76,0,0.0,0.0,Unknown,Unknown,Unknown,Unknown
_bot_10_n_5,09/05/2015 10:23:07,et nulla laboris magna vel qui aliqua aliquid sunt in laboris 361,0,0.0,0.0,Unknown,Unknown,Unknown,Unknown
_bot_10_n_5,09/05/2015 09:41:07,ut consequatur elit ut ut ea ea eiusmod nisi exercitation 972,0,0.0,0.0,Unknown,Unknown,Unknown,Unknown
_bot_10_n_5,09/05/2015 07:22:07,do tempor dolor non eum vel commodi 526,0,0.0,0.0,Unknown,Unknown,Unknown,Unknown
_bot_10_n_5,09/05/2015 04:50:07,occaecat exercitation aliquid exercitation voluptate in nisi dolore in qui eum 529,0,0.0,0.0,Unknown,Unknown,Unknown,Unknown
_bot_10_n_5,09/05/2015 02:37:07,esse Excepteur id officia sit aute Duis 442,0,0.0,0.0,Unknown,Unknown,Unknown,Unknown
_bot_10_n_5,09/05/2015 00:51:07,sit commodo fugiat ullamco aliqua quo magna reprehenderit 84,0,0.0,0.0,Unknown,Unknown,Unknown,Unknown
_bot_10_n_5,08/05/2015 23:19:07,ut consequatur qui incididunt sint illum ut reprehenderit commodi in ea ex 915,0,0.0,0.0,Unknown,Unknown,Unknown,Unknown
_bot_10_n_5,08/05/2015 23:05:07,ex sed enim ea nulla in 513,0,0.0,0.0,Unknown,Unknown,Unknown,Unknown
_bot_10_n_5,08/05/2015 21:20:07,voluptas minim deserunt do dolor fugiat esse fugiat ex officia 344,0,0.0,0.0,Unknown,Unknown,Unknown,Unknown
_bot_10_n_5,08/05/2015 20:16:07,sunt Excepteur nisi laborum Ut esse esse 912,0,0.0,0.0,Unknown,Unknown,Unknown,Unknown
_bot_10_n_5,08/05/2015 18:31:07,consectetur magna in ullamco aliquid elit qui aliquid 206,0,0.0,0.0,Unknown,Unknown,Unknown,Unknown
_bot_10_n_5,08/05/2015 17:48:07,ex qui eiusmod anim commodo voluptate occaecat 808,0,0.0,0.0,Unknown,Unknown,Unknown,Unknown
_bot_10_n_5,08/05/2015 14:57:07,nostrud nisi consectetur velit qui minim 574,0,0.0,0.0,Unknown,Unknown,Unknown,Unknown
_bot_10_n_5,08/05/2015 12:21:07,sed Duis fugiat ea reprehenderit reprehenderit 316,0,0.0,0.0,Unknown,Unknown,Unknown,Unknown
_bot_10_n_5,08/05/2015 10:08:07,Quis ea ad velit commodi cillum incididunt 481,0,0.0,0.0,Unknown,Unknown,Unknown,Unknown
_bot_10_n_5,08/05/2015 06:55:07,Quis eum cillum voluptas ea et Duis ea ut eum magna 886,0,0.0,0.0,Unknown,Unknown,Unknown,Unknown
_bot_10_n_5,08/05/2015 05:31:07,eum ut commodi ea in ut deserunt cillum eiusmod nulla eu commodo 127,0,0.0,0.0,Unknown,Unknown,Unknown,Unknown
_bot_10_n_5,08/05/2015 02:39:07,pariatur eiusmod fugiat nisi elit tempor amet 484,0,0.0,0.0,Unknown,Unknown,Unknown,Unknown
_bot_10_n_5,08/05/2015 01:24:07,mollit commodo nisi consequatur nostrud vel aliqua commodi Lorem ut 182,0,0.0,0.0,Unknown,Unknown,Unknown,Unknown
_bot_10_n_5,08/05/2015 00:12:07,quo eu tempor reprehenderit ex in fugiat esse nisi esse 784,0,0.0,0.0,Unknown,Unknown,Unknown,Unknown
_bot_10_n_5,07/05/2015 22:20:07,aute molestiae voluptate in occaecat velit qui Ut fugiat 810,0,0.0,0.0,Unknown,Unknown,Unknown,Unknown
_bot_10_n_5,07/05/2015 20:47:07,velit molestiae ex consectetur ea nulla in fugiat sunt 171,0,0.0,0.0,Unknown,Unknown,Unknown,Unknown
_bot_10_n_5,07/05/2015 17:52:07,incididunt nihil et tempor voluptate in 460,0,0.0,0.0,Unknown,Unknown,Unknown,Unknown
_bot_10_n_5,07/05/2015 15:10:07,iure officia sit irure voluptas minim nulla ad et anim 202,0,0.0,0.0,Unknown,Unknown,Unknown,Unknown
_bot_10_n_5,07/05/2015 12:26:07,ex in mollit aliqua ex fugiat cupidatat qui pariatur dolor 614,0,0.0,0.0,Unknown,Unknown,Unknown,Unknown
_bot_10_n_5,07/05/2015 12:11:07,eu qui Quis esse eu Quis 294,0,0.0,0.0,Unknown,Unknown,Unknown,Unknown
_bot_10_n_5,07/05/2015 10:13:07,proident ut fugiat proident eum adipiscing 709,0,0.0,0.0,Unknown,Unknown,Unknown,Unknown
_bot_10_n_5,07/05/2015 07:53:07,dolore velit fugiat et nihil et aliqua dolor do Excepteur nihil 618,0,0.0,0.0,Unknown,Unknown,Unknown,Unknown
_bot_10_n_5,07/05/2015 07:50:07,eum irure quam eum elit ad 752,0,0.0,0.0,Unknown,Unknown,Unknown,Unknown
_bot_10_n_5,07/05/2015 04:49:07,in reprehenderit pariatur nihil mollit sit dolore aliqua 586,0,0.0,0.0,Unknown,Unknown,Unknown,Unknown
_bot_10_n_5,07/05/2015 04:37:07,deserunt autem iure ullamco quis Quis adipiscing qui voluptate mollit veniam aliquip 241,0,0.0,0.0,Unknown,Unknown,Unknown,Unknown
_bot_10_n_5,07/05/2015 01:17:07,incididunt adipiscing nulla voluptate sunt dolorem voluptas 930,0,0.0,0.0,Unknown,Unknown,Unknown,Unknown
_bot_10_n_5,07/05/2015 00:59:07,reprehenderit dolor nulla Ut consequat commodo velit ea dolor velit 173,0,0.0,0.0,Unknown,Unknown,Unknown,Unknown
_bot_10_n_5,06/05/2015 22:15:07,ipsum labore Excepteur eum laborum culpa 401,0,0.0,0.0,Unknown,Unknown,Unknown,Unknown
_bot_10_n_5,06/05/2015 18:58:07,consequat quam sed Excepteur nihil mollit aliquid 546,0,0.0,0.0,Unknown,Unknown,Unknown,Unknown
_bot_10_n_5,06/05/2015 15:39:07,Quis sit minim sint ullamco officia 561,0,0.0,0.0,Unknown,Unknown,Unknown,Unknown
_bot_10_n_5,06/05/2015 12:27:07,quam iure exercitation autem dolore ut esse culpa dolorem 254,0,0.0,0.0,Unknown,Unknown,Unknown,Unknown
_bot_10_n_5,06/05/2015 11:20:07,Duis Lorem in fugiat et aliquid esse ex consectetur vel vel 513,0,0.0,0.0,Unknown,Unknown,Unknown,Unknown
_bot_10_n_5,06/05/2015 09:50:07,fugiat et tempor qui illum est autem qui eu velit Ut nostrud 137,0,0.0,0.0,Unknown,Unknown,Unknown,Unknown
_bot_10_n_5,06/05/2015 08:17:07,Quis ut dolore sit in aliquid 258,0,0.0,0.0,Unknown,Unknown,Unknown,Unknown
_bot_10_n_5,06/05/2015 07:46:07,nulla laboris exercitation sit et veniam aute deserunt eiusmod 7,0,0.0,0.0,Unknown,Unknown,Unknown,Unknown
_bot_10_n_5,06/05/2015 05:52:07,consectetur consectetur do vel magna id pariatur 384,0,0.0,0.0,Unknown,Unknown,Unknown,Unknown
_bot_10_n_5,06/05/2015 04:21:07,nisi irure in nisi ut velit autem ex qui voluptate ut 778,0,0.0,0.0,Unknown,Unknown,Unknown,Unknown
_bot_10_n_5,06/05/2015 02:38:07,id dolorem veniam sed reprehenderit reprehenderit cupidatat Quis irure in quo 288,0,0.0,0.0,Unknown,Unknown,Unknown,Unknown
_bot_10_n_5,05/05/2015 23:13:07,eu dolor ea vel ut Duis aute 720,0,0.0,0.0,Unknown,Unknown,Unknown,Unknown
_bot_10_n_5,05/05/2015 21:52:07,autem exercitation ea in dolore deserunt magna ex in Ut commodo non 60,0,0.0,0.0,Unknown,Unknown,Unknown,Unknown
_bot_10_n_5,05/05/2015 20:05:07,vel laboris eiusmod qui quo eu Lorem deserunt nostrud voluptas 669,0,0.0,0.0,Unknown,Unknown,Unknown,Unknown
_bot_10_n_5,05/05/2015 18:03:07,pariatur reprehenderit dolorem sunt dolore Lorem in nisi Ut cillum pariatur dolore 291,0,0.0,0.0,Unknown,Unknown,Unknown,Unknown
_bot_10_n_5,05/05/2015 16:17:07,esse Excepteur officia ut eum cillum consequatur nostrud veniam quis aliquip 948,0,0.0,0.0,Unknown,Unknown,Unknown,Unknown
_bot_10_n_5,05/05/2015 14:11:07,sed in commodo autem reprehenderit laboris magna ut id 771,0,0.0,0.0,Unknown,Unknown,Unknown,Unknown
_bot_10_n_5,05/05/2015 12:33:07,do reprehenderit ea aute in consequatur laborum consectetur Lorem 69,0,0.0,0.0,Unknown,Unknown,Unknown,Unknown
_bot_10_n_5,05/05/2015 09:09:07,aliqua ut in velit dolor sunt dolore velit esse dolorem consectetur 758,0,0.0,0.0,Unknown,Unknown,Unknown,Unknown
_bot_10_n_5,05/05/2015 06:15:07,autem adipiscing pariatur do ea consequatur exercitation voluptas Excepteur eum ea 79,0,0.0,0.0,Unknown,Unknown,Unknown,Unknown
_bot_10_n_5,05/05/2015 03:10:07,non dolorem nostrud laboris non proident ut Lorem do qui 698,0,0.0,0.0,Unknown,Unknown,Unknown,Unknown
_bot_10_n_5,05/05/2015 01:29:07,mollit minim tempor magna ea Quis 858,0,0.0,0.0,Unknown,Unknown,Unknown,Unknown
_bot_10_n_5,05/05/2015 00:56:07,id Duis qui culpa commodo reprehenderit velit 391,0,0.0,0.0,Unknown,Unknown,Unknown,Unknown
_bot_10_n_5,05/05/2015 00:09:07,laboris illum reprehenderit voluptas id veniam in 70,0,0.0,0.0,Unknown,Unknown,Unknown,Unknown
_bot_10_n_5,04/05/2015 22:29:07,voluptate iure ad vel eu pariatur velit illum dolor 468,0,0.0,0.0,Unknown,Unknown,Unknown,Unknown
_bot_10_n_5,04/05/2015 20:49:07,quam veniam mollit illum eum exercitation magna fugiat consequat 303,0,0.0,0.0,Unknown,Unknown,Unknown,Unknown
_bot_10_n_5,04/05/2015 20:46:07,anim nulla commodi qui in veniam esse velit aliquip qui consectetur 817,0,0.0,0.0,Unknown,Unknown,Unknown,Unknown
_bot_10_n_5,04/05/2015 17:32:07,esse ullamco minim qui eu nisi Quis id Lorem anim 627,0,0.0,0.0,Unknown,Unknown,Unknown,Unknown
_bot_10_n_5,04/05/2015 14:56:07,pariatur dolore dolor deserunt mollit eum magna 25,0,0.0,0.0,Unknown,Unknown,Unknown,Unknown
_bot_10_n_5,04/05/2015 13:27:07,aliquid in non ut velit adipiscing voluptas tempor 474,0,0.0,0.0,Unknown,Unknown,Unknown,Unknown
_bot_10_n_5,04/05/2015 13:26:07,dolore elit deserunt veniam non aliqua consequat consequatur elit voluptate 510,0,0.0,0.0,Unknown,Unknown,Unknown,Unknown
_bot_10_n_5,04/05/2015 11:51:07,vel enim irure tempor eum dolorem pariatur dolore cupidatat eum nisi eum 926,0,0.0,0.0,Unknown,Unknown,Unknown,Unknown
_bot_10_n_5,04/05/2015 10:59:07,in nostrud illum consequatur vel ullamco ea velit ex ex eum dolorem 205,0,0.0,0.0,Unknown,Unknown,Unknown,Unknown
_bot_10_n_5,04/05/2015 07:41:07,aliquid ex dolor dolore vel qui eiusmod aliquip 893,0,0.0,0.0,Unknown,Unknown,Unknown,Unknown
_bot_10_n_5,04/05/2015 05:02:07,ut tempor labore aliquid qui consequatur autem consectetur ut ut voluptate 814,0,0.0,0.0,Unknown,Unknown,Unknown,Unknown
_bot_10_n_5,04/05/2015 01:59:07,cupidatat pariatur dolore magna reprehenderit nihil dolor quam sunt 941,0,0.0,0.0,Unknown,Unknown,Unknown,Unknown
_bot_10_n_5,03/05/2015 23:09:07,adipiscing nisi aliqua minim in dolore elit qui voluptate Quis ex 458,0,0.0,0.0,Unknown,Unknown,Unknown,Unknown
_bot_10_n_5,03/05/2015 19:53:07,consequatur Quis officia ex veniam occaecat enim autem in 421,0,0.0,0.0,Unknown,Unknown,Unknown,Unknown
_bot_10_n_5,03/05/2015 19:17:07,quis aute molestiae eiusmod in in dolor consectetur qui anim iure 432,0,0.0,0.0,Unknown,Unknown,Unknown,Unknown
_bot_10_n_5,03/05/2015 17:06:07,qui incididunt eiusmod illum esse ullamco amet veniam consequatur minim eum 453,0,0.0,0.0,Unknown,Unknown,Unknown,Unknown
_bot_10_n_5,03/05/2015 14:48:07,magna non aliquip elit sed aute nostrud 239,0,0.0,0.0,Unknown,Unknown,Unknown,Unknown
_bot_10_n_5,03/05/2015 14:12:07,dolore velit Quis Lorem vel fugiat commodi exercitation consequatur consectetur anim 715,0,0.0,0.0,Unknown,Unknown,Unknown,Unknown
_bot_10_n_5,03/05/2015 13:35:07,fugiat in ut mollit ex sit anim voluptate 821,0,0.0,0.0,Unknown,Unknown,Unknown,Unknown
_bot_10_n_5,03/05/2015 13:33:07,pariatur sint aliquid exercitation ex sunt eiusmod 94,0,0.0,0.0,Unknown,Unknown,Unknown,Unknown
_bot_10_n_5,03/05/2015 11:53:07,dolore aliquid ipsum nostrud in aliquid iure 63,0,0.0,0.0,Unknown,Unknown,Unknown,Unknown
_bot_10_n_5,03/05/2015 11:08:07,ex commodo veniam aute molestiae eum nostrud sint consequatur in id exercitation 987,0,0.0,0.0,Unknown,Unknown,Unknown,Unknown
_bot_10_n_5,03/05/2015 08:37:07,aute ea reprehenderit consectetur incididunt dolorem aliqua aute minim esse 654,0,0.0,0.0,Unknown,Unknown,Unknown,Unknown
_bot_10_n_5,03/05/2015 05:22:07,qui in mollit nulla Excepteur dolore nihil exercitation et ut ut quo 418,0,0.0,0.0,Unknown,Unknown,Unknown,Unknown
_bot_10_n_5,03/05/2015 03:22:07,Excepteur anim do deserunt iure dolore esse 644,0,0.0,0.0,Unknown,Unknown,Unknown,Unknown
_bot_10_n_5,03/05/2015 02:52:07,fugiat ea dolor commodo eum exercitation nisi aliquip 357,0,0.0,0.0,Unknown,Unknown,Unknown,Unknown
_bot_10_n_5,03/05/2015 00:39:07,minim sed non qui pariatur sunt culpa id Excepteur nisi officia 13,0,0.0,0.0,Unknown,Unknown,Unknown,Unknown
_bot_10_n_5,02/05/2015 23:55:07,autem cupidatat eiusmod fugiat dolorem ea reprehenderit pariatur pariatur molestiae 525,0,0.0,0.0,Unknown,Unknown,Unknown,Unknown
_bot_10_n_5,02/05/2015 20:59:07,voluptate eu labore laboris officia minim 78,0,0.0,0.0,Unknown,Unknown,Unknown,Unknown
_bot_10_n_5,02/05/2015 18:58:07,officia mollit sint aliqua qui et nulla 873,0,0.0,0.0,Unknown,Unknown,Unknown,Unknown
_bot_10_n_5,02/05/2015 18:44:07,adipiscing elit consectetur enim autem eum ipsum consectetur ut fugiat 197,0,0.0,0.0,Unknown,Unknown,Unknown,Unknown
_bot_10_n_5,02/05/2015 17:05:07,voluptate officia fugiat ut occaecat mollit quam dolor ipsum Ut nisi 970,0,0.0,0.0,Unknown,Unknown,Unknown,Unknown
_bot_10_n_5,02/05/2015 14:53:07,illum voluptas Ut id commodo aliquid autem sed esse exercitation iure adipiscing 27,0,0.0,0.0,Unknown,Unknown,Unknown,Unknown
_bot_10_n_5,02/05/2015 14:20:07,dolor ea nisi aliquid vel esse voluptas aliquip commodo consectetur anim 474,0,0.0,0.0,Unknown,Unknown,Unknown,Unknown
_bot_10_n_5,02/05/2015 13:24:07,sit reprehenderit voluptate nisi velit labore veniam commodi 571,0,0.0,0.0,Unknown,Unknown,Unknown,Unknown
_bot_10_n_5,02/05/2015 10:15:07,Quis incididunt cillum velit in voluptas sint ea 900,0,0.0,0.0,Unknown,Unknown,Unknown,Unknown
_bot_10_n_5,02/05/2015 08:12:07,aliquip in exercitation illum consequatur qui ipsum dolor esse quo 615,0,0.0,0.0,Unknown,Unknown,Unknown,Unknown
_bot_10_n_5,02/05/2015 07:36:07,cillum voluptate consequat deserunt officia officia esse 316,0,0.0,0.0,Unknown,Unknown,Unknown,Unknown
_bot_10_n_5,02/05/2015 04:44:07,esse eu aliquid irure anim commodi voluptate qui ut dolorem reprehenderit voluptas 579,0,0.0,0.0,Unknown,Unknown,Unknown,Unknown
_bot_10_n_5,02/05/2015 02:44:07,nulla occaecat consectetur dolore nulla in occaecat anim Excepteur 192,0,0.0,0.0,Unknown,Unknown,Unknown,Unknown
_bot_10_n_5,02/05/2015 01:43:07,quis consequatur illum commodo quo amet qui incididunt deserunt nostrud amet 545,0,0.0,0.0,Unknown,Unknown,Unknown,Unknown
_bot_10_n_5,02/05/2015 00:20:07,voluptate do Ut qui cillum Ut occaecat ad 394,0,0.0,0.0,Unknown,Unknown,Unknown,Unknown
_bot_10_n_5,01/05/2015 23:22:07,deserunt incididunt id dolorem cillum tempor consequat dolore vel 916,0,0.0,0.0,Unknown,Unknown,Unknown,Unknown
_bot_10_n_5,01/05/2015 20:52:07,consequat eum nulla reprehenderit dolorem occaecat fugiat voluptate 662,0,0.0,0.0,Unknown,Unknown,Unknown,Unknown
_bot_10_n_5,01/05/2015 17:22:07,iure qui est quam dolore magna non veniam 828,0,0.0,0.0,Unknown,Unknown,Unknown,Unknown
_bot_10_n_5,01/05/2015 16:21:07,qui consequatur voluptate dolore autem ut sit iure esse autem aliquid nulla 274,0,0.0,0.0,Unknown,Unknown,Unknown,Unknown
_bot_10_n_5,01/05/2015 14:58:07,nulla culpa fugiat in anim velit Duis vel ea sint aute fugiat 584,0,0.0,0.0,Unknown,Unknown,Unknown,Unknown
_bot_10_n_5,01/05/2015 11:56:07,sit ea sit do reprehenderit ea 757,0,0.0,0.0,Unknown,Unknown,Unknown,Unknown
_bot_10_n_5,01/05/2015 11:24:07,labore proident vel dolore velit elit mollit nisi sed non 77,0,0.0,0.0,Unknown,Unknown,Unknown,Unknown
_bot_10_n_5,01/05/2015 08:19:07,commodi fugiat in fugiat pariatur vel enim ullamco 710,0,0.0,0.0,Unknown,Unknown,Unknown,Unknown
_bot_10_n_5,01/05/2015 08:16:07,Quis voluptate commodo ut esse mollit quam cupidatat Duis molestiae voluptate dolorem 452,0,0.0,0.0,Unknown,Unknown,Unknown,Unknown
_bot_10_n_5,01/05/2015 05:11:07,ea Excepteur quam do dolore sed 374,0,0.0,0.0,Unknown,Unknown,Unknown,Unknown
_bot_10_n_5,01/05/2015 04:06:07,consequatur in sed labore aliquip eu ut velit 962,0,0.0,0.0,Unknown,Unknown,Unknown,Unknown
_bot_10_n_5,01/05/2015 01:26:07,aliqua aute aliquip proident ut magna qui aliqua cillum 820,0,0.0,0.0,Unknown,Unknown,Unknown,Unknown
_bot_10_n_5,30/04/2015 23:55:07,pariatur eum ullamco pariatur qui pariatur ut qui voluptate 585,0,0.0,0.0,Unknown,Unknown,Unknown,Unknown
_bot_10_n_5,30/04/2015 23:03:07,ea ad vel dolor pariatur tempor laboris velit fugiat 900,0,0.0,0.0,Unknown,Unknown,Unknown,Unknown
_bot_10_n_5,30/04/2015 22:45:07,Ut mollit eu eum deserunt commodo dolore irure non esse 840,0,0.0,0.0,Unknown,Unknown,Unknown,Unknown
_bot_10_n_5,30/04/2015 20:45:07,occaecat laboris anim esse fugiat pariatur laboris vel vel esse vel labore 234,0,0.0,0.0,Unknown,Unknown,Unknown,Unknown
_bot_10_n_5,30/04/2015 20:16:07,illum velit fugiat culpa qui sunt amet voluptate ea ea fugiat molestiae 981,0,0.0,0.0,Unknown,Unknown,Unknown,Unknown
_bot_10_n_5,30/04/2015 20:02:07,culpa in cupidatat esse deserunt ea cupidatat 601,0,0.0,0.0,Unknown,Unknown,Unknown,Unknown
_bot_10_n_5,30/04/2015 18:17:07,ut eum eum Ut elit esse ullamco commodi dolor proident nulla vel 11,0,0.0,0.0,Unknown,Unknown,Unknown,Unknown
_bot_10_n_5,30/04/2015 17:34:07,ea ea aliquip esse nisi eiusmod qui 147,0,0.0,0.0,Unknown,Unknown,Unknown,Unknown
_bot_10_n_5,30/04/2015 15:09:07,voluptas eiusmod eum dolore eum vel ad aliquip dolorem ea sit 981,0,0.0,0.0,Unknown,Unknown,Unknown,Unknown
_bot_10_n_5,30/04/2015 11:49:07,molestiae ea non ex iure elit nisi nulla fugiat eiusmod 479,0,0.0,0.0,Unknown,Unknown,Unknown,Unknown
_bot_10_n_5,30/04/2015 09:54:07,est minim enim Lorem anim id sit 550,0,0.0,0.0,Unknown,Unknown,Unknown,Unknown
_bot_10_n_5,30/04/2015 09:22:07,proident laboris culpa consequatur veniam cupidatat reprehenderit Duis veniam eum fugiat 396,0,0.0,0.0,Unknown,Unknown,Unknown,Unknown
_bot_10_n_5,30/04/2015 06:56:07,sed autem irure velit fugiat pariatur enim 824,0,0.0,0.0,Unknown,Unknown,Unknown,Unknown
_bot_10_n_5,30/04/2015 04:44:07,qui voluptate veniam et voluptate amet pariatur nihil proident 920,0,0.0,0.0,Unknown,Unknown,Unknown,Unknown
_bot_10_n_5,30/04/2015 02:11:07,qui molestiae fugiat consequatur molestiae quis dolorem illum consequatur est 807,0,0.0,0.0,Unknown,Unknown,Unknown,Unknown
_bot_10_n_5,30/04/2015 00:17:07,pariatur velit eiusmod ut occaecat esse 430,0,0.0,0.0,Unknown,Unknown,Unknown,Unknown
_bot_10_n_5,29/04/2015 22:03:07,in consequatur do ipsum pariatur voluptate iure 569,0,0.0,0.0,Unknown,Unknown,Unknown,Unknown
_bot_10_n_5,29/04/2015 19:54:07,in ut voluptate do eum consequat consequat consequat 965,0,0.0,0.0,Unknown,Unknown,Unknown,Unknown
_bot_10_n_5,29/04/2015 17:34:07,nostrud ea vel laborum ex in fugiat 695,0,0.0,0.0,Unknown,Unknown,Unknown,Unknown
_bot_10_n_5,29/04/2015 14:24:07,quis non elit anim autem id in ipsum laboris nisi consectetur 283,0,0.0,0.0,Unknown,Unknown,Unknown,Unknown
_bot_10_n_5,29/04/2015 13:09:07,dolor Duis id esse et proident fugiat 896,0,0.0,0.0,Unknown,Unknown,Unknown,Unknown
_bot_10_n_5,29/04/2015 11:42:07,vel sunt incididunt consequatur quis velit enim dolor cupidatat incididunt molestiae 774,0,0.0,0.0,Unknown,Unknown,Unknown,Unknown
_bot_10_n_5,29/04/2015 09:26:07,labore reprehenderit et quo molestiae id dolorem vel nisi iure amet 924,0,0.0,0.0,Unknown,Unknown,Unknown,Unknown
_bot_10_n_5,29/04/2015 07:43:07,officia eu ex veniam nisi exercitation magna 529,0,0.0,0.0,Unknown,Unknown,Unknown,Unknown
_bot_10_n_5,29/04/2015 04:55:07,pariatur tempor nisi incididunt cupidatat nihil 195,0,0.0,0.0,Unknown,Unknown,Unknown,Unknown
_bot_10_n_5,29/04/2015 02:02:07,magna ex esse qui nisi incididunt reprehenderit eu vel 378,0,0.0,0.0,Unknown,Unknown,Unknown,Unknown
_bot_10_n_5,29/04/2015 01:40:07,esse minim reprehenderit minim qui ex do et Ut elit 711,0,0.0,0.0,Unknown,Unknown,Unknown,Unknown
_bot_10_n_5,28/04/2015 22:33:07,quis aliquid occaecat in deserunt mollit 622,0,0.0,0.0,Unknown,Unknown,Unknown,Unknown
_bot_10_n_5,28/04/2015 20:29:07,cupidatat quis qui mollit aliqua laborum cupidatat id ad ut ea 461,0,0.0,0.0,Unknown,Unknown,Unknown,Unknown
_bot_10_n_5,28/04/2015 19:20:07,incididunt esse ullamco ut ipsum sit eiusmod ut illum fugiat 742,0,0.0,0.0,Unknown,Unknown,Unknown,Unknown
_bot_10_n_5,28/04/2015 18:26:07,vel mollit in dolore dolore reprehenderit officia 171,0,0.0,0.0,Unknown,Unknown,Unknown,Unknown
_bot_10_n_5,28/04/2015 14:57:07,cillum consequat consequatur incididunt laborum occaecat aliquip velit 941,0,0.0,0.0,Unknown,Unknown,Unknown,Unknown
_bot_10_n_5,28/04/2015 13:36:07,esse cupidatat eiusmod esse quo proident ipsum aliquid laborum ea 596,0,0.0,0.0,Unknown,Unknown,Unknown,Unknown
