_bot_fixed_5_mention_n_random_5,15/09/2015 22:29:53,@wtreedl in sed exercitation irure Lorem #fhuhfo 0 #rrvfg,0,0.0,0.0,Unknown,Unknown,Unknown,Unknown
_bot_fixed_5_mention_n_random_5,15/09/2015 22:21:53,anim dolorem velit dolor pariatur ipsum in esse in adipiscing,0,0.0,0.0,Unknown,Unknown,Unknown,Unknown
_bot_fixed_5_mention_n_random_5,15/09/2015 22:13:53,ut dolorem proident reprehenderit consectetur proident nulla ex quis ad aute culpa,0,0.0,0.0,Unknown,Unknown,Unknown,Unknown
_bot_fixed_5_mention_n_random_5,15/09/2015 22:05:53,@jljdllk Ut voluptate reprehenderit consequatur reprehenderit do nulla #ehtjlm 983 #szcqveug,0,0.0,0.0,Unknown,Unknown,Unknown,Unknown
_bot_fixed_5_mention_n_random_5,15/09/2015 21:57:53,ut enim ut molestiae consectetur est commodi veniam autem nisi,0,0.0,0.0,Unknown,Unknown,Unknown,Unknown
_bot_fixed_5_mention_n_random_5,15/09/2015 21:49:53,vel amet aliquid dolore do voluptas reprehenderit laboris dolore,0,0.0,0.0,Unknown,Unknown,Unknown,Unknown
_bot_fixed_5_mention_n_random_5,15/09/2015 21:41:53,aliquid dolore in dolor in sunt sit,0,0.0,0.0,Unknown,Unknown,Unknown,Unknown
_bot_fixed_5_mention_n_random_5,15/09/2015 21:33:53,autem voluptas do eiusmod nisi dolor,0,0.0,0.0,Unknown,Unknown,Unknown,Unknown
_bot_fixed_5_mention_n_random_5,15/09/2015 21:25:53,vel anim minim ut autem ut eiusmod dolore,0,0.0,0.0,Unknown,Unknown,Unknown,Unknown
_bot_fixed_5_mention_n_random_5,15/09/2015 21:17:53,Duis voluptate commodo tempor voluptate consequat,0,0.0,0.0,Unknown,Unknown,Unknown,Unknown
