_bot_5_n_2,12/08/2015 13:14:10,aliqua occaecat eum velit sint sed officia pariatur 108,0,0.0,0.0,Unknown,Unknown,Unknown,Unknown,Unknown
_bot_5_n_2,12/08/2015 07:44:10,ut proident eum ea dolorem autem anim cupidatat autem 775,0,0.0,0.0,Unknown,Unknown,Unknown,Unknown,Unknown
_bot_5_n_2,12/08/2015 04:48:10,laborum in anim commodo esse quo voluptas aliqua dolore commodi 568,0,0.0,0.0,Unknown,Unknown,Unknown,Unknown,Unknown
_bot_5_n_2,12/08/2015 03:21:10,ex velit culpa Excepteur est quam consequatur in 525,0,0.0,0.0,Unknown,Unknown,Unknown,Unknown,Unknown
_bot_5_n_2,12/08/2015 01:16:10,iure in mollit sed et dolorem molestiae pariatur ullamco nulla laboris cillum 281,0,0.0,0.0,Unknown,Unknown,Unknown,Unknown,Unknown
_bot_5_n_2,11/08/2015 19:35:10,iure in cillum enim elit velit mollit occaecat ex 756,0,0.0,0.0,Unknown,Unknown,Unknown,Unknown,Unknown
_bot_5_n_2,11/08/2015 16:03:10,consectetur voluptate Excepteur ut quo fugiat consequatur 47,0,0.0,0.0,Unknown,Unknown,Unknown,Unknown,Unknown
_bot_5_n_2,11/08/2015 14:33:10,incididunt esse consequat non molestiae tempor 557,0,0.0,0.0,Unknown,Unknown,Unknown,Unknown,Unknown
_bot_5_n_2,11/08/2015 12:33:10,eum nisi sed ut Quis ad 186,0,0.0,0.0,Unknown,Unknown,Unknown,Unknown,Unknown
_bot_5_n_2,11/08/2015 08:23:10,amet Duis in reprehenderit nisi esse elit deserunt 914,0,0.0,0.0,Unknown,Unknown,Unknown,Unknown,Unknown
_bot_5_n_2,11/08/2015 07:08:10,in qui pariatur enim ut mollit minim commodo 321,0,0.0,0.0,Unknown,Unknown,Unknown,Unknown,Unknown
_bot_5_n_2,11/08/2015 03:02:10,sit ea vel ipsum ipsum ea ullamco ex quo ea 693,0,0.0,0.0,Unknown,Unknown,Unknown,Unknown,Unknown
_bot_5_n_2,11/08/2015 01:59:10,aliquip velit mollit et vel voluptate velit officia dolorem mollit 604,0,0.0,0.0,Unknown,Unknown,Unknown,Unknown,Unknown
_bot_5_n_2,11/08/2015 00:06:10,nostrud ea laboris in ex commodi 795,0,0.0,0.0,Unknown,Unknown,Unknown,Unknown,Unknown
_bot_5_n_2,10/08/2015 19:31:10,dolore pariatur reprehenderit qui sed illum Ut 429,0,0.0,0.0,Unknown,Unknown,Unknown,Unknown,Unknown
_bot_5_n_2,10/08/2015 14:27:10,laboris mollit quo qui elit eiusmod reprehenderit autem ex eum 597,0,0.0,0.0,Unknown,Unknown,Unknown,Unknown,Unknown
