_bot_20_n_5,03/05/2015 01:38:02,Quis laboris eiusmod fugiat eiusmod dolore laborum 814,0,0.0,0.0,Unknown,Unknown,Unknown,Unknown,Unknown
_bot_20_n_5,03/05/2015 00:21:02,quo et consequatur ut occaecat aliquip Duis in Duis esse labore in 722,0,0.0,0.0,Unknown,Unknown,Unknown,Unknown,Unknown
_bot_20_n_5,02/05/2015 23:17:02,laboris consequatur consectetur nisi incididunt qui reprehenderit cillum consequat 823,0,0.0,0.0,Unknown,Unknown,Unknown,Unknown,Unknown
_bot_20_n_5,02/05/2015 22:17:02,molestiae ullamco ut voluptate quam nihil eiusmod reprehenderit 88,0,0.0,0.0,Unknown,Unknown,Unknown,Unknown,Unknown
_bot_20_n_5,02/05/2015 20:23:02,voluptate ex ex ullamco velit enim ea autem nulla 556,0,0.0,0.0,Unknown,Unknown,Unknown,Unknown,Unknown
_bot_20_n_5,02/05/2015 18:29:02,commodi in irure sed pariatur velit 76,0,0.0,0.0,Unknown,Unknown,Unknown,Unknown,Unknown
_bot_20_n_5,02/05/2015 17:25:02,nisi dolorem amet quam veniam in 281,0,0.0,0.0,Unknown,Unknown,Unknown,Unknown,Unknown
_bot_20_n_5,02/05/2015 16:36:02,pariatur ex reprehenderit eum elit enim Duis 401,0,0.0,0.0,Unknown,Unknown,Unknown,Unknown,Unknown
_bot_20_n_5,02/05/2015 15:43:02,adipiscing in minim ut labore proident nostrud dolorem 892,0,0.0,0.0,Unknown,Unknown,Unknown,Unknown,Unknown
_bot_20_n_5,02/05/2015 14:30:02,fugiat nisi voluptas voluptas eiusmod magna nisi voluptas anim fugiat nisi 707,0,0.0,0.0,Unknown,Unknown,Unknown,Unknown,Unknown
_bot_20_n_5,02/05/2015 14:29:02,in enim adipiscing aliquip deserunt Ut mollit Lorem cupidatat Duis voluptate 859,0,0.0,0.0,Unknown,Unknown,Unknown,Unknown,Unknown
_bot_20_n_5,02/05/2015 12:47:02,qui esse dolor illum do sit consequatur 387,0,0.0,0.0,Unknown,Unknown,Unknown,Unknown,Unknown
_bot_20_n_5,02/05/2015 12:15:02,ut commodi Ut in officia eum id 544,0,0.0,0.0,Unknown,Unknown,Unknown,Unknown,Unknown
_bot_20_n_5,02/05/2015 11:25:02,commodi laboris magna autem amet in ea tempor dolor nostrud ex 546,0,0.0,0.0,Unknown,Unknown,Unknown,Unknown,Unknown
_bot_20_n_5,02/05/2015 10:19:02,in quis in commodi molestiae aliquid pariatur 398,0,0.0,0.0,Unknown,Unknown,Unknown,Unknown,Unknown
_bot_20_n_5,02/05/2015 08:22:02,enim esse eum aliqua Excepteur commodi eum elit incididunt commodo fugiat 779,0,0.0,0.0,Unknown,Unknown,Unknown,Unknown,Unknown
_bot_20_n_5,02/05/2015 07:24:02,ullamco pariatur in deserunt vel consequat est 779,0,0.0,0.0,Unknown,Unknown,Unknown,Unknown,Unknown
