_bot_fixed_20_mention_n_random_3,16/09/2015 07:55:20,@nrwdnptbz commodo eum quo nisi et #vfkfy 958 #ulqnlfbn,0,0.0,0.0,Unknown,Unknown,Unknown,Unknown
_bot_fixed_20_mention_n_random_3,16/09/2015 06:42:20,esse fugiat et consectetur Quis voluptate,0,0.0,0.0,Unknown,Unknown,Unknown,Unknown
_bot_fixed_20_mention_n_random_3,16/09/2015 05:29:20,@jtccybvwugc amet aliqua pariatur dolor quo sed #pubbtlad 202 #hnlcqyo,0,0.0,0.0,Unknown,Unknown,Unknown,Unknown
_bot_fixed_20_mention_n_random_3,16/09/2015 04:16:20,@vtvlqknxf nisi Duis cupidatat proident fugiat ad Quis incididunt quo #sxmkb 795 #pyqllm,0,0.0,0.0,Unknown,Unknown,Unknown,Unknown
_bot_fixed_20_mention_n_random_3,16/09/2015 03:03:20,cillum sint est magna pariatur dolorem voluptate,0,0.0,0.0,Unknown,Unknown,Unknown,Unknown
_bot_fixed_20_mention_n_random_3,16/09/2015 01:50:20,autem tempor quo aliquid Excepteur Excepteur,0,0.0,0.0,Unknown,Unknown,Unknown,Unknown
_bot_fixed_20_mention_n_random_3,16/09/2015 00:37:20,voluptate officia autem id do laborum ipsum ut fugiat in esse,0,0.0,0.0,Unknown,Unknown,Unknown,Unknown
_bot_fixed_20_mention_n_random_3,15/09/2015 23:24:20,proident laborum fugiat Lorem sint ut,0,0.0,0.0,Unknown,Unknown,Unknown,Unknown
_bot_fixed_20_mention_n_random_3,15/09/2015 22:11:20,sunt eu proident adipiscing illum vel,0,0.0,0.0,Unknown,Unknown,Unknown,Unknown
_bot_fixed_20_mention_n_random_3,15/09/2015 20:58:20,@oatvnedeq qui tempor consequat reprehenderit dolor est sunt ad dolore #ekuava 370 #aiyyv,0,0.0,0.0,Unknown,Unknown,Unknown,Unknown
