_bot_fixed_10_n_5,07/07/2014 03:54:50,Excepteur do consequat qui sed nihil in in qui anim deserunt ea 981,0,0.0,0.0,Unknown,Unknown,Unknown,Unknown,Unknown
_bot_fixed_10_n_5,06/07/2014 16:56:50,eum tempor cillum consequat consequat sunt amet aliqua est mollit ut officia 57,0,0.0,0.0,Unknown,Unknown,Unknown,Unknown,Unknown
_bot_fixed_10_n_5,06/07/2014 05:58:50,pariatur ex proident minim eum culpa 560,0,0.0,0.0,Unknown,Unknown,Unknown,Unknown,Unknown
_bot_fixed_10_n_5,05/07/2014 19:00:50,id cillum ipsum labore sunt culpa eu eu est minim adipiscing voluptate 407,0,0.0,0.0,Unknown,Unknown,Unknown,Unknown,Unknown
_bot_fixed_10_n_5,05/07/2014 08:02:50,id eiusmod esse sint dolore dolore consequatur sint ut eum consequat voluptate 513,0,0.0,0.0,Unknown,Unknown,Unknown,Unknown,Unknown
_bot_fixed_10_n_5,04/07/2014 21:04:50,non ea amet enim cupidatat laborum aliqua nulla consectetur dolorem reprehenderit 563,0,0.0,0.0,Unknown,Unknown,Unknown,Unknown,Unknown
_bot_fixed_10_n_5,04/07/2014 10:06:50,molestiae pariatur commodi nisi sit autem 435,0,0.0,0.0,Unknown,Unknown,Unknown,Unknown,Unknown
_bot_fixed_10_n_5,03/07/2014 23:08:50,ea consequat in iure sint et occaecat exercitation voluptate Duis iure culpa 469,0,0.0,0.0,Unknown,Unknown,Unknown,Unknown,Unknown
_bot_fixed_10_n_5,03/07/2014 12:10:50,ut adipiscing qui cupidatat dolore Excepteur eu nulla 753,0,0.0,0.0,Unknown,Unknown,Unknown,Unknown,Unknown
_bot_fixed_10_n_5,03/07/2014 01:12:50,qui culpa incididunt exercitation officia mollit sed qui et reprehenderit minim 358,0,0.0,0.0,Unknown,Unknown,Unknown,Unknown,Unknown
_bot_fixed_10_n_5,02/07/2014 14:14:50,do Duis fugiat ut ut autem adipiscing aliqua aliqua nisi 491,0,0.0,0.0,Unknown,Unknown,Unknown,Unknown,Unknown
_bot_fixed_10_n_5,02/07/2014 03:16:50,quis eu Ut laboris ea in ut ut ea 663,0,0.0,0.0,Unknown,Unknown,Unknown,Unknown,Unknown
_bot_fixed_10_n_5,01/07/2014 16:18:50,deserunt irure dolorem nulla laboris consectetur commodi esse 758,0,0.0,0.0,Unknown,Unknown,Unknown,Unknown,Unknown
_bot_fixed_10_n_5,01/07/2014 05:20:50,nostrud dolor commodi dolor voluptate Lorem dolorem eiusmod 325,0,0.0,0.0,Unknown,Unknown,Unknown,Unknown,Unknown
_bot_fixed_10_n_5,30/06/2014 18:22:50,minim laboris in Excepteur in anim quis eum nisi quo pariatur dolor 910,0,0.0,0.0,Unknown,Unknown,Unknown,Unknown,Unknown
_bot_fixed_10_n_5,30/06/2014 07:24:50,molestiae est reprehenderit magna elit consequatur 511,0,0.0,0.0,Unknown,Unknown,Unknown,Unknown,Unknown
_bot_fixed_10_n_5,29/06/2014 20:26:50,pariatur autem iure iure enim non reprehenderit ea quis anim sunt 470,0,0.0,0.0,Unknown,Unknown,Unknown,Unknown,Unknown
_bot_fixed_10_n_5,29/06/2014 09:28:50,voluptate nisi ut mollit quis aliquid 192,0,0.0,0.0,Unknown,Unknown,Unknown,Unknown,Unknown
_bot_fixed_10_n_5,28/06/2014 22:30:50,ullamco ut et sint aliqua qui aute anim incididunt esse eum 427,0,0.0,0.0,Unknown,Unknown,Unknown,Unknown,Unknown
_bot_fixed_10_n_5,28/06/2014 11:32:50,sint ea eum ut dolor eum mollit tempor ullamco 379,0,0.0,0.0,Unknown,Unknown,Unknown,Unknown,Unknown
_bot_fixed_10_n_5,28/06/2014 00:34:50,sunt in ut illum sint voluptate occaecat iure qui 459,0,0.0,0.0,Unknown,Unknown,Unknown,Unknown,Unknown
_bot_fixed_10_n_5,27/06/2014 13:36:50,Lorem non laboris fugiat est eum molestiae esse fugiat quam non 624,0,0.0,0.0,Unknown,Unknown,Unknown,Unknown,Unknown
_bot_fixed_10_n_5,27/06/2014 02:38:50,proident laboris enim ad qui in consequat nisi Lorem qui pariatur 648,0,0.0,0.0,Unknown,Unknown,Unknown,Unknown,Unknown
_bot_fixed_10_n_5,26/06/2014 15:40:50,dolore commodo et nostrud qui qui Excepteur 548,0,0.0,0.0,Unknown,Unknown,Unknown,Unknown,Unknown
_bot_fixed_10_n_5,26/06/2014 04:42:50,nisi Excepteur eum qui irure occaecat velit 602,0,0.0,0.0,Unknown,Unknown,Unknown,Unknown,Unknown
_bot_fixed_10_n_5,25/06/2014 17:44:50,Quis consequat ipsum sit in vel sint quo dolore dolor 611,0,0.0,0.0,Unknown,Unknown,Unknown,Unknown,Unknown
