_bot_20_n_2,16/09/2015 05:23:58,eum ea reprehenderit qui consequatur aliqua pariatur nulla quis 933,0,0.0,0.0,Unknown,Unknown,Unknown,Unknown
_bot_20_n_2,15/09/2015 23:47:58,sed in elit minim cillum commodo dolorem velit ea voluptate 429,0,0.0,0.0,Unknown,Unknown,Unknown,Unknown
_bot_20_n_2,15/09/2015 12:09:58,velit nisi Lorem amet laborum qui 372,0,0.0,0.0,Unknown,Unknown,Unknown,Unknown
_bot_20_n_2,14/09/2015 22:43:58,nulla velit nostrud in pariatur elit adipiscing reprehenderit magna ullamco qui 653,0,0.0,0.0,Unknown,Unknown,Unknown,Unknown
_bot_20_n_2,14/09/2015 10:29:58,reprehenderit ipsum Lorem esse laboris ea 704,0,0.0,0.0,Unknown,Unknown,Unknown,Unknown
_bot_20_n_2,13/09/2015 21:43:58,veniam cillum dolore iure ea nihil aliquid elit 389,0,0.0,0.0,Unknown,Unknown,Unknown,Unknown
_bot_20_n_2,13/09/2015 21:10:58,adipiscing ea adipiscing illum occaecat fugiat dolore non anim ullamco ad Duis 202,0,0.0,0.0,Unknown,Unknown,Unknown,Unknown
_bot_20_n_2,13/09/2015 19:59:58,eu deserunt ea nihil sit id magna pariatur nisi 588,0,0.0,0.0,Unknown,Unknown,Unknown,Unknown
_bot_20_n_2,13/09/2015 09:42:58,eum qui commodi proident quam do autem ad ut dolor 114,0,0.0,0.0,Unknown,Unknown,Unknown,Unknown
_bot_20_n_2,13/09/2015 09:27:58,aute Lorem dolore est commodi illum irure 133,0,0.0,0.0,Unknown,Unknown,Unknown,Unknown
