_bot_10_n_5,28/04/2015 10:21:07,consequat dolor ea incididunt voluptas velit ea 590,0,0.0,0.0,Unknown,Unknown,Unknown,Unknown
_bot_10_n_5,28/04/2015 07:00:07,incididunt exercitation aute veniam occaecat aliquid dolore in quo minim dolorem 949,0,0.0,0.0,Unknown,Unknown,Unknown,Unknown
_bot_10_n_5,28/04/2015 04:24:07,ullamco dolorem ad nihil qui dolorem Duis ipsum dolor deserunt 644,0,0.0,0.0,Unknown,Unknown,Unknown,Unknown
_bot_10_n_5,28/04/2015 03:16:07,iure molestiae ex quo ex Excepteur commodo 870,0,0.0,0.0,Unknown,Unknown,Unknown,Unknown
_bot_10_n_5,28/04/2015 00:11:07,nisi Excepteur quis Excepteur consequatur qui commodo magna magna adipiscing iure proident 792,0,0.0,0.0,Unknown,Unknown,Unknown,Unknown
_bot_10_n_5,27/04/2015 23:12:07,Ut occaecat irure aliquid labore ullamco nulla non Ut commodo sint quo 555,0,0.0,0.0,Unknown,Unknown,Unknown,Unknown
_bot_10_n_5,27/04/2015 23:06:07,nostrud consequat anim commodo nisi autem amet qui eu quis 173,0,0.0,0.0,Unknown,Unknown,Unknown,Unknown
_bot_10_n_5,27/04/2015 22:57:07,in in velit commodi Lorem illum ex elit in consequatur 791,0,0.0,0.0,Unknown,Unknown,Unknown,Unknown
